rel=cannonical	title
http://www.oac.cdlib.org/findaid/ark:/13030/tf596nb46b	Aiken (Conrad). “Sixth voice from Punch”
http://www.oac.cdlib.org/findaid/ark:/13030/kt458034sj	Aiken (William Ross) Papers 1944-2007
http://www.oac.cdlib.org/findaid/ark:/13030/kt700034z9	Aikin (Wilford Merton) papers
http://www.oac.cdlib.org/findaid/ark:/13030/kt5c6036jh	Ain (Gregory) papers
http://www.oac.cdlib.org/findaid/ark:/13030/tf2d5n997j	Ainge (Fern A. Proudfoot) Collection
http://www.oac.cdlib.org/findaid/ark:/13030/ft1199n436	Ainslie (Douglas) Letters
http://www.oac.cdlib.org/findaid/ark:/13030/tf5w1006r6	Ainsworth (Ed) Papers
http://www.oac.cdlib.org/findaid/ark:/13030/kt3199q09v	Ainsworth (Katherine) Papers
http://www.oac.cdlib.org/findaid/ark:/13030/c8q81dp3	Ainsworth (Robert Henry) papers relating to the Ward Kimball house
http://www.oac.cdlib.org/findaid/ark:/13030/kt0v19p971	Aintabi (Sami A.) Collection of Arabic Manuscripts
http://www.oac.cdlib.org/findaid/ark:/13030/tf8199n94x	Air Force Reserve Officer Training Corps (AFROTC) Records
http://www.oac.cdlib.org/findaid/ark:/13030/kt2h4nf3j3	Air France Menu Special Collection
http://www.oac.cdlib.org/findaid/ark:/13030/c8mg7r0p	Air Mail clippings scrapbook
http://www.oac.cdlib.org/findaid/ark:/13030/kt9h4nc2kd	Air Pollution - Collection of Material
http://www.oac.cdlib.org/findaid/ark:/13030/tf7f59n8kg	Air Resources Board Records
http://www.oac.cdlib.org/findaid/ark:/13030/c8m32wck	Airwaves (Charlie) Los Angeles Christopher Street West Gay Pride Parade Photographs
http://www.oac.cdlib.org/findaid/ark:/13030/kt8m3nf56d	Aitchison (Bruce) mimeograph
http://www.oac.cdlib.org/findaid/ark:/13030/kt0z09r2f9	"Akademiia nauk SSSR, Sibirskoe otdeleniie miscellaneous records"
http://www.oac.cdlib.org/findaid/ark:/13030/kt767nf193	"Akaemov, Nikolai holograph"
http://www.oac.cdlib.org/findaid/ark:/13030/tf687007jz	Akahori Family papers
http://www.oac.cdlib.org/findaid/ark:/13030/kt6000342j	Akbar (Said Hyder) sound recordings
http://www.oac.cdlib.org/findaid/ark:/13030/c8rn36st	Akeley (Kurt) Papers
http://www.oac.cdlib.org/findaid/ark:/13030/kt5h4nf28d	Akhmedov (F.) translation
http://www.oac.cdlib.org/findaid/ark:/13030/kt4j49r9br	Akin (David) Audiorecordings
http://www.oac.cdlib.org/findaid/ark:/13030/kt409nf3wm	Akins (Samuel B.) Papers
http://www.oac.cdlib.org/findaid/ark:/13030/c8h132ss	Akins (Zoë) Papers
http://www.oac.cdlib.org/findaid/ark:/13030/ft2q2nb05z	Akins (Zoe) Papers
http://www.oac.cdlib.org/findaid/ark:/13030/kt5000372p	Akintievskii (Konstantin Konstantinovich) memoirs
http://www.oac.cdlib.org/findaid/ark:/13030/kt000030r3	Akselrod (Yulia) papers
http://www.oac.cdlib.org/findaid/ark:/13030/tf9g50072z	Alabados (religious songs)
http://www.oac.cdlib.org/findaid/ark:/13030/kt9t1nc9wd	Aladdin Stereographs: Japan and Russia
http://www.oac.cdlib.org/findaid/ark:/13030/kt6t1nf0jv	Alai (Hussein) writings
http://www.oac.cdlib.org/findaid/ark:/13030/c8rv0q7s	Alamagordo and Sacramento Mountain Railway Records
http://www.oac.cdlib.org/findaid/ark:/13030/tf0290007r	Alameda City Schools Radio Scripts
http://www.oac.cdlib.org/findaid/ark:/13030/tf9m3nb71d	Alameda Contra Costa Medical Society Records
http://www.oac.cdlib.org/findaid/ark:/13030/tf1z09n955	"Alameda County, California, ca. 1913 - Views"
http://www.oac.cdlib.org/findaid/ark:/13030/tf7c60065r	Alameda County Land Papers
http://www.oac.cdlib.org/findaid/ark:/13030/c8rb73jv	Alameda County Library California literature research project records
http://www.oac.cdlib.org/findaid/ark:/13030/ft167n9937	Alameda County Tobacco Control Program Records
http://www.oac.cdlib.org/findaid/ark:/13030/c81n82m9	Alamo and the Daughters of the Republic of Texas Collection
http://www.oac.cdlib.org/findaid/ark:/13030/kt1z09r85c	Alan Adler and the Aerobie collection
http://www.oac.cdlib.org/findaid/ark:/13030/c8qv3k7z	Alan Peters oral history interview
http://www.oac.cdlib.org/findaid/ark:/13030/tf7z09p28n	Alaska Commercial Company Records
http://www.oac.cdlib.org/findaid/ark:/13030/tf8d5nb390	Alaska Commercial Company Records
http://www.oac.cdlib.org/findaid/ark:/13030/c88s4rb1	Alaska fishing and fishermen photographs
http://www.oac.cdlib.org/findaid/ark:/13030/tf5s200558	Alaska Indians of Yukutat Bay
http://www.oac.cdlib.org/findaid/ark:/13030/c8x34znj	Alaska Packers Association Logbooks
http://www.oac.cdlib.org/findaid/ark:/13030/c8dj5dmp	"Alaska, Photograph Album of the Cruise of the Revenue Cutter ""Corwin,"" 1883"
http://www.oac.cdlib.org/findaid/ark:/13030/kt0b69r812	Alaska Photograph Collection
http://www.oac.cdlib.org/findaid/ark:/13030/c8q23z64	"Alaska, Photograph Collection of the Revenue Cutters ""Bear"" and ""Corwin,"" 1880s"
http://www.oac.cdlib.org/findaid/ark:/13030/tf7489p4bd	"Alaska to Mexico, ca. 1859-1902 - Stereoviews"
http://www.oac.cdlib.org/findaid/ark:/13030/tf700005r0	Alaskan Scenery - Photographs
http://www.oac.cdlib.org/findaid/ark:/13030/kt3b69r4qd	Albanian subject collection
http://www.oac.cdlib.org/findaid/ark:/13030/kt038nd5x2	Albano (Antonio) legal motion
http://www.oac.cdlib.org/findaid/ark:/13030/kt1r29p4qh	Albany Library Historical Photograph Collection
http://www.oac.cdlib.org/findaid/ark:/13030/kt800033r1	Albee Directs Albee Collection
http://www.oac.cdlib.org/findaid/ark:/13030/tf4n39n7br	Albee (George S.) Papers
http://www.oac.cdlib.org/findaid/ark:/13030/kt3p303896	Albemarle Hotel Register
http://www.oac.cdlib.org/findaid/ark:/13030/kt8q2nc6mv	"Albert and Charles Boni, Inc. records"
http://www.oac.cdlib.org/findaid/ark:/13030/c8gq70vz	Albert (Eddie) papers
http://www.oac.cdlib.org/findaid/ark:/13030/kt267nd71v	Albert (Steve) papers
http://www.oac.cdlib.org/findaid/ark:/13030/kt5f59s13c	Albert Zugsmith papers
http://www.oac.cdlib.org/findaid/ark:/13030/kt167nd75m	Alberti (Clark and Nellie) Family Papers
http://www.oac.cdlib.org/findaid/ark:/13030/kt696nc8n3	Albertini (Georges) Papers
http://www.oac.cdlib.org/findaid/ark:/13030/tf5f59n7sg	Alberto F. Porta Papers
http://www.oac.cdlib.org/findaid/ark:/13030/tf6q2nb557	Alberts (Bruce M.) Papers
http://www.oac.cdlib.org/findaid/ark:/13030/c8kh0kpz	Albertson (Earnest) papers
http://www.oac.cdlib.org/findaid/ark:/13030/kt3g5032dj	Albertson (Jack) Papers
http://www.oac.cdlib.org/findaid/ark:/13030/kt5j49q6pb	Albertype Co. Souvenir Viewbooks
http://www.oac.cdlib.org/findaid/ark:/13030/tf796nb21d	Albrecht (Frank M.) Papers
http://www.oac.cdlib.org/findaid/ark:/13030/kt3k403174	Albrecht (Ralph G.) papers
http://www.oac.cdlib.org/findaid/ark:/13030/kt6z09s1tt	Albrecht (Richard) papers
http://www.oac.cdlib.org/findaid/ark:/13030/c8ft8ns1	Albrier (Frances) Papers
http://www.oac.cdlib.org/findaid/ark:/13030/tf7w1008jp	Albright (Horace M.) papers
http://www.oac.cdlib.org/findaid/ark:/13030/c8c24x60	"Album of California Mission Photographs, ca. 1950"
http://www.oac.cdlib.org/findaid/ark:/13030/tf9v19p0wz	Album of Pacific Northwest and California Views
http://www.oac.cdlib.org/findaid/ark:/13030/tf8p3006q9	"Album Palaeographicum, 1285-1629"
http://www.oac.cdlib.org/findaid/ark:/13030/tf2h4n998q	"Album Souvenir of St. Matthews School, San Mateo, Cal."
http://www.oac.cdlib.org/findaid/ark:/13030/c84x565p	Alcatraz Indian Occupation Records
http://www.oac.cdlib.org/findaid/ark:/13030/tf038n96xv	Alcohol and Drug Programs Dept. Records
http://www.oac.cdlib.org/findaid/ark:/13030/tf3x0n99f7	Alcoholic Beverage Control Dept. Records
http://www.oac.cdlib.org/findaid/ark:/13030/kt996nf447	Alcoholics Together Records
http://www.oac.cdlib.org/findaid/ark:/13030/c81r6rb8	"Alden (Alice W.) Collection, late 19th c."
http://www.oac.cdlib.org/findaid/ark:/13030/kt2j49r8dp	Alden (Raymond Macdonald) Papers
http://www.oac.cdlib.org/findaid/ark:/13030/tf000000vz	Alders Duck Sales Record Books
http://www.oac.cdlib.org/findaid/ark:/13030/tf0n39n4fm	"Aldine Manuscripts, 1871-1906"
http://www.oac.cdlib.org/findaid/ark:/13030/c8c53n6b	Aldrich (Elmer C.) papers
http://www.oac.cdlib.org/findaid/ark:/13030/kt7c6036g3	Aldrich (Mildred) letters
http://www.oac.cdlib.org/findaid/ark:/13030/tf0n39n52d	Aldrich (Philip) Archives [graphic]
http://www.oac.cdlib.org/findaid/ark:/13030/c88c9vjq	Aldrich (Robert G.) logbook and correspondence
http://www.oac.cdlib.org/findaid/ark:/13030/kt8489r7jh	Aldrovandi Marescotti (Luigi) typescript
http://www.oac.cdlib.org/findaid/ark:/13030/tf496nb042	Alegria (Fernando) papers
http://www.oac.cdlib.org/findaid/ark:/13030/kt1k40113j	Aleksandr Sergeevich Pushkin Subject Collection
http://www.oac.cdlib.org/findaid/ark:/13030/kt4t1nf1rt	Aleksandra Iosifovna letters
http://www.oac.cdlib.org/findaid/ark:/13030/tf5p300496	Alekseev (Mikhail V.) Papers
http://www.oac.cdlib.org/findaid/ark:/13030/kt000030cd	Alekseev (Vasilii Ivanovich) Papers
http://www.oac.cdlib.org/findaid/ark:/13030/c8zc81mh	"Alemany, (Joseph Sadoc) Papers"
http://www.oac.cdlib.org/findaid/ark:/13030/kt1489r4gv	Aleppo news-letter
http://www.oac.cdlib.org/findaid/ark:/13030/kt1n39q0h8	Alexander (Alec P.) Papers
http://www.oac.cdlib.org/findaid/ark:/13030/tf200002jw	Alexander (Annie M.) Papers
http://www.oac.cdlib.org/findaid/ark:/13030/tf80000692	Alexander (Annie Montague) Papers
http://www.oac.cdlib.org/findaid/ark:/13030/tf729005ff	Alexander Family Papers
http://www.oac.cdlib.org/findaid/ark:/13030/kt9w1037h0	Alexander (Hartley Burr) Collection of American Indian Artwork
http://www.oac.cdlib.org/findaid/ark:/13030/kt2q2nc6kg	Alexander (Hartley Burr) Papers
http://www.oac.cdlib.org/findaid/ark:/13030/kt4489q974	Alexander (Hartley Burr) Projects Collection
http://www.oac.cdlib.org/findaid/ark:/13030/kt5199s04s	"Alexander II, Emperor of Russia, decree"
http://www.oac.cdlib.org/findaid/ark:/13030/tf5f59p0qh	"Alexander (Jeff) Television, Radio, and Motion Picture Music collection"
http://www.oac.cdlib.org/findaid/ark:/13030/c8cz37rg	Alexander (Jesse) papers
http://www.oac.cdlib.org/findaid/ark:/13030/c8zk5jdz	Alexander (Red) Oral History
http://www.oac.cdlib.org/findaid/ark:/13030/kt5s20367g	"Alexander (Samuel J.) Correspondence, 1895-1902"
http://www.oac.cdlib.org/findaid/ark:/13030/c8hq40g6	Alexander (William Levy) papers
http://www.oac.cdlib.org/findaid/ark:/13030/kt4v19r92k	Alexander (Yonah) papers
http://www.oac.cdlib.org/findaid/ark:/13030/kt0m3nd4d3	Alexandra (Mother) papers
http://www.oac.cdlib.org/findaid/ark:/13030/kt5r29r8t4	"Alexandra, Queen, consort of Edward VII, King of Great Britain photograph album"
http://www.oac.cdlib.org/findaid/ark:/13030/kt1x0nd6db	Alexandra Township collection
http://www.oac.cdlib.org/findaid/ark:/13030/kt567nd7rn	Alexeef (Victor V.) papers
http://www.oac.cdlib.org/findaid/ark:/13030/kt0d5nf3f8	Alfonte (James) Special Collection
http://www.oac.cdlib.org/findaid/ark:/13030/kt0n39r3d9	Alfred (Dennis) scripts
http://www.oac.cdlib.org/findaid/ark:/13030/kt0w10244m	Alfred (Randy) Subject Files and Sound Recordings
http://www.oac.cdlib.org/findaid/ark:/13030/tf2d5nb1wz	Alfven (Hannes) Papers
http://www.oac.cdlib.org/findaid/ark:/13030/tf7j49n9t7	Alger (Lulu) Scrapbook of Opera News
http://www.oac.cdlib.org/findaid/ark:/13030/kt9f59r2wj	Algeranoff (Harcourt) Photograph Album.
http://www.oac.cdlib.org/findaid/ark:/13030/kt038nc3hf	Algeria Photograph Album
http://www.oac.cdlib.org/findaid/ark:/13030/kt3m3nc41w	Algeria Photograph Collection
http://www.oac.cdlib.org/findaid/ark:/13030/kt4c6033vd	Algerian subject collection
http://www.oac.cdlib.org/findaid/ark:/13030/c879458z	"Alhambra High School Yearbook, 1978"
http://www.oac.cdlib.org/findaid/ark:/13030/c8kh0pnr	Alice Madeleine Laborde Papers
http://www.oac.cdlib.org/findaid/ark:/13030/kt0k40349p	"Alien Enemy Registration Affidavits, 1918"
http://www.oac.cdlib.org/findaid/ark:/13030/kt4n39s1xs	Alien Nation television scripts (Collection of)
http://www.oac.cdlib.org/findaid/ark:/13030/kt638nf0rc	Alien Registration Materials
http://www.oac.cdlib.org/findaid/ark:/13030/c8fx77w2	Alimanestianu (Dinu) papers
http://www.oac.cdlib.org/findaid/ark:/13030/kt9g5036nz	Alinsky (Jean Graham) papers
http://www.oac.cdlib.org/findaid/ark:/13030/ft6t1nb4s3	Alioto (Joseph L.) Papers?
http://www.oac.cdlib.org/findaid/ark:/13030/kt2g50314m	Alioto (Robert F.) miscellaneous papers
http://www.oac.cdlib.org/findaid/ark:/13030/kt2779r6xh	Alkon (Paul K.) papers
http://www.oac.cdlib.org/findaid/ark:/13030/kt8p303913	All Nations Church and Foundation photographs
http://www.oac.cdlib.org/findaid/ark:/13030/kt5580387h	All Nations Church and Foundation records
http://www.oac.cdlib.org/findaid/ark:/13030/c8513zsf	"All States Picnic, Inc. Collection"
http://www.oac.cdlib.org/findaid/ark:/13030/kt4p3033c4	All World Hebrew Central Organization records
http://www.oac.cdlib.org/findaid/ark:/13030/kt6489r6pg	Allan (Edwin Chester) papers
http://www.oac.cdlib.org/findaid/ark:/13030/c8fj2g3z	Allan Hancock Foundation Archive
http://www.oac.cdlib.org/findaid/ark:/13030/kt5489p5q9	Allan (Maud) Papers
http://www.oac.cdlib.org/findaid/ark:/13030/c81z4576	"Allard Arms Album, ca. 1900"
http://www.oac.cdlib.org/findaid/ark:/13030/c8fn16rt	Allard (Gladys Stanley) Collection
http://www.oac.cdlib.org/findaid/ark:/13030/kt958038mf	Allard (Lillian I.) collection of California postcards
http://www.oac.cdlib.org/findaid/ark:/13030/kt6000265m	Allderdice (Norman) Collection
http://www.oac.cdlib.org/findaid/ark:/13030/kt4h4nc6d6	Allen (Alden L.) Japan Notebook
http://www.oac.cdlib.org/findaid/ark:/13030/c8cc122t	Allen (Amelia S.) field notes
http://www.oac.cdlib.org/findaid/ark:/13030/kt92903098	Allen and Lewis costume sketches
http://www.oac.cdlib.org/findaid/ark:/13030/tf9b69p03s	Allen (Benjamin S.) Papers
http://www.oac.cdlib.org/findaid/ark:/13030/kt2489p4d7	Allen (Bennet M.) Papers
http://www.oac.cdlib.org/findaid/ark:/13030/kt467nf3c5	Allen Controversy Papers
http://www.oac.cdlib.org/findaid/ark:/13030/kt1n39r4t9	Allen Dairy Collection
http://www.oac.cdlib.org/findaid/ark:/13030/tf9x0nb72w	Allen (Donald) Collection
http://www.oac.cdlib.org/findaid/ark:/13030/c82j6cgr	Allen (Doris) Papers
http://www.oac.cdlib.org/findaid/ark:/13030/kt096nd0cp	Allen Family Collection of Kennedy-Johnson Inaugural Ephemera
http://www.oac.cdlib.org/findaid/ark:/13030/kt7870369v	Allen Family Papers
http://www.oac.cdlib.org/findaid/ark:/13030/c8nz89b9	Allen (Gene) papers
http://www.oac.cdlib.org/findaid/ark:/13030/kt7c6005hs	Allen (Henry W.) Papers
http://www.oac.cdlib.org/findaid/ark:/13030/kt038nd6t0	Allen (Hollis P.) Collection of Japanese-Philippine materials
http://www.oac.cdlib.org/findaid/ark:/13030/kt2290313g	Allen (Hollis P.) papers
http://www.oac.cdlib.org/findaid/ark:/13030/tf1m3nb03k	Allen (Irwin) Papers
http://www.oac.cdlib.org/findaid/ark:/13030/tf687005kh	Allen (J. A.) Papers
http://www.oac.cdlib.org/findaid/ark:/13030/tf9199p0n3	Allen (James T.) Papers
http://www.oac.cdlib.org/findaid/ark:/13030/kt0k40015t	Allen (John H.) Papers
http://www.oac.cdlib.org/findaid/ark:/13030/c8wh2r7r	Allen (Mariette Pathy) Collection
http://www.oac.cdlib.org/findaid/ark:/13030/kt3n39r4z0	Allen (Niel R.) papers
http://www.oac.cdlib.org/findaid/ark:/13030/kt2b69r8dc	Allen (Peter C.) Collection Documenting Student Demonstrations at Stanford
http://www.oac.cdlib.org/findaid/ark:/13030/kt696nf2n3	Allen (Richard V.) papers
http://www.oac.cdlib.org/findaid/ark:/13030/kt0m3nd4ck	Allen (Ronald) letter
http://www.oac.cdlib.org/findaid/ark:/13030/kt1d5nd7h3	Allen (Steve) photographs of Fairchild Semiconductor
http://www.oac.cdlib.org/findaid/ark:/13030/kt8b69r8fr	Allen (Theophilus) letter
http://www.oac.cdlib.org/findaid/ark:/13030/c80k294n	Allen (W. G.) Vladivostok [Russia] Collection
http://www.oac.cdlib.org/findaid/ark:/13030/kt2c60348g	"Allen (Walter C.) Papers, 1943-1944"
http://www.oac.cdlib.org/findaid/ark:/13030/kt438nf4rp	Allen (Warren Dwight) Papers
http://www.oac.cdlib.org/findaid/ark:/13030/kt2g5034nt	Allen's Cheyenne Minstrels Collection
http://www.oac.cdlib.org/findaid/ark:/13030/c8cz399g	Alles (Gordon) Papers
http://www.oac.cdlib.org/findaid/ark:/13030/kt200033m3	Allewelt (William F.) Papers
http://www.oac.cdlib.org/findaid/ark:/13030/kt4z09r0d2	Alley (Harry) Collection
http://www.oac.cdlib.org/findaid/ark:/13030/kt1s203038	Allgemeine Zeitung clippings
http://www.oac.cdlib.org/findaid/ark:/13030/c89s1rtg	Alliance for Gay and Lesbian Artists (AGLA) records
http://www.oac.cdlib.org/findaid/ark:/13030/tf6r29n87z	Allied and Associated Powers (1914-1920) Inter-Allied Food Council Records
http://www.oac.cdlib.org/findaid/ark:/13030/kt0199r28t	Allied and Associated Powers Treaties
http://www.oac.cdlib.org/findaid/ark:/13030/kt5870193p	Allied Architects Assn. of Los Angeles Records
http://www.oac.cdlib.org/findaid/ark:/13030/kt467nf3zz	Allied Craftsmen of San Diego Records
http://www.oac.cdlib.org/findaid/ark:/13030/kt0p3032z6	Allied Forces. South West Pacific Area. Allied Geographical Section printed material
http://www.oac.cdlib.org/findaid/ark:/13030/kt0t1nd8ct	Allied Forces. Supreme Headquarters. Psychological Warfare Division. Austrian Radio Section propaganda
http://www.oac.cdlib.org/findaid/ark:/13030/kt296nd9j7	Allied Forces. Supreme Headquarters. Psychological Warfare Division letter
http://www.oac.cdlib.org/findaid/ark:/13030/tf8g5006ct	Allin Brothers Field Books Collection
http://www.oac.cdlib.org/findaid/ark:/13030/c8mw2hqf	Allison and Allison drawings of the Mr. and Mrs. Carl von Bibra residence
http://www.oac.cdlib.org/findaid/ark:/13030/tf5j49n7jh	Allman (Norwood F.) Papers
http://www.oac.cdlib.org/findaid/ark:/13030/kt2d5nd228	Alloo (Modeste) Collection
http://www.oac.cdlib.org/findaid/ark:/13030/tf6g5004jt	Allyne (John W.) Business Papers
http://www.oac.cdlib.org/findaid/ark:/13030/kt109nf0vq	Almack (John C.) Papers
http://www.oac.cdlib.org/findaid/ark:/13030/c8r49sfg	Almaraz (Carlos) and Los Four Ephemera Collection
http://www.oac.cdlib.org/findaid/ark:/13030/kt8w10392x	"Almond (Dorothea K.), ""Cooperative childcare at Stanford"""
http://www.oac.cdlib.org/findaid/ark:/13030/kt1k4035ch	Almond (Dorothea K.) Papers
http://www.oac.cdlib.org/findaid/ark:/13030/kt6489s0w4	Almond (Gabriel A.) Papers
http://www.oac.cdlib.org/findaid/ark:/13030/kt5g5032sv	Almond (Nina) and Ralph Haswell Lutz collection
http://www.oac.cdlib.org/findaid/ark:/13030/kt1x0nd6ct	Alpert (Deirdre) Papers
http://www.oac.cdlib.org/findaid/ark:/13030/kt7199s19g	"Alpha Kappa Lambda Fraternity, Beta Chapter, Records"
http://www.oac.cdlib.org/findaid/ark:/13030/kt6k4039bg	"Alpha Mu Fraternity, Beta Chapter Records"
http://www.oac.cdlib.org/findaid/ark:/13030/tf9t1nb53s	Alpha Mu Records
http://www.oac.cdlib.org/findaid/ark:/13030/tf609nb46p	"Alpha Omega Club (Stockton, Calif.) Records"
http://www.oac.cdlib.org/findaid/ark:/13030/kt1k4035fj	"Alpha Phi Omega, Zeta Chapter, Records"
http://www.oac.cdlib.org/findaid/ark:/13030/kt3x0nf03v	Alpha Pi Boulé Records
http://www.oac.cdlib.org/findaid/ark:/13030/kt138nf360	Alpha Tau Omega Records
http://www.oac.cdlib.org/findaid/ark:/13030/c8hm56th	Alpine Library Association Records
http://www.oac.cdlib.org/findaid/ark:/13030/kt3j49r6km	Alquist (Alfred E.) Papers
http://www.oac.cdlib.org/findaid/ark:/13030/kt3m3nf1fj	Alsberg (Carl) Eastern Asia Interview Notes
http://www.oac.cdlib.org/findaid/ark:/13030/kt996nf688	Alsberg (Henry Garfield) typescript
http://www.oac.cdlib.org/findaid/ark:/13030/tf1h4n982t	Altengrabow (Germany : Prison Camp) Newspaper Issues
http://www.oac.cdlib.org/findaid/ark:/13030/kt5b69r6mf	Alter (Arthur S.) collection
http://www.oac.cdlib.org/findaid/ark:/13030/kt638nd4dp	Alternative Comic Book Collection
http://www.oac.cdlib.org/findaid/ark:/13030/ft400003nx	Alternative Press Collection
http://www.oac.cdlib.org/findaid/ark:/13030/kt7n39q43v	Altman (George) Papers
http://www.oac.cdlib.org/findaid/ark:/13030/tf0199n771	Altman (Harold N.) Sacramento History Papers
http://www.oac.cdlib.org/findaid/ark:/13030/tf5v19n8gx	Altman (Ludwig) Papers
http://www.oac.cdlib.org/findaid/ark:/13030/kt1t1nd6f6	Altmeyer (Walter) papers
http://www.oac.cdlib.org/findaid/ark:/13030/tf296nb1r7	Altrocchi (Julia C.) Poetry Collection
http://www.oac.cdlib.org/findaid/ark:/13030/k6td9v7w	Altrocchi (Julia Cooley) papers
http://www.oac.cdlib.org/findaid/ark:/13030/tf8p3006c4	Altrocchi (Rudolph) Papers
http://www.oac.cdlib.org/findaid/ark:/13030/kt8d5nc7x1	Aluminum Company of America (Alcoa) Television Scripts
http://www.oac.cdlib.org/findaid/ark:/13030/tf7290085r	Alumni Affairs Records
http://www.oac.cdlib.org/findaid/ark:/13030/c8d79csx	Alumni Association. Administrative files.
http://www.oac.cdlib.org/findaid/ark:/13030/kt6h4nf6xg	"Alumni Association Honoraria Papers (University of California, Irvine)"
http://www.oac.cdlib.org/findaid/ark:/13030/c8862hts	"Alumni Association. Minutes of meetings, financial statements, and reports."
http://www.oac.cdlib.org/findaid/ark:/13030/kt829040nk	"Alumni Association Photographs and Other Material (University of California, Irvine)"
http://www.oac.cdlib.org/findaid/ark:/13030/kt3q2nd850	Alumni Association Records
http://www.oac.cdlib.org/findaid/ark:/13030/c85m6440	Alurista Papers
http://www.oac.cdlib.org/findaid/ark:/13030/kt967nd685	Alvarez (Luis W.) Papers
http://www.oac.cdlib.org/findaid/ark:/13030/kt6199r9j6	Alvarez Montalvan (Emilio) speeches
http://www.oac.cdlib.org/findaid/ark:/13030/tf309n990m	Alverson (Margaret B.) Papers
http://www.oac.cdlib.org/findaid/ark:/13030/c89s1s21	Alvin (Joe) papers
http://www.oac.cdlib.org/findaid/ark:/13030/tf9g50077j	Alviso Family Papers: Documentos para la historia de California
http://www.oac.cdlib.org/findaid/ark:/13030/tf587004r9	Alvord (William) Papers
http://www.oac.cdlib.org/findaid/ark:/13030/kt1d5nd9f1	"Alvord (William) Papers, 1833-1904"
http://www.oac.cdlib.org/findaid/ark:/13030/kt0779q1nw	"A&amp;M Records Collection of business papers, sound recordings, music manuscripts, and memorabilia"
http://www.oac.cdlib.org/findaid/ark:/13030/c8n58nwp	Amador Branch Railroad Cash Book
http://www.oac.cdlib.org/findaid/ark:/13030/tf5c6003wj	Amador County Legal Records
http://www.oac.cdlib.org/findaid/ark:/13030/c8765cqm	Amador (Don) Papers
http://www.oac.cdlib.org/findaid/ark:/13030/c8qj7j2q	Amador Mining Company Records
http://www.oac.cdlib.org/findaid/ark:/13030/kt2j49q754	"Amador, Yorba, López, and Cota families correspondence"
http://www.oac.cdlib.org/findaid/ark:/13030/c82r3q3w	Amalgamated Printers' Association Ephemera Collection
http://www.oac.cdlib.org/findaid/ark:/13030/kt6779r6r5	"Amalgamated Transit Union, Local 192 Records"
http://www.oac.cdlib.org/findaid/ark:/13030/tf4x0nb2ss	Amateau (Rod) Papers
http://www.oac.cdlib.org/findaid/ark:/13030/kt3q2nf194	Ambassador Auditorium
http://www.oac.cdlib.org/findaid/ark:/13030/kt2r29q8v8	Amdahl (Gene M.) Papers
http://www.oac.cdlib.org/findaid/ark:/13030/c8d79c5v	"Amerasians: Media and the Arts Video Collection, 1983-1990."
http://www.oac.cdlib.org/findaid/ark:/13030/tf9s20075g	America First Committee records
http://www.oac.cdlib.org/findaid/ark:/13030/c8qz2996	"""America!"" Scrapbook, 1918-1927"
http://www.oac.cdlib.org/findaid/ark:/13030/kt196nc2qp	American Academy of Ophthalmology (Foundation) Oral History Series
http://www.oac.cdlib.org/findaid/ark:/13030/tf6g50075k	American Academy of Pain Management Records
http://www.oac.cdlib.org/findaid/ark:/13030/c8cz35kd	American Almanac Collection
http://www.oac.cdlib.org/findaid/ark:/13030/kt287037pg	American Almanacs Collection
http://www.oac.cdlib.org/findaid/ark:/13030/kt7r29r8ws	American Association for Higher Education records
http://www.oac.cdlib.org/findaid/ark:/13030/tf5m3nb16v	"American Association for the Advancement of Science, Pacific Division - Portraits"
http://www.oac.cdlib.org/findaid/ark:/13030/c8mk6fz5	American Association of Land Grant Colleges. Collection.
http://www.oac.cdlib.org/findaid/ark:/13030/tf796nb1rs	"American Association of University Professors, Fresno Chapter Records"
http://www.oac.cdlib.org/findaid/ark:/13030/c87m08r2	American Association of University Women
http://www.oac.cdlib.org/findaid/ark:/13030/tf6j49n8rd	"American Association of University Women, Pasadena, California Branch Papers"
http://www.oac.cdlib.org/findaid/ark:/13030/c8m32wrh	"American Association of University Women records, 1916-1991"
http://www.oac.cdlib.org/findaid/ark:/13030/tf5s2004n1	American authors collection
http://www.oac.cdlib.org/findaid/ark:/13030/c8f191fj	American Beekeeping Federation Records
http://www.oac.cdlib.org/findaid/ark:/13030/tf8r29n9vc	American Campaign Literature Collection
http://www.oac.cdlib.org/findaid/ark:/13030/tf8s2006nx	American Children's Fund Records
http://www.oac.cdlib.org/findaid/ark:/13030/c8h70d7p	"American Cities, a collection of perspectives"
http://www.oac.cdlib.org/findaid/ark:/13030/kt009nf073	American Civil Liberties Union of Northern California Records
http://www.oac.cdlib.org/findaid/ark:/13030/kt4h4nd2z0	American Civil Liberties Union of Southern California Lesbian &amp; Gay Rights Chapter Records
http://www.oac.cdlib.org/findaid/ark:/13030/kt9c60151m	American Civil Liberties Union of Southern California records
http://www.oac.cdlib.org/findaid/ark:/13030/tf967nb3zt	American Civil War Era - Portraits
http://www.oac.cdlib.org/findaid/ark:/13030/kt1489r6rz	American Committee for Liberation from Bolshevism processed volume
http://www.oac.cdlib.org/findaid/ark:/13030/kt2x0nd651	American Committee for the Encouragement of Democratic Government in Russia records
http://www.oac.cdlib.org/findaid/ark:/13030/kt7779r94m	American Committee on United Europe records
http://www.oac.cdlib.org/findaid/ark:/13030/kt709nf0gw	American Committee to Keep Biafra Alive collection
http://www.oac.cdlib.org/findaid/ark:/13030/c83f4nmc	American Composers Forum Los Angeles Chapter records guide
http://www.oac.cdlib.org/findaid/ark:/13030/kt500040xp	American Council on Education Minutes
http://www.oac.cdlib.org/findaid/ark:/13030/tf6z09n8hd	American Council on Education Records
http://www.oac.cdlib.org/findaid/ark:/13030/kt067nb00f	American Educational Research Association Records
