rel=cannonical	title
http://www.oac.cdlib.org/findaid/ark:/13030/tf629004j6	American Emergency Committee for Tibetan Refugees Records
http://www.oac.cdlib.org/findaid/ark:/13030/c8g16226	American Expeditionary Forces Photograph Album
http://www.oac.cdlib.org/findaid/ark:/13030/kt1j49r38w	"American Federation of Television and Radio Artists (AFTRA), San Diego Chapter Records"
http://www.oac.cdlib.org/findaid/ark:/13030/c8542qbc	American Flags Collection
http://www.oac.cdlib.org/findaid/ark:/13030/kt7h4nf43d	American Folk Music Photograph Collection
http://www.oac.cdlib.org/findaid/ark:/13030/kt467nd9hp	American Forum for Global Education records
http://www.oac.cdlib.org/findaid/ark:/13030/kt4f59r7j7	American Foundation miscellaneous records
http://www.oac.cdlib.org/findaid/ark:/13030/kt138nd1jr	American Friends Service Committee - United States-Mexico Border Program Records
http://www.oac.cdlib.org/findaid/ark:/13030/kt2489r54g	American Friends Service Committee. Civilian Public Service records
http://www.oac.cdlib.org/findaid/ark:/13030/kt9870384v	American Friends Service Committee. Coal Relief Section records
http://www.oac.cdlib.org/findaid/ark:/13030/kt6199s2sw	American Guild of Organists records
http://www.oac.cdlib.org/findaid/ark:/13030/tf409nb001	American Historical Documents : Facsimiles
http://www.oac.cdlib.org/findaid/ark:/13030/kt038nc934	American Hotel Guestbook
http://www.oac.cdlib.org/findaid/ark:/13030/kt0p303458	American Indian Community History Center Records
http://www.oac.cdlib.org/findaid/ark:/13030/c8n017wb	American Indian Culture Center. Publications.
http://www.oac.cdlib.org/findaid/ark:/13030/c8kw5gt6	American Indian Print Collection
http://www.oac.cdlib.org/findaid/ark:/13030/c81v5frk	American Institute of Architects Collection
http://www.oac.cdlib.org/findaid/ark:/13030/tf4g500461	"American Institute of Architects, San Francisco Chapter: Centennial Drawing Collection"
http://www.oac.cdlib.org/findaid/ark:/13030/kt2199r5w6	American Institute of Architects Santa Clara Valley Chapter Collection
http://www.oac.cdlib.org/findaid/ark:/13030/kt5n39q39v	American Institute of Graphic Arts Collection
http://www.oac.cdlib.org/findaid/ark:/13030/tf596nb39d	American Institute of Landscape Architects Records
http://www.oac.cdlib.org/findaid/ark:/13030/tf5j49n7k1	American Institutes for Research Reports
http://www.oac.cdlib.org/findaid/ark:/13030/kt5m3nf083	American Jewish Alternatives to Zionism records
http://www.oac.cdlib.org/findaid/ark:/13030/kt3m3nf1j3	"American Jewish Congress, Northern California Division records"
http://www.oac.cdlib.org/findaid/ark:/13030/kt0f59q75v	"American Jewish University, Digital Archive"
http://www.oac.cdlib.org/findaid/ark:/13030/tf5779n74b	American Land and Trust Co. Records
http://www.oac.cdlib.org/findaid/ark:/13030/kt5n39r85n	American Law Institute. Committee to Encourage Discussion of Essential Human Rights. Statement of essential human rights mimeograph
http://www.oac.cdlib.org/findaid/ark:/13030/c88916db	"American Legion Scrapbook, 1941-1954"
http://www.oac.cdlib.org/findaid/ark:/13030/c8x63k95	American Library Association Gay Task Force and Social Responsibilities Round Table Collection
http://www.oac.cdlib.org/findaid/ark:/13030/tf8n39n9nm	American Library Association War Service records
http://www.oac.cdlib.org/findaid/ark:/13030/ft1b69n5hv	American Lung Association of Alameda County Records
http://www.oac.cdlib.org/findaid/ark:/13030/ft0t1n98sq	American Lung Association of California
http://www.oac.cdlib.org/findaid/ark:/13030/ft409nb10w	American Lung Association of Sacramento-Emigrant Trails
http://www.oac.cdlib.org/findaid/ark:/13030/kt3d5nd82g	American Lung Association of Sacramento-Emigrant Trails Chapter Records
http://www.oac.cdlib.org/findaid/ark:/13030/c8pk0hd5	American Militaria Collection
http://www.oac.cdlib.org/findaid/ark:/13030/kt1489q3sk	American Missionaries and Educators in China Collection
http://www.oac.cdlib.org/findaid/ark:/13030/c8jh3n0n	American Mutoscope and Biograph Company Collection
http://www.oac.cdlib.org/findaid/ark:/13030/kt1779r3xr	American National Labor Party Platform mimeograph
http://www.oac.cdlib.org/findaid/ark:/13030/kt1h4nd13n	American National Red Cross
http://www.oac.cdlib.org/findaid/ark:/13030/ft6t1nb2wp	American Newspaper Collection
http://www.oac.cdlib.org/findaid/ark:/13030/tf4z09n9gr	American Newspapers (Various) Collection of Reprints and Facsimile Reproductions
http://www.oac.cdlib.org/findaid/ark:/13030/kt538nf2p0	The American Pageant Collection
http://www.oac.cdlib.org/findaid/ark:/13030/tf6s2007g6	American Pain Society Records
http://www.oac.cdlib.org/findaid/ark:/13030/kt2c6025n6	American Pictorial Collection
http://www.oac.cdlib.org/findaid/ark:/13030/tf4j49n761	American President Lines Records
http://www.oac.cdlib.org/findaid/ark:/13030/kt129023nz	American Printing History Association Collection
http://www.oac.cdlib.org/findaid/ark:/13030/tf5p3007xz	American Red Cross. San Joaquin County (Calif.) Chapter Records
http://www.oac.cdlib.org/findaid/ark:/13030/tf9779p02m	American Relief Administration. European Operations Records
http://www.oac.cdlib.org/findaid/ark:/13030/tf996nb3ks	American Relief Administration Russian Operational Records
http://www.oac.cdlib.org/findaid/ark:/13030/tf3779n92n	American Religions Collection
http://www.oac.cdlib.org/findaid/ark:/13030/c8x06613	American Revolution Bicentennial Collection
http://www.oac.cdlib.org/findaid/ark:/13030/tf9m3nb3d5	American Revolution Bicentennial Commission of California Records
http://www.oac.cdlib.org/findaid/ark:/13030/kt009nd81d	American Samoa interim legal code
http://www.oac.cdlib.org/findaid/ark:/13030/ft396nb065	American screen and theater : photographs and lobby cards
http://www.oac.cdlib.org/findaid/ark:/13030/c89022rr	American Seamen's Certificate of Protection for Isaiah West Taber
http://www.oac.cdlib.org/findaid/ark:/13030/kt867nd58c	American Seedless Raisin Company records
http://www.oac.cdlib.org/findaid/ark:/13030/tf909nb3b6	American Sheet Music Collection
http://www.oac.cdlib.org/findaid/ark:/13030/kt129030zm	American Slav Congress issuances
http://www.oac.cdlib.org/findaid/ark:/13030/c8m61jks	"American Smelting and Refining Company (ASARCO) Collection, 1910-1930"
http://www.oac.cdlib.org/findaid/ark:/13030/kt4s2037fr	American Social Hygiene Association Minutes
http://www.oac.cdlib.org/findaid/ark:/13030/kt367nf0cd	American Society for Aesthetics Records
http://www.oac.cdlib.org/findaid/ark:/13030/kt1j49r2v6	American Society for Eighteenth-Century Studies Records
http://www.oac.cdlib.org/findaid/ark:/13030/c80003fk	American Society of Cinematographers collection
http://www.oac.cdlib.org/findaid/ark:/13030/kt30003214	"American Society of Civil Engineers, San Diego Chapter Records"
http://www.oac.cdlib.org/findaid/ark:/13030/tf0j49n4jh	"American Society of Civil Engineers, Stanford University Student Chapter, Records"
http://www.oac.cdlib.org/findaid/ark:/13030/kt209nb0p3	"American Society of Landscape Architects (ASLA) Records, 1937, 1970-1990"
http://www.oac.cdlib.org/findaid/ark:/13030/kt2199r4k2	American songs of peace sound recording
http://www.oac.cdlib.org/findaid/ark:/13030/tf9v19p0sd	American Student Health Association Records
http://www.oac.cdlib.org/findaid/ark:/13030/kt996nf4ph	American students organize : Founding the National Student Association after World War II : an anthology and sourcebook preview proofs
http://www.oac.cdlib.org/findaid/ark:/13030/kt6h4nf5pc	American Studies Seminars in Japan Records
http://www.oac.cdlib.org/findaid/ark:/13030/tf1j49n4rx	American Subject collection
http://www.oac.cdlib.org/findaid/ark:/13030/tf02900046	American Sugar Refinery Company Records
http://www.oac.cdlib.org/findaid/ark:/13030/c8251kxc	American Trade Bindings Book Collection
http://www.oac.cdlib.org/findaid/ark:/13030/c87p8wr7	American Volunteer Group (Flying Tigers) Special Collection
http://www.oac.cdlib.org/findaid/ark:/13030/kt1z09r6xs	American Volunteer Motor Ambulance Corps correspondence
http://www.oac.cdlib.org/findaid/ark:/13030/hb2000082j	American war posters from the First World War
http://www.oac.cdlib.org/findaid/ark:/13030/hb5d5nb7dj	American war posters from the Second World War
http://www.oac.cdlib.org/findaid/ark:/13030/tf00000111	American West - Views
http://www.oac.cdlib.org/findaid/ark:/13030/c8k074v9	American Women Collection
http://www.oac.cdlib.org/findaid/ark:/13030/ft0p30021x	"American Women's Himalayan Expedition, Inc. : files"
http://www.oac.cdlib.org/findaid/ark:/13030/c8mw2hzk	American-Italian (Orange County Italian Heritage Archive)
http://www.oac.cdlib.org/findaid/ark:/13030/ft596nb1jf	Americans for Nonsmokers' Rights Curriculum Materials
http://www.oac.cdlib.org/findaid/ark:/13030/ft2199n5xd	Americans for Nonsmokers' Rights Records
http://www.oac.cdlib.org/findaid/ark:/13030/kt6h4nc04s	"Americans for Nonsmokers' Rights Records, Addendum"
http://www.oac.cdlib.org/findaid/ark:/13030/kt9c603872	America's town meeting of the air radio broadcast
http://www.oac.cdlib.org/findaid/ark:/13030/kt638nf1rv	Amerikas Latweetis newspaper articles
http://www.oac.cdlib.org/findaid/ark:/13030/c8xd13fg	Amerine (Maynard A.) Papers.
http://www.oac.cdlib.org/findaid/ark:/13030/kt7c60240f	Ames Astrogram
http://www.oac.cdlib.org/findaid/ark:/13030/c8b85b63	Ames (Bob) Scrapbook
http://www.oac.cdlib.org/findaid/ark:/13030/kt4n39r86v	Ames (David W.) papers
http://www.oac.cdlib.org/findaid/ark:/13030/kt5199r1vp	Ames (Ed) Musical Arrangements Collection
http://www.oac.cdlib.org/findaid/ark:/13030/tf0489n477	Ames Family Papers
http://www.oac.cdlib.org/findaid/ark:/13030/kt5h4nd46w	Ames (Jean and Arthur) Scrapbook Collection
http://www.oac.cdlib.org/findaid/ark:/13030/kt2t1nf3vq	Ames (William) Collection
http://www.oac.cdlib.org/findaid/ark:/13030/kt5779r9r9	Amesbury (Fred) Photograph Album
http://www.oac.cdlib.org/findaid/ark:/13030/kt109nd6x6	Amesti (Jose) Cuaderno de Cuentas dela Casa del J[os]e Amesti del Año de 1840 a 1850
http://www.oac.cdlib.org/findaid/ark:/13030/kt967nd1fb	Amestoy (Helen) Collection of Materials on Lawrence Clark Powell
http://www.oac.cdlib.org/findaid/ark:/13030/c80r9q7b	Amet (Edward H.) Collection
http://www.oac.cdlib.org/findaid/ark:/13030/c8x067kp	Amet (E.H.) (1860-1948) Collection
http://www.oac.cdlib.org/findaid/ark:/13030/kt9g50422p	Amigos de Humanidad records
http://www.oac.cdlib.org/findaid/ark:/13030/kt9w103859	Amis de la Pologne issuances
http://www.oac.cdlib.org/findaid/ark:/13030/tf267n98q0	Amis (Kingsley) Papers
http://www.oac.cdlib.org/findaid/ark:/13030/kt1g5001m6	Ammen (Daniel) Papers
http://www.oac.cdlib.org/findaid/ark:/13030/kt6779r79x	Amoedo (Julio) interviews
http://www.oac.cdlib.org/findaid/ark:/13030/c8wq058g	Amos (Ellen) and Family Letters
http://www.oac.cdlib.org/findaid/ark:/13030/kt4v19s146	Ampex Collection Addenda
http://www.oac.cdlib.org/findaid/ark:/13030/ft4s2004rn	Ampex Corporation Records
http://www.oac.cdlib.org/findaid/ark:/13030/kt0g5034n6	Amphion Club Collection
http://www.oac.cdlib.org/findaid/ark:/13030/tf496nb2d5	Ampico Player Piano Rolls Collection
http://www.oac.cdlib.org/findaid/ark:/13030/kt1779r3t6	Amrein (Polly) letters
http://www.oac.cdlib.org/findaid/ark:/13030/c88w3br3	Amsden (Georgia C.) Papers
http://www.oac.cdlib.org/findaid/ark:/13030/kt2j49r4z1	Amvrosii (Archimandrite) papers
http://www.oac.cdlib.org/findaid/ark:/13030/kt087029tf	Amy (Henry Joseph) papers
http://www.oac.cdlib.org/findaid/ark:/13030/kt35803719	"""An Architect Grows Up in Palo Alto; Memoirs of Birge M. Clark"" Typescript"
http://www.oac.cdlib.org/findaid/ark:/13030/kt9h4nf6mr	"""An Uncommon Man: Paul C. Edwards, 1882-1962, His Story and Writings"""
http://www.oac.cdlib.org/findaid/ark:/13030/kt2199p9w7	Anaheim Public Library photograph collection on Anaheim local history
http://www.oac.cdlib.org/findaid/ark:/13030/tf0c6000b8	Anaximandrian Society Proceedings
http://www.oac.cdlib.org/findaid/ark:/13030/kt8199s2dt	Anaya (S. James.) typescript
http://www.oac.cdlib.org/findaid/ark:/13030/kt629033b9	A.N.C. : V.I.P.'s of violence : video tape
http://www.oac.cdlib.org/findaid/ark:/13030/c8db83j4	Anchor (Cliff) Papers
http://www.oac.cdlib.org/findaid/ark:/13030/c8cf9qxm	Ancient Mexican Writing System by Charles E. Dibble
http://www.oac.cdlib.org/findaid/ark:/13030/c84j0dgh	"Ancient Order of United Workmen Ledgers, 1883-1899"
http://www.oac.cdlib.org/findaid/ark:/13030/kt3870204p	Ancona (Mario) Collection
http://www.oac.cdlib.org/findaid/ark:/13030/c87p90wn	Andermann (Greg) Collection
http://www.oac.cdlib.org/findaid/ark:/13030/tf0p3000tg	Anders (Wladyslaw) Collection
http://www.oac.cdlib.org/findaid/ark:/13030/c85x2bns	Andersdatter (Karla Margaret) Papers.
http://www.oac.cdlib.org/findaid/ark:/13030/c8542m13	Anderson (Allan W.) Papers
http://www.oac.cdlib.org/findaid/ark:/13030/c8gf0vgz	"Anderson (Andy) collection on oil production, circa 1900s"
http://www.oac.cdlib.org/findaid/ark:/13030/tf6d5nb1m2	Anderson (Annelise G.) Papers
http://www.oac.cdlib.org/findaid/ark:/13030/tf9c60106f	Anderson (Artemisia D.) Poetry Notebook
http://www.oac.cdlib.org/findaid/ark:/13030/c84j0fz6	Anderson (Arthur J.O.) papers
http://www.oac.cdlib.org/findaid/ark:/13030/kt096nd95x	Anderson (C. R. W.) India / China Photograph Album
http://www.oac.cdlib.org/findaid/ark:/13030/kt7870288v	Anderson (Carl D.) papers
http://www.oac.cdlib.org/findaid/ark:/13030/c8tt4sp7	Anderson (Carl T.) Oral History
http://www.oac.cdlib.org/findaid/ark:/13030/kt838nf1cs	Anderson (Charles G.) biographical writings
http://www.oac.cdlib.org/findaid/ark:/13030/c8154k3f	Anderson Collection at Stanford University: Groundbreaking Ceremony keepsake book
http://www.oac.cdlib.org/findaid/ark:/13030/tf8x0nb6v0	Anderson (Dame J.) Collection
http://www.oac.cdlib.org/findaid/ark:/13030/kt3t1nd9nc	Anderson (Dillon) papers
http://www.oac.cdlib.org/findaid/ark:/13030/tf9c6006hj	Anderson (Don L.) Papers
http://www.oac.cdlib.org/findaid/ark:/13030/kt7h4nf5k4	Anderson (Dorotheda Revay) Papers
http://www.oac.cdlib.org/findaid/ark:/13030/kt5f59r8w6	Anderson (Edgar) miscellaneous papers
http://www.oac.cdlib.org/findaid/ark:/13030/kt6199q2x2	Anderson (Eugene N.) Papers
http://www.oac.cdlib.org/findaid/ark:/13030/tf8t1nb68j	Anderson (Evelyn) Papers
http://www.oac.cdlib.org/findaid/ark:/13030/tf1b69n50q	Anderson Family Papers
http://www.oac.cdlib.org/findaid/ark:/13030/kt98700720	Anderson Family Papers?
http://www.oac.cdlib.org/findaid/ark:/13030/tf887006ch	Anderson Family Papers
http://www.oac.cdlib.org/findaid/ark:/13030/tf587004fn	Anderson Family Papers
http://www.oac.cdlib.org/findaid/ark:/13030/tf7x0nb2w8	"Anderson Family Papers, 1809-1933"
http://www.oac.cdlib.org/findaid/ark:/13030/c8ns0smx	Anderson (Frank Marion) Papers
http://www.oac.cdlib.org/findaid/ark:/13030/tf4290030t	Anderson (Frederick L.) papers
http://www.oac.cdlib.org/findaid/ark:/13030/kt4x0nd9xg	Anderson (Glenn M.) Papers
http://www.oac.cdlib.org/findaid/ark:/13030/tf138nb1gg	Anderson (Hamilton H.) Papers
http://www.oac.cdlib.org/findaid/ark:/13030/tf7x0nb2sq	Anderson (Hugh) Collection
http://www.oac.cdlib.org/findaid/ark:/13030/tf9g5009hn	Anderson (Hugh H.) Papers
http://www.oac.cdlib.org/findaid/ark:/13030/kt1q2nd6xs	Anderson (Jeannette) letters
http://www.oac.cdlib.org/findaid/ark:/13030/kt5b69n7s5	Anderson (John A.) Papers
http://www.oac.cdlib.org/findaid/ark:/13030/c85h7gwb	"Anderson (Martin ) Papers, White House Central Files, 1969-1974"
http://www.oac.cdlib.org/findaid/ark:/13030/ft7c600565	Anderson (Melville Best) Papers
http://www.oac.cdlib.org/findaid/ark:/13030/c80r9mtq	Anderson (Michael) Portrait Photographs
http://www.oac.cdlib.org/findaid/ark:/13030/kt1n39r7mn	Anderson (R. Joseph) and Orville R. Butler History of Physicists in Industry Report
http://www.oac.cdlib.org/findaid/ark:/13030/tf0p3000zj	Anderson (Richard C.) Papers
http://www.oac.cdlib.org/findaid/ark:/13030/kt796nf1s0	Anderson (Ronald S.) papers
http://www.oac.cdlib.org/findaid/ark:/13030/c87h1h9g	Anderson (Roy A.) Papers
http://www.oac.cdlib.org/findaid/ark:/13030/kt1b69r5f4	Anderson (Roy Scott) papers
http://www.oac.cdlib.org/findaid/ark:/13030/kt2t1nf4dg	Anderson (T. W.) Papers
http://www.oac.cdlib.org/findaid/ark:/13030/c8vt1ts5	Anderson Valley Advertiser Records
http://www.oac.cdlib.org/findaid/ark:/13030/kt7c6037tr	Anderson (Vernon Ellsworth) papers
http://www.oac.cdlib.org/findaid/ark:/13030/tf7d5nb5g7	Anderson (Walter T.) Collection
http://www.oac.cdlib.org/findaid/ark:/13030/kt1p3033mt	Andersson (Kingsley) diaries
http://www.oac.cdlib.org/findaid/ark:/13030/kt7c6037v8	"Anderthalb Jahre in einer Sowjet ""Glawka"" typescript"
http://www.oac.cdlib.org/findaid/ark:/13030/kt667nf0dv	Andreev (Andreevskii) (Ivan Mikhailovich ) Papers
http://www.oac.cdlib.org/findaid/ark:/13030/kt8h4nf2tm	Andreev (N. N.) letters
http://www.oac.cdlib.org/findaid/ark:/13030/kt0v19r7v8	Andreini (Robert Leslie) Speech and Drama Notebooks
http://www.oac.cdlib.org/findaid/ark:/13030/kt5z09r78p	Andrew (A. Piatt) papers
http://www.oac.cdlib.org/findaid/ark:/13030/kt7f59p7g7	Andrews (Colman) Papers
http://www.oac.cdlib.org/findaid/ark:/13030/kt700026ws	Andrews (Joseph Alfred) Papers
http://www.oac.cdlib.org/findaid/ark:/13030/kt0r29p9qm	Andrews (Robert H.) papers
http://www.oac.cdlib.org/findaid/ark:/13030/c89k4ckv	Andrews (Sarah S.) Collection
http://www.oac.cdlib.org/findaid/ark:/13030/c8cc11jp	Andrews (Wayne) Collection of Architectural Photographs
http://www.oac.cdlib.org/findaid/ark:/13030/kt0z09r2c8	Andreyev (Leonid) collection
http://www.oac.cdlib.org/findaid/ark:/13030/c8fj2f7b	Andromeda television scripts (Collection of)
http://www.oac.cdlib.org/findaid/ark:/13030/kt467nd9cm	Andrushkevich (Nikolaĭ Aleksandrovich) writings
http://www.oac.cdlib.org/findaid/ark:/13030/c8rf5wcd	Andy Mahoney (steam schooner) logbook and Lottie Carson (bark) ledger page
http://www.oac.cdlib.org/findaid/ark:/13030/kt6t1nc77p	Andy Williams Show (The) - Collection of Television Scripts
http://www.oac.cdlib.org/findaid/ark:/13030/kt3c6031jg	Aneks collection
http://www.oac.cdlib.org/findaid/ark:/13030/tf5489n7kd	"Angel Island Publications, Inc. Records"
http://www.oac.cdlib.org/findaid/ark:/13030/kt267nf00d	"Angel (Myron) Papers, 1827-1911"
http://www.oac.cdlib.org/findaid/ark:/13030/kt9489s3jb	Angel of Grief Condition Survey Report
http://www.oac.cdlib.org/findaid/ark:/13030/tf6p30051v	Angela Davis trial
http://www.oac.cdlib.org/findaid/ark:/13030/c84f1p54	Angelillo (Olindo R.) papers
http://www.oac.cdlib.org/findaid/ark:/13030/kt1g5034kg	Angell (Frank) papers
http://www.oac.cdlib.org/findaid/ark:/13030/kt2n39r04b	Angels' Talk Project Collection of Astrology Charts of Persons with AIDS
http://www.oac.cdlib.org/findaid/ark:/13030/kt0x0nc4k6	Anglemyer (Philinda R.) Philippines Collection
http://www.oac.cdlib.org/findaid/ark:/13030/kt0q2nf0cr	Angola Mining Photograph Album
http://www.oac.cdlib.org/findaid/ark:/13030/tf296n98m3	Angolan subject collection
http://www.oac.cdlib.org/findaid/ark:/13030/kt5n39r0dd	Anguiano (Lupe) Papers
http://www.oac.cdlib.org/findaid/ark:/13030/c88c9xk0	Angulo (Jaime de) Papers
http://www.oac.cdlib.org/findaid/ark:/13030/tf7t1nb4wk	Angulo (Jaime de) Papers
http://www.oac.cdlib.org/findaid/ark:/13030/kt9v19s0tm	Anichkov (Vladimir Petrovich) holograph
http://www.oac.cdlib.org/findaid/ark:/13030/c8n29vxz	Animation Collection
http://www.oac.cdlib.org/findaid/ark:/13030/c8gb22rr	Anna Rabkin oral history interview
http://www.oac.cdlib.org/findaid/ark:/13030/kt0q2nc5z2	Anne T. Kent California Room Collection
http://www.oac.cdlib.org/findaid/ark:/13030/kt1x0nd803	Annenkov (Boris Vladimirovich) orders
http://www.oac.cdlib.org/findaid/ark:/13030/c8sj1mdc	"Annie M. Reid (built 1892; bark, 4m) logbooks"
http://www.oac.cdlib.org/findaid/ark:/13030/tf2z09n5d5	Anonymous Letter [Ida to Laura]
http://www.oac.cdlib.org/findaid/ark:/13030/c8fn1762	ANTA West records
http://www.oac.cdlib.org/findaid/ark:/13030/c89p30md	"Antelope Valley, Lancaster, Kern County Scrapbook"
http://www.oac.cdlib.org/findaid/ark:/13030/kt1x0nd0tn	Antheil (George) Collection
http://www.oac.cdlib.org/findaid/ark:/13030/ft158002h6	Antheil (George) Motion Picture and Television Collection
http://www.oac.cdlib.org/findaid/ark:/13030/kt3199q9h9	Anthony (Abraham) Scrapbook
http://www.oac.cdlib.org/findaid/ark:/13030/k6tb14t3	Anthony (Gene) Summer of Love Photograph Collection
http://www.oac.cdlib.org/findaid/ark:/13030/tf3w1005m1	Anthony (Gordon) Ballet and Theatrical Photograph Albums
http://www.oac.cdlib.org/findaid/ark:/13030/c8r210nx	Anthony (Humphrey) papers
http://www.oac.cdlib.org/findaid/ark:/13030/c8pc3371	"Anthony (Ida Husted Harper) Collection of Susan B. Photographs, ca. 1870s-1906"
http://www.oac.cdlib.org/findaid/ark:/13030/k6v985zx	Anthony P. Morse papers
http://www.oac.cdlib.org/findaid/ark:/13030/kt3n39q3nd	Anthony (Susan B.) Collection
http://www.oac.cdlib.org/findaid/ark:/13030/kt9q2nf7cx	Anti-Cigarette League of America archive
http://www.oac.cdlib.org/findaid/ark:/13030/kt0w1033nb	Anti-Defamation League of San Diego Collection
http://www.oac.cdlib.org/findaid/ark:/13030/kt1779r56v	Antin (David) Papers
http://www.oac.cdlib.org/findaid/ark:/13030/c8vq31df	"Antin, Eleanor 100 Boots feedback collection"
http://www.oac.cdlib.org/findaid/ark:/13030/c8251hgq	Antin (Eleanor) Papers
http://www.oac.cdlib.org/findaid/ark:/13030/tf5h4nb302	Antiquarian Booksellers Assn. of America (S. Calif. Chapter) Records
http://www.oac.cdlib.org/findaid/ark:/13030/ft1199n59s	Antiquarian Map Collection
http://www.oac.cdlib.org/findaid/ark:/13030/kt20003408	antique automobile photographs (Collection of)
http://www.oac.cdlib.org/findaid/ark:/13030/c8gh9kgr	Antique Mechanics Club Records
http://www.oac.cdlib.org/findaid/ark:/13030/kt300031pg	Anti-socialist activities in Great Britain typescript
http://www.oac.cdlib.org/findaid/ark:/13030/kt4199q8zv	Anti-Viet Nam War Collection
http://www.oac.cdlib.org/findaid/ark:/13030/kt2489r592	Antonenko (V. P.)typescript
http://www.oac.cdlib.org/findaid/ark:/13030/kt7m3nf1x1	Antoniade (Constantin) letter
http://www.oac.cdlib.org/findaid/ark:/13030/kt900038bj	Antonov (O. K.) papers
http://www.oac.cdlib.org/findaid/ark:/13030/kt8q2nd6j8	Anzaldúa (Gloria) Altares Collection
http://www.oac.cdlib.org/findaid/ark:/13030/c89888qt	Apiculture Subject File Collection
http://www.oac.cdlib.org/findaid/ark:/13030/c89025vb	Apiculturists Collection
http://www.oac.cdlib.org/findaid/ark:/13030/c8q52nk0	Apollo (ship) records
http://www.oac.cdlib.org/findaid/ark:/13030/c80002nv	"Apostolic Faith Mission (Portland, Oregon)"
http://www.oac.cdlib.org/findaid/ark:/13030/kt5z09s0qg	"""Apostrophes a Stanford: deux philosophes Francais en Californie"" [videorecording]"
http://www.oac.cdlib.org/findaid/ark:/13030/kt587039tf	Appel (Al and Charlotte S.) Papers
http://www.oac.cdlib.org/findaid/ark:/13030/kt4b69s00c	Appelbaum (Richard P.) Collection
http://www.oac.cdlib.org/findaid/ark:/13030/kt996nf7kd	Apperson (Albert M) Papers
http://www.oac.cdlib.org/findaid/ark:/13030/ft48700332	Apple Computer ephemera collection
http://www.oac.cdlib.org/findaid/ark:/13030/tf4t1nb0n3	Apple Computer Inc. Records
http://www.oac.cdlib.org/findaid/ark:/13030/c8gq708b	Apple (Nick) papers
http://www.oac.cdlib.org/findaid/ark:/13030/kt4199r6qq	Applebaum (Anne) collection
http://www.oac.cdlib.org/findaid/ark:/13030/tf4j49n80d	"Applegarth (George A.) Collection, 1918-1919"
http://www.oac.cdlib.org/findaid/ark:/13030/tf0x0n97r0	Applegarth (John S.) Collection
http://www.oac.cdlib.org/findaid/ark:/13030/kt0q2nd9g6	"Applegate Jr. (O.C.) Letters, 1941"
http://www.oac.cdlib.org/findaid/ark:/13030/kt6w104070	Appleton Family Papers
http://www.oac.cdlib.org/findaid/ark:/13030/tf629004r9	Appleton-Foster Collection
http://www.oac.cdlib.org/findaid/ark:/13030/kt7t1nf6sp	Appleyard (Donald) Papers
http://www.oac.cdlib.org/findaid/ark:/13030/c8mc8zb0	"Appointments, Diplomas, and Certificates"
http://www.oac.cdlib.org/findaid/ark:/13030/ft4f59n6mg	"Appy (Charles) Papers, 1824-1934"
http://www.oac.cdlib.org/findaid/ark:/13030/kt1199r750	April 3rd Movement Records
http://www.oac.cdlib.org/findaid/ark:/13030/kt4n39r081	Aptheker (Bettina) Papers
http://www.oac.cdlib.org/findaid/ark:/13030/tf467nb0bh	Aptheker (Herbert) Papers
http://www.oac.cdlib.org/findaid/ark:/13030/kt4f59q1hc	Aptos PTA Scrapbooks
http://www.oac.cdlib.org/findaid/ark:/13030/c86110wr	Aquatic Park Bathhouse Bayview Room Restoration documentation
http://www.oac.cdlib.org/findaid/ark:/13030/tf429003hk	Arabic manuscripts
http://www.oac.cdlib.org/findaid/ark:/13030/kt0n39n46b	Arabic Manuscripts Collection
http://www.oac.cdlib.org/findaid/ark:/13030/tf7f59p1r4	Arai Family Papers
http://www.oac.cdlib.org/findaid/ark:/13030/kt2j49r564	Arakchaa (Kara-kys Dongikovna) papers
http://www.oac.cdlib.org/findaid/ark:/13030/kt896nf54d	Aras (Tevfik Rustu) typescript
http://www.oac.cdlib.org/findaid/ark:/13030/kt4v19r98p	"Arbegast (Mai Kitazawa) Collection, 1933-2003, (bulk 1980-2000)"
http://www.oac.cdlib.org/findaid/ark:/13030/tf8b69n9hk	Arbor Vitae Club Collection
http://www.oac.cdlib.org/findaid/ark:/13030/c8n58n3c	Arbuckle (Fatty) Glass Negatives
http://www.oac.cdlib.org/findaid/ark:/13030/kt9r29q8rw	Arcadia History Collection
http://www.oac.cdlib.org/findaid/ark:/13030/c8x63nkk	Arcata &amp; Mad River Railroad Collection
http://www.oac.cdlib.org/findaid/ark:/13030/kt1d5nd9dh	Arcelo (Adriano A.) processed volume
http://www.oac.cdlib.org/findaid/ark:/13030/c8dr2x0r	"Archaeology of Black Mountain, California"
http://www.oac.cdlib.org/findaid/ark:/13030/kt1q2nd6sq	Archbishop Apollinarii (Koshevoi) papers
http://www.oac.cdlib.org/findaid/ark:/13030/kt4h4nf4cm	Archeological Evaluation of the Greystone Quarry in the Santa Teresa Hills Report
http://www.oac.cdlib.org/findaid/ark:/13030/tf9199p2zq	Archer (H. Richard) and the Hippogryph Press Collection
http://www.oac.cdlib.org/findaid/ark:/13030/kt438nc68h	Archer (John F.) - Susohn Collection
