rel=cannonical	title
http://www.oac.cdlib.org/findaid/ark:/13030/kt358004j8	Archer (Kate Rennie) Papers
http://www.oac.cdlib.org/findaid/ark:/13030/c81n839p	Architectural drawings collection
http://www.oac.cdlib.org/findaid/ark:/13030/c8sn09pw	"Architectural models from the exhibition ""The Architecture of R. M. Schindler (1887-1953)"""
http://www.oac.cdlib.org/findaid/ark:/13030/kt387002kg	"Architectural Pottery (Firm: Los Angeles, Calif.) Lawrence (Max and Rita) Records"
http://www.oac.cdlib.org/findaid/ark:/13030/kt8199s44n	"Architectural Resources Group, Leland Stanford Junior Museum Paint Analysis analysis"
http://www.oac.cdlib.org/findaid/ark:/13030/kt3000171n	Architecture and Urban Planning Collection
http://www.oac.cdlib.org/findaid/ark:/13030/kt3r29q3s4	"Architecture and Urban Planning (Graduate School of ). Development Office. Correspondence: scholarships, endowments, and other funds."
http://www.oac.cdlib.org/findaid/ark:/13030/c8f47qdn	Architecture and Urban Planning (Graduate School of). Dean. Correspondence files.
http://www.oac.cdlib.org/findaid/ark:/13030/c89c6zpx	Architecture and Urban Planning (Graduate School of). Dean. Minutes of meetings and correspondence files.
http://www.oac.cdlib.org/findaid/ark:/13030/c8pn96vc	Architecture and Urban Planning (Graduate School of). Dean's Council. Correspondence files.
http://www.oac.cdlib.org/findaid/ark:/13030/kt5d5nc924	Architecture and Urban Planning (Graduate School of). Dean's Council. Dean's Council Dinner records.
http://www.oac.cdlib.org/findaid/ark:/13030/tf2d5nb1c6	Architecture and Urban Planning (Graduate School of). Dean's Office. Administrative files of Harvery S. Perloff.
http://www.oac.cdlib.org/findaid/ark:/13030/kt2q2nc6hf	Architecture and Urban Planning (Graduate School of). Development Office. Director. Correspondence files.
http://www.oac.cdlib.org/findaid/ark:/13030/tf5d5nb31x	Architecture and Urban Planning (Graduate School of). Development Office. General correspondence.
http://www.oac.cdlib.org/findaid/ark:/13030/c8sn0c16	Architecture and Urban Planning (Graduate School of). Publications.
http://www.oac.cdlib.org/findaid/ark:/13030/c8h70j06	Architecture and Urban Planning (Graduate School of). Running on Empty: The Travel Patterns of Extremely Poor People in Los Angeles.
http://www.oac.cdlib.org/findaid/ark:/13030/c85m66zk	Architecture and Urban Planning (School of). Event Files.
http://www.oac.cdlib.org/findaid/ark:/13030/tf738nb28q	Architecture of Stanford University Collection
http://www.oac.cdlib.org/findaid/ark:/13030/tf4t1nb406	Archive for New Poetry. Curator's Correspondence and Subject Files
http://www.oac.cdlib.org/findaid/ark:/13030/c8mw2jmh	Archives of the Committee For the Conservation of Cultural Resources for Southern California Collections
http://www.oac.cdlib.org/findaid/ark:/13030/tf1q2n9845	Archives of the Soviet Communist Party and Soviet State Microfilm Collection: Russian State Archives of Social and Political History (Rossiiskii gosudarstvennyi arkhiv sotsialno-politicheskoi istorii - RGASPI)
http://www.oac.cdlib.org/findaid/ark:/13030/kt0779r3rv	Archives of the Soviet Communist Party and Soviet State Microfilm Collection: State Archives of the Russian Federation (Gosudarstvennyĭ arkhiv Rossiĭskoĭ Federatsii - GARF)
http://www.oac.cdlib.org/findaid/ark:/13030/kt767nf11z	Archives of the Soviet Communist Party and Soviet State Microfilm Collection:Russian State Archive of Contemporary History (Rossiiskii gosudarstvennyi arkhiv noveishei istorii - RGANI)
http://www.oac.cdlib.org/findaid/ark:/13030/tf4j49n75h	Archives Reference Collection
http://www.oac.cdlib.org/findaid/ark:/13030/tf1x0n98s9	Archivo del Obispado de Monterey y Los Angeles
http://www.oac.cdlib.org/findaid/ark:/13030/kt829014pp	Archivo General de Indias
http://www.oac.cdlib.org/findaid/ark:/13030/kt5199s1jg	"Archivo General de Indias records : Spanish exploration and settlement related materials, circa 1530-circa 1820"
http://www.oac.cdlib.org/findaid/ark:/13030/kt187034pq	"Archivo Histórico de la Defensa Nacional records, 1706-1857"
http://www.oac.cdlib.org/findaid/ark:/13030/tf8779n9v3	Archivos de las Misiones
http://www.oac.cdlib.org/findaid/ark:/13030/kt2p3015wb	Archiwum Wschodnie Collection
http://www.oac.cdlib.org/findaid/ark:/13030/kt8s2036qn	Arday (Lajos) writings
http://www.oac.cdlib.org/findaid/ark:/13030/tf1w1004hc	Ardizzone (Edward) Papers
http://www.oac.cdlib.org/findaid/ark:/13030/c88s4rdx	Ardmore (Jane) papers
http://www.oac.cdlib.org/findaid/ark:/13030/tf5w1006sq	Ardrey (Robert) Papers
http://www.oac.cdlib.org/findaid/ark:/13030/tf187001tn	Arequipa Sanatorium Records
http://www.oac.cdlib.org/findaid/ark:/13030/kt1c60321k	Arevalo (Apolinar F. de) commission
http://www.oac.cdlib.org/findaid/ark:/13030/kt996nf4q1	Arey (James A.) papers
http://www.oac.cdlib.org/findaid/ark:/13030/kt709nf1wk	Argelander (Frank) memorandum
http://www.oac.cdlib.org/findaid/ark:/13030/tf1q2n98pf	Argüello (José D.) Papers
http://www.oac.cdlib.org/findaid/ark:/13030/tf2k4002cp	Argentina. Consulado General (Berlin) Records
http://www.oac.cdlib.org/findaid/ark:/13030/kt5c6035sn	"Argentina Photograph Collection, ca. 1900-1950s"
http://www.oac.cdlib.org/findaid/ark:/13030/tf300002b3	Argentine Subject Collection
http://www.oac.cdlib.org/findaid/ark:/13030/kt7z09s206	Argo (Arnold Clarence) papers
http://www.oac.cdlib.org/findaid/ark:/13030/kt8z09s0z1	"Arguello (Luise L.) Letters, 1911"
http://www.oac.cdlib.org/findaid/ark:/13030/kt3q2nb7wg	Ariadna (Mother) Papers
http://www.oac.cdlib.org/findaid/ark:/13030/kt000034r1	Ariel (Joan) Collection of Lesbian Periodicals
http://www.oac.cdlib.org/findaid/ark:/13030/kt6c603476	Ariel (Joan) Files on Women's Political Activism
http://www.oac.cdlib.org/findaid/ark:/13030/kt9p3038pr	"Ariel (Joan) files on Women's Studies at the University of California, Irvine"
http://www.oac.cdlib.org/findaid/ark:/13030/c8hd7x6t	Arizona and Colorado Railroad Records
http://www.oac.cdlib.org/findaid/ark:/13030/c8nv9k0g	Arizona Citizen Interview with Mariana Dias by A. P. K. Safford and Samuel Hughes
http://www.oac.cdlib.org/findaid/ark:/13030/c8xs5ww4	Arizona Hassayampa Society Collection
http://www.oac.cdlib.org/findaid/ark:/13030/c87d2wmd	Arizona Historical Photographs Collection
http://www.oac.cdlib.org/findaid/ark:/13030/tf2q2nb27k	Arizona Land Marks
http://www.oac.cdlib.org/findaid/ark:/13030/c87p90v6	Arizona Territorial Volunteers Records
http://www.oac.cdlib.org/findaid/ark:/13030/kt1b69r7v9	Arkatov (James) Photograph Collection
http://www.oac.cdlib.org/findaid/ark:/13030/kt5p3035cd	Arkatov (James) photographs
http://www.oac.cdlib.org/findaid/ark:/13030/kt6k4037rq	Arkhangel'skii (Aleksei Petrovich) papers
http://www.oac.cdlib.org/findaid/ark:/13030/kt5m3nf3rs	Arkoff (Samuel Z.) Papers
http://www.oac.cdlib.org/findaid/ark:/13030/kt1n39r7bh	Arkus (Albert H.)
http://www.oac.cdlib.org/findaid/ark:/13030/c8736spg	Arleta Chamber of Commerce &amp; Resident's Association
http://www.oac.cdlib.org/findaid/ark:/13030/tf6w1005p0	Arlett (Arthur) Papers
http://www.oac.cdlib.org/findaid/ark:/13030/kt4x0nf1x2	Arlon (Belgium) proclamations
http://www.oac.cdlib.org/findaid/ark:/13030/kt9k40426d	Armantrout (Rae) Papers
http://www.oac.cdlib.org/findaid/ark:/13030/kt0779r3xf	Armantrout (Rae) Papers
http://www.oac.cdlib.org/findaid/ark:/13030/kt4h4nb099	Armed Revolutionary Organizations in Mexico documents (Microform)
http://www.oac.cdlib.org/findaid/ark:/13030/c8w0958n	"Armed Services Catalog of Medical Materials, 1949-1952"
http://www.oac.cdlib.org/findaid/ark:/13030/kt6r29q3jf	Armenian Manuscripts Collection
http://www.oac.cdlib.org/findaid/ark:/13030/kt8c6036gd	Armenian subject collection
http://www.oac.cdlib.org/findaid/ark:/13030/kt8c6036q1	Armenian Women's Archive Collection
http://www.oac.cdlib.org/findaid/ark:/13030/c8rn39wd	Armenian Women’s Archives Collection
http://www.oac.cdlib.org/findaid/ark:/13030/tf4000041q	Armer (Elinor) Compositions
http://www.oac.cdlib.org/findaid/ark:/13030/kt5s2036b1	Armitage (Merle) Collection
http://www.oac.cdlib.org/findaid/ark:/13030/tf1c6003d2	Armor (Samuel and Alice L.) Papers
http://www.oac.cdlib.org/findaid/ark:/13030/kt209nf2wh	"Armour (Allison V.) expedition to Yucátan, Mexico scrapbook"
http://www.oac.cdlib.org/findaid/ark:/13030/tf6g5004rx	Armour (Lester) Papers
http://www.oac.cdlib.org/findaid/ark:/13030/c8319t78	"Arms Control, Weapons in the 80's: The MX and Beyond [videorecording]"
http://www.oac.cdlib.org/findaid/ark:/13030/kt3x0nf407	The Arms race: Sources and Solutions [videorecording]
http://www.oac.cdlib.org/findaid/ark:/13030/c81r6r4k	"Armstrong (Anne) Papers, White House Central Files, 1969-1974"
http://www.oac.cdlib.org/findaid/ark:/13030/c8930tsk	Armstrong (Duke) Papers
http://www.oac.cdlib.org/findaid/ark:/13030/kt1f59r5tg	Armstrong (Eunice Burton) papers
http://www.oac.cdlib.org/findaid/ark:/13030/c80c4thg	Armstrong (Fred) Papers
http://www.oac.cdlib.org/findaid/ark:/13030/kt1r29r5rd	Armstrong (Hubert Coslet) papers
http://www.oac.cdlib.org/findaid/ark:/13030/kt9s2042mx	Armstrong (John S.) Nursery Collection
http://www.oac.cdlib.org/findaid/ark:/13030/kt0z09r3zj	Armstrong (Marjorie) Family Papers
http://www.oac.cdlib.org/findaid/ark:/13030/c8f47ngq	Armstrong (Winifred) papers
http://www.oac.cdlib.org/findaid/ark:/13030/kt80003912	Army Air Corp. Air Mail Accidents: February-April 1934 Special Collection
http://www.oac.cdlib.org/findaid/ark:/13030/kt8g503819	Army Industrial College memoranda
http://www.oac.cdlib.org/findaid/ark:/13030/kt7z09n94v	Army of the Potomac Ledger
http://www.oac.cdlib.org/findaid/ark:/13030/kt3489r6zp	Army War College (United States) Historical Section miscellany
http://www.oac.cdlib.org/findaid/ark:/13030/kt9779s1j1	Arnaz (Desi) Papers
http://www.oac.cdlib.org/findaid/ark:/13030/c8n29xwb	"Arnaz, Wagner, Levy, Waterman, Barnes, Denton, Walker papers, circa 1800s-1900s"
http://www.oac.cdlib.org/findaid/ark:/13030/kt8199s11n	Arndt (Edward J. Arndt) phonorecord collection
http://www.oac.cdlib.org/findaid/ark:/13030/kt2000338x	Arnold (Bob) Collection
http://www.oac.cdlib.org/findaid/ark:/13030/c8057dwh	Arnold (Charles E.) Collection
http://www.oac.cdlib.org/findaid/ark:/13030/tf6m3nb4mt	Arnold (James) Papers
http://www.oac.cdlib.org/findaid/ark:/13030/kt4q2nf2f0	Arnold (John Edward) Course Materials
http://www.oac.cdlib.org/findaid/ark:/13030/tf500003tf	Arnold (Julean H.) Papers
http://www.oac.cdlib.org/findaid/ark:/13030/kt7m3nf1sz	Arnold memoranda
http://www.oac.cdlib.org/findaid/ark:/13030/kt7r29r7w9	Arnold (Patricia Louise) typescript
http://www.oac.cdlib.org/findaid/ark:/13030/kt3779s22d	Arnold (Ralph) Addenda
http://www.oac.cdlib.org/findaid/ark:/13030/tf2j49n5mn	Arnold (Ralph) Collection
http://www.oac.cdlib.org/findaid/ark:/13030/kt0k4031w1	Arnold (Ralph) typescript
http://www.oac.cdlib.org/findaid/ark:/13030/tf467nb15d	Arnold (Zach M.) Papers
http://www.oac.cdlib.org/findaid/ark:/13030/tf5489n7nf	Arnon (Daniel Israel) Papers
http://www.oac.cdlib.org/findaid/ark:/13030/tf6f59p282	Arnot (Philip H.) Papers
http://www.oac.cdlib.org/findaid/ark:/13030/kt238nd9dv	"Arnstein, (Flora J.) Papers"
http://www.oac.cdlib.org/findaid/ark:/13030/tf4p300428	Arnstein (Lawrence) Papers
http://www.oac.cdlib.org/findaid/ark:/13030/kt8d5nf2w0	Arntz (Wilhelm) Papers
http://www.oac.cdlib.org/findaid/ark:/13030/c83n2446	Arobateau (Red) papers
http://www.oac.cdlib.org/findaid/ark:/13030/c8cf9s61	Aroche Parra (Miguel) papers
http://www.oac.cdlib.org/findaid/ark:/13030/kt800020cf	Aroeste (Jean L.) Papers
http://www.oac.cdlib.org/findaid/ark:/13030/tf2h4n98th	Aron (Raymond) Papers
http://www.oac.cdlib.org/findaid/ark:/13030/kt0b69q19c	Aroner (Dion Louise) Papers
http://www.oac.cdlib.org/findaid/ark:/13030/tf8779p359	Arrhenius' (S.) Levnadsrön
http://www.oac.cdlib.org/findaid/ark:/13030/kt709nf1v2	Arrigo (Jean Maria) Intelligence ethics collection
http://www.oac.cdlib.org/findaid/ark:/13030/kt287032z6	Arrowsmith (Robert) papers
http://www.oac.cdlib.org/findaid/ark:/13030/c8f769x2	ARS Audiotape Collection
http://www.oac.cdlib.org/findaid/ark:/13030/kt0h4nf0w6	ARS Miscellany
http://www.oac.cdlib.org/findaid/ark:/13030/c8gx4d9p	Art and Print Collection
http://www.oac.cdlib.org/findaid/ark:/13030/kt3h4nd934	Art Center (Europe)
http://www.oac.cdlib.org/findaid/ark:/13030/kt0j49q77j	Art Center Wives Club
http://www.oac.cdlib.org/findaid/ark:/13030/c8k075n1	"Art Council. Exhibition files, minutes of meetings, and scrapbooks."
http://www.oac.cdlib.org/findaid/ark:/13030/kt909nf846	Art History 233: The Museum History and Practice Exhibit Proposals
http://www.oac.cdlib.org/findaid/ark:/13030/c8fj2hkn	Art Works: Behind the Scenes at the Getty production materials
http://www.oac.cdlib.org/findaid/ark:/13030/kt3g5035z8	Artenstein (Isaac) Papers
http://www.oac.cdlib.org/findaid/ark:/13030/c8np258q	Arthur (Allen A.) photographs
http://www.oac.cdlib.org/findaid/ark:/13030/kt6x0nd4w5	Arthur M. Ellis Collection of Photographic Negatives
http://www.oac.cdlib.org/findaid/ark:/13030/kt458034kf	Arthur Tooth &amp; Sons stock inventories and accounts
http://www.oac.cdlib.org/findaid/ark:/13030/c8th8p2b	Article and Sea Journal
http://www.oac.cdlib.org/findaid/ark:/13030/kt996nf6db	"Article Clippings (Vertical Files) Collection , circa 1880 - present"
http://www.oac.cdlib.org/findaid/ark:/13030/kt909nf469	Artis (Edward A.) miscellany
http://www.oac.cdlib.org/findaid/ark:/13030/c8m61j05	Artist and gallery ephemera
http://www.oac.cdlib.org/findaid/ark:/13030/tf8m3nb8rf	"Artistic Homes of California, 1887-1890"
http://www.oac.cdlib.org/findaid/ark:/13030/tf529004bs	Artists and Political Figures - Portraits
http://www.oac.cdlib.org/findaid/ark:/13030/kt2b69r559	Artists at the front portfolio
http://www.oac.cdlib.org/findaid/ark:/13030/tf5q2nb1dm	Artists Collection
http://www.oac.cdlib.org/findaid/ark:/13030/kt1h4nf2d7	Artists Exhibition Announcements collection
http://www.oac.cdlib.org/findaid/ark:/13030/hb2r29p1hx	Artists’ Exhibition Catalog Collection
http://www.oac.cdlib.org/findaid/ark:/13030/ft6v19n9m5	Artotypes from the San Francisco News Letter
http://www.oac.cdlib.org/findaid/ark:/13030/kt838nd45p	Arts and Architecture (School of the). Administrative files.
http://www.oac.cdlib.org/findaid/ark:/13030/c8b859g8	Arts and Architecture (School of the). Public Information Office. Administrative files.
http://www.oac.cdlib.org/findaid/ark:/13030/tf596nb3bx	Arts and Architecture (School of the). Special Projects. Event files of Etsu Garfias.
http://www.oac.cdlib.org/findaid/ark:/13030/tf2t1n98nw	Arts Commission Records
http://www.oac.cdlib.org/findaid/ark:/13030/c8pv6m3d	Arts Guide: Your Complete Guide to the Arts at Stanford
http://www.oac.cdlib.org/findaid/ark:/13030/k64m92gc	Arveson (William) Papers
http://www.oac.cdlib.org/findaid/ark:/13030/kt8290359c	Arvidson (Richard A.) diary
http://www.oac.cdlib.org/findaid/ark:/13030/tf538nb2tc	Arzner (Dorothy) Papers
http://www.oac.cdlib.org/findaid/ark:/13030/tf4z09n6v0	Asay (Jeff S.) Collection
http://www.oac.cdlib.org/findaid/ark:/13030/c8sx6fjs	Asbury Park (ferry) logbook and memorandum
http://www.oac.cdlib.org/findaid/ark:/13030/tf9z09p09t	ASCIT Board Minutes
http://www.oac.cdlib.org/findaid/ark:/13030/c8x067nk	"Ash (Roy) Papers, White House Central Files, 1969-1974"
http://www.oac.cdlib.org/findaid/ark:/13030/hb1v19p1pv	Ashburner (William) Collection of Photographs from the Geological Exploration of the Fortieth Parallel
http://www.oac.cdlib.org/findaid/ark:/13030/c8hq40hn	Ashby (Dillu) Collection
http://www.oac.cdlib.org/findaid/ark:/13030/c8vx0hs3	Ashby (Hal) papers
http://www.oac.cdlib.org/findaid/ark:/13030/kt0489r5j2	Asher (Betty) Papers
http://www.oac.cdlib.org/findaid/ark:/13030/c8vd6xd7	Asher Family Day Book
http://www.oac.cdlib.org/findaid/ark:/13030/kt0c6030nm	Ashford (Douglas Elliott) papers
http://www.oac.cdlib.org/findaid/ark:/13030/tf767nb4q2	Ashizawa (Riichi) papers
http://www.oac.cdlib.org/findaid/ark:/13030/kt4c60383f	Ashmore (Harry S.) Collection
http://www.oac.cdlib.org/findaid/ark:/13030/kt909nb3jn	Ashton (Christopher) Audiorecordings
http://www.oac.cdlib.org/findaid/ark:/13030/kt7779s1v2	Ashton Family World Travels Photograph Collection
http://www.oac.cdlib.org/findaid/ark:/13030/tf7p3006b9	Ashurst (Henry F.) Papers
http://www.oac.cdlib.org/findaid/ark:/13030/kt5v19r7m6	Asia Foundation records
http://www.oac.cdlib.org/findaid/ark:/13030/c8fn17w1	Asian American Dance Performances collection
http://www.oac.cdlib.org/findaid/ark:/13030/kt0v19r4t9	Asian American Student Alliance Collection
http://www.oac.cdlib.org/findaid/ark:/13030/kt600037vw	Asian American Students at Stanford University Newsletters and Ephemera
http://www.oac.cdlib.org/findaid/ark:/13030/tf9r29p39z	Asian American Theater Company Archives
http://www.oac.cdlib.org/findaid/ark:/13030/ft096n9854	Asian American Theater Company Archives - Annotated Catalog to Productions and Scripts
http://www.oac.cdlib.org/findaid/ark:/13030/kt1d5nf0dm	Asian Americans at Stanford Collection
http://www.oac.cdlib.org/findaid/ark:/13030/kt0870329r	Asian Culture in Southern California Ephemera Collection
http://www.oac.cdlib.org/findaid/ark:/13030/kt858035k5	Asian Newspaper Clippings Collection
http://www.oac.cdlib.org/findaid/ark:/13030/tf3m3n99kb	Asian Pacific Studies Collection
http://www.oac.cdlib.org/findaid/ark:/13030/kt9z09r51b	Asian Pictorial Collection
http://www.oac.cdlib.org/findaid/ark:/13030/kt8p3035r1	Asian subject collection
http://www.oac.cdlib.org/findaid/ark:/13030/kt609nd4z9	Asian travel collection
http://www.oac.cdlib.org/findaid/ark:/13030/kt100025b5	Asian/Pacific AIDS Coalition Records
http://www.oac.cdlib.org/findaid/ark:/13030/tf096nb0j1	Asian/Pacific Islander Lesbian Collection
http://www.oac.cdlib.org/findaid/ark:/13030/kt1p301712	Asian/Pacific Islander Tobacco Education Network Records
http://www.oac.cdlib.org/findaid/ark:/13030/c85x29q8	Asian/Pacific Lesbians and Gays (A/PLG) Records
http://www.oac.cdlib.org/findaid/ark:/13030/c89k4c1p	Asiatic Exclusion League Records
http://www.oac.cdlib.org/findaid/ark:/13030/kt3t1nf298	"Askey, John Martin, M.D., Papers"
http://www.oac.cdlib.org/findaid/ark:/13030/kt3c6035zm	Asmundson (Vigfus) Papers
http://www.oac.cdlib.org/findaid/ark:/13030/tf1v19n59n	Asociacion de Vendedores Ambulantes (Street Vendors Association) Records
http://www.oac.cdlib.org/findaid/ark:/13030/kt3779r82v	Asselstine (James K.) papers
http://www.oac.cdlib.org/findaid/ark:/13030/kt8h4nd5rk	Assembly Aging and Long Term Care Committee Records
http://www.oac.cdlib.org/findaid/ark:/13030/kt5j49r1sx	Assembly Agriculture Committee Records
http://www.oac.cdlib.org/findaid/ark:/13030/kt658033t6	Assembly Appropriations Committee Records
http://www.oac.cdlib.org/findaid/ark:/13030/kt4n39r9rm	Assembly Banking and Finance Committee Records
http://www.oac.cdlib.org/findaid/ark:/13030/c8f47r9q	Assembly Business and Professions Committee Records
http://www.oac.cdlib.org/findaid/ark:/13030/tf3199n5h4	Assembly Constitutional Amendments Committee Records
http://www.oac.cdlib.org/findaid/ark:/13030/kt096nd9bh	"Assembly Consumer Protection, Governmental Efficiency, and Economic Development Committee Records"
http://www.oac.cdlib.org/findaid/ark:/13030/c8k35wcd	Assembly Economic Development and New Technologies Committee Records
http://www.oac.cdlib.org/findaid/ark:/13030/c82v2dw4	Assembly Education Committee Records
http://www.oac.cdlib.org/findaid/ark:/13030/tf02900067	Assembly Elections and Reapportionment Committee Records
http://www.oac.cdlib.org/findaid/ark:/13030/kt8199r9bq	Assembly Environmental Safety and Toxic Materials Committee Records
http://www.oac.cdlib.org/findaid/ark:/13030/tf229001n2	Assembly Governmental Efficiency and Economy Committee Records
http://www.oac.cdlib.org/findaid/ark:/13030/tf500003kt	"Assembly Health, Public Health and Health and Welfare Committees Records"
http://www.oac.cdlib.org/findaid/ark:/13030/kt8c6034x5	Assembly Higher Education Committee Records
http://www.oac.cdlib.org/findaid/ark:/13030/c8t43s3b	Assembly Human Services Committee Records
http://www.oac.cdlib.org/findaid/ark:/13030/c8vt1qhb	Assembly Insurance Committee Records
http://www.oac.cdlib.org/findaid/ark:/13030/kt658026t6	Assembly International Trade and Development Committee Records
http://www.oac.cdlib.org/findaid/ark:/13030/kt8b69s323	Assembly Judiciary Committee Records
http://www.oac.cdlib.org/findaid/ark:/13030/kt1w101890	Assembly Labor and Employment Committee Records
http://www.oac.cdlib.org/findaid/ark:/13030/kt8h4nc11b	Assembly Local Government Committee Records
http://www.oac.cdlib.org/findaid/ark:/13030/kt129034wh	Assembly Natural Resources Committee Records
http://www.oac.cdlib.org/findaid/ark:/13030/kt809nf4fm	"Assembly Public Employees, Retirement, and Social Security Committee Records"
http://www.oac.cdlib.org/findaid/ark:/13030/kt6x0nf1j0	Assembly Transportation Committee Records
http://www.oac.cdlib.org/findaid/ark:/13030/tf7v19n8x8	Assembly Urban Affairs and Housing Committee Records
http://www.oac.cdlib.org/findaid/ark:/13030/kt0489r3d1	Assembly Utilities and Commerce Committee Records
http://www.oac.cdlib.org/findaid/ark:/13030/kt8x0nf7x6	"Assembly Water, Parks and Wildlife Committee Records"
http://www.oac.cdlib.org/findaid/ark:/13030/c8833smr	Assessment rolls Yolo County
http://www.oac.cdlib.org/findaid/ark:/13030/kt900029vb	Assessor's Office Records
http://www.oac.cdlib.org/findaid/ark:/13030/c82r3t4k	Asseyev (Tamara) Television Production Materials Collection
http://www.oac.cdlib.org/findaid/ark:/13030/kt2r29r5v8	Assistance Committee for the Democratic Opposition in Poland records
http://www.oac.cdlib.org/findaid/ark:/13030/c8s75hks	Assistant Vice Chancellor for Business. Associate Business Manager Harland B. Thompson. Administrative Files.
http://www.oac.cdlib.org/findaid/ark:/13030/c8k64kk1	Assistant Vice Chancellor for Business. Business and Transportation Services. Administrative subject files.
http://www.oac.cdlib.org/findaid/ark:/13030/c8959jsc	Assistant Vice Chancellor for Business. Child Care Services. Administrative files.
http://www.oac.cdlib.org/findaid/ark:/13030/c8dz09hb	Assistant Vice Chancellor for Business. Contracts and Grants. Administrative files.
http://www.oac.cdlib.org/findaid/ark:/13030/c8hq415k	Assistant Vice Chancellor for Business. Contracts and Materials Manager. Administrative files of Paul C. Hannum.
http://www.oac.cdlib.org/findaid/ark:/13030/c85h7hht	Assistant Vice Chancellor for Business. Correspondence files.
http://www.oac.cdlib.org/findaid/ark:/13030/c81r6rs3	Assistant Vice Chancellor for Business. Executive Assistant. Administrative files of Harland B. Thompson.
http://www.oac.cdlib.org/findaid/ark:/13030/c8jq1272	Assistant Vice Chancellor for Business. Records.
http://www.oac.cdlib.org/findaid/ark:/13030/c8x0689h	Assistant Vice Chancellor for Business. Services Manager. Administrative files of Harland B. Thompson.
http://www.oac.cdlib.org/findaid/ark:/13030/c8ng4rv2	Assistant Vice Chancellor of Facilities and Operations. Administrative files of Harland B. Thompson.
http://www.oac.cdlib.org/findaid/ark:/13030/c8bv7jcf	Associated Chambers of Commerce of the San Fernando Valley Collection
http://www.oac.cdlib.org/findaid/ark:/13030/kt8489r5k2	Associated News Service photographs
http://www.oac.cdlib.org/findaid/ark:/13030/kt2f59s092	"Associated Students of Stanford University, Athletic Committee, Records"
http://www.oac.cdlib.org/findaid/ark:/13030/tf90000706	"Associated Students of Stanford University, Institute of International Relations, Records"
http://www.oac.cdlib.org/findaid/ark:/13030/kt1b69r8qq	Associated Students of Stanford University Records
http://www.oac.cdlib.org/findaid/ark:/13030/kt9j49s3r2	"Associated Students of Stanford University, Speakers Bureau, Audio-Visual Materials"
http://www.oac.cdlib.org/findaid/ark:/13030/c8mk6f7r	Associated Students of UCLA (ASUCLA). Agendas and minutes.
http://www.oac.cdlib.org/findaid/ark:/13030/c8cf9rg6	Associated Students of UCLA (ASUCLA). Board of Directors. Agendas and minutes of meetings.
http://www.oac.cdlib.org/findaid/ark:/13030/c86q1zk6	Associated Students of UCLA (ASUCLA). Distinguished Speakers Program.
http://www.oac.cdlib.org/findaid/ark:/13030/c8qf8tmj	Associated Students of UCLA (ASUCLA). Financial reports.
http://www.oac.cdlib.org/findaid/ark:/13030/c85b04ks	Associated Students of UCLA (ASUCLA). Publications.
http://www.oac.cdlib.org/findaid/ark:/13030/c8862hv7	Associated Students of UCLA (ASUCLA). Rally Committee. Card Stunt Files.
http://www.oac.cdlib.org/findaid/ark:/13030/c8jh3njt	Associated Students of UCLA (ASUCLA). Undergraduate Students Association Council. Meeting minutes.
http://www.oac.cdlib.org/findaid/ark:/13030/kt996nf56r	Associated Students Records
http://www.oac.cdlib.org/findaid/ark:/13030/c8b27vvh	"Associated Students, University of California, Davis (ASUCD) Records"
http://www.oac.cdlib.org/findaid/ark:/13030/c8k075h7	"Associated Students, University of California, Irvine Records (University of California, Irvine)"
http://www.oac.cdlib.org/findaid/ark:/13030/c8n014z0	Associated Women for Pepperdine Records
http://www.oac.cdlib.org/findaid/ark:/13030/kt6t1nf37n	Associated Women Students Collection
http://www.oac.cdlib.org/findaid/ark:/13030/kt4000033m	Associated Women Students records
http://www.oac.cdlib.org/findaid/ark:/13030/kt067nf1q4	Associates of the Stanford University Libraries Logo and Related Correspondence
http://www.oac.cdlib.org/findaid/ark:/13030/kt2p3034q5	Associates of the Stanford University Libraries Records
http://www.oac.cdlib.org/findaid/ark:/13030/tf909nb364	"Association For Clinical Pastoral Education, Pacific Region Records"
http://www.oac.cdlib.org/findaid/ark:/13030/kt9d5nf21c	Association for Comparative Economic Studies records
http://www.oac.cdlib.org/findaid/ark:/13030/ft2m3n99kd	Association for Humanistic Psychology Records
