rel=cannonical	title	parent
http://www.oac.cdlib.org/findaid/ark:/13030/kt0f59r4f0	Baade (Fritz) memoranda	ark:/13030/tf4m3nb8sq
http://www.oac.cdlib.org/findaid/ark:/13030/tf896nb2x5	Baade (Wilhelm H.W.) Papers	ark:/13030/tf209nb609
http://www.oac.cdlib.org/findaid/ark:/13030/kt8k4035m9	Baarslag (Karl) papers	ark:/13030/tf4m3nb8sq
http://www.oac.cdlib.org/findaid/ark:/13030/kt9s20433n	Babb (Charles H.) Collection	ark:/13030/kt9f59s474
http://www.oac.cdlib.org/findaid/ark:/13030/kt1c6031vh	Babb (James) papers	ark:/13030/tf4m3nb8sq
http://www.oac.cdlib.org/findaid/ark:/13030/kt029030m4	Babb (Nancy) papers	ark:/13030/tf4m3nb8sq
http://www.oac.cdlib.org/findaid/ark:/13030/kt787034df	Babcock (Conrad Stanton) papers	ark:/13030/tf4m3nb8sq
http://www.oac.cdlib.org/findaid/ark:/13030/tf4489p0wt	"Babcock (Harry) Photograph Albums, 1881-1883"	ark:/13030/tf7r29p8s0
http://www.oac.cdlib.org/findaid/ark:/13030/kt2489r4xw	Babel' (I.) letters	ark:/13030/tf4m3nb8sq
http://www.oac.cdlib.org/findaid/ark:/13030/kt1489r5md	Babinski (Witold) typescript	ark:/13030/tf4m3nb8sq
http://www.oac.cdlib.org/findaid/ark:/13030/kt0r29r758	Babitz (Mae) papers	ark:/13030/tf129008pn
http://www.oac.cdlib.org/findaid/ark:/13030/tf938nb646	"Babitz (Sol) Collection of Research Materials, Correspondence, and Papers, 1948-1982"	ark:/13030/kt4199r6d2
http://www.oac.cdlib.org/findaid/ark:/13030/tf3t1n99d2	Baby Hygiene Committee Records	ark:/13030/tf7v19p5mm
http://www.oac.cdlib.org/findaid/ark:/13030/kt867nd0km	Baca (Herman) Papers	ark:/13030/tf5r29p653
http://www.oac.cdlib.org/findaid/ark:/13030/c8v98b5s	Baccigaluppi (Harry) Papers.	ark:/13030/tf1489p250
http://www.oac.cdlib.org/findaid/ark:/13030/kt0r29r7bv	Bach (George Leland) Papers	ark:/13030/tf458010c5
http://www.oac.cdlib.org/findaid/ark:/13030/kt3489q4fh	Bacher (Robert F.) papers	ark:/13030/tf938nc278
http://www.oac.cdlib.org/findaid/ark:/13030/kt3s20031z	Bacher (William A.) Papers	ark:/13030/tf129008pn
http://www.oac.cdlib.org/findaid/ark:/13030/kt2870026g	Back (Frank) Papers	ark:/13030/tf5r29p653
http://www.oac.cdlib.org/findaid/ark:/13030/c8ws8vq9	Back to the Ranch	ark:/13030/kt8489r6nk
http://www.oac.cdlib.org/findaid/ark:/13030/ft4d5nb18n	Bacon (Ernst) Papers	ark:/13030/tf5r29p4tz
http://www.oac.cdlib.org/findaid/ark:/13030/tf1p3002dj	Bacon (Ernst) Papers	ark:/13030/tf4000119v
http://www.oac.cdlib.org/findaid/ark:/13030/tf3c6002wf	Bacon (Ernst) Papers	ark:/13030/tf5r29p4tz
http://www.oac.cdlib.org/findaid/ark:/13030/c8h99785	Bacon Family papers	ark:/13030/tf458010c5
http://www.oac.cdlib.org/findaid/ark:/13030/c8cj8g5h	Bacon (Francis) Library Archive	ark:/13030/c8x068dv
http://www.oac.cdlib.org/findaid/ark:/13030/kt509nf4wd	Bacon (Frank) Records	ark:/13030/kt1d5nc252
http://www.oac.cdlib.org/findaid/ark:/13030/tf6d5nb1qm	Bacon (Henry D.) Papers	ark:/13030/tf209nb609
http://www.oac.cdlib.org/findaid/ark:/13030/c8gt5q9r	Bacon (Lloyd) papers	ark:/13030/c8ff3t03
http://www.oac.cdlib.org/findaid/ark:/13030/k6c8276x	Bacon (Madi) papers	ark:/13030/tf7r29p8s0
http://www.oac.cdlib.org/findaid/ark:/13030/kt8q2nf3hr	Bacon (Walter M.) typescript	ark:/13030/tf4m3nb8sq
http://www.oac.cdlib.org/findaid/ark:/13030/kt5p30049j	Badash (Lawrence) Papers	ark:/13030/kt2j49q7f8
http://www.oac.cdlib.org/findaid/ark:/13030/tf6x0nb1x0	Bade (Wilfrid) Papers	ark:/13030/tf4m3nb8sq
http://www.oac.cdlib.org/findaid/ark:/13030/tf1779n565	Bade (William F.) Papers	ark:/13030/tf7r29p8s0
http://www.oac.cdlib.org/findaid/ark:/13030/c84j0d3k	Baden (Frank) papers	ark:/13030/kt8779s1dn
http://www.oac.cdlib.org/findaid/ark:/13030/c89k4bv1	Baden (Nancy) Collection about Brazilian Literature	ark:/13030/tf129008pn
http://www.oac.cdlib.org/findaid/ark:/13030/kt4k4032jk	Bader (Charles) Papers	ark:/13030/tf6g5012g8
http://www.oac.cdlib.org/findaid/ark:/13030/kt2g5018wg	"Badges, Medals, Pins, and Buttons Collection"	ark:/13030/kt2j49q7f8
http://www.oac.cdlib.org/findaid/ark:/13030/tf9f59p2m5	Badham (Robert E.) Papers	ark:/13030/tf1p3008cx
http://www.oac.cdlib.org/findaid/ark:/13030/kt567nf0zt	"Badlam, Sr. (Alexander) Papers"	ark:/13030/kt8s2020gp
http://www.oac.cdlib.org/findaid/ark:/13030/tf787005rd	Baeck Family Papers	ark:/13030/tf7r29p8s0
http://www.oac.cdlib.org/findaid/ark:/13030/kt767nf0vw	Baehr (Carl Adolph) collection	ark:/13030/tf4m3nb8sq
http://www.oac.cdlib.org/findaid/ark:/13030/kt9g5037nf	Baehr (Nicholas E.) scripts	ark:/13030/kt4199r6d2
http://www.oac.cdlib.org/findaid/ark:/13030/c8tt4pnj	Baer (Morley) Photographs	ark:/13030/tf458010c5
http://www.oac.cdlib.org/findaid/ark:/13030/c8x350d6	Baerwald (Hans H.) papers	ark:/13030/tf129008pn
http://www.oac.cdlib.org/findaid/ark:/13030/tf309n99c9	Baez (Albert V.) Papers	ark:/13030/tf4m3nb8sq
http://www.oac.cdlib.org/findaid/ark:/13030/kt2w1035hv	Baez (Albert V.) Papers	ark:/13030/tf458010c5
http://www.oac.cdlib.org/findaid/ark:/13030/kt500036x4	Bagby (Carroll A.) papers	ark:/13030/tf4m3nb8sq
http://www.oac.cdlib.org/findaid/ark:/13030/kt1489r5pf	Bagg (Mrs L. L. S.) collection	ark:/13030/tf4m3nb8sq
http://www.oac.cdlib.org/findaid/ark:/13030/kt9f59s364	Bagley (Charles Leland) papers	ark:/13030/tf6t1nc15d
http://www.oac.cdlib.org/findaid/ark:/13030/kt4v19r776	Bagley (Charles Rutherford) papers	ark:/13030/tf4m3nb8sq
http://www.oac.cdlib.org/findaid/ark:/13030/c89p32dj	Bagley (Julian) Collection	ark:/13030/kt9c6029ms
http://www.oac.cdlib.org/findaid/ark:/13030/c85q4xs9	Bahlman (Robert) Photographs	ark:/13030/tf458010c5
http://www.oac.cdlib.org/findaid/ark:/13030/kt0489q1k6	Bail (Hamilton V.) Harvard collection	ark:/13030/tf129008pn
http://www.oac.cdlib.org/findaid/ark:/13030/kt896nf4xt	Bail (Hamilton Vaughan) typescript	ark:/13030/tf4m3nb8sq
http://www.oac.cdlib.org/findaid/ark:/13030/c8bp04x8	Bailey Family Genealogy Research Papers	ark:/13030/c8c24z6d
http://www.oac.cdlib.org/findaid/ark:/13030/kt3489q25d	Bailey (Florence M.) Papers	ark:/13030/tf7r29p8s0
http://www.oac.cdlib.org/findaid/ark:/13030/tf3f59n66k	Bailey (George A.) Papers	ark:/13030/tf5r29p4tz
http://www.oac.cdlib.org/findaid/ark:/13030/kt267nd86x	Bailey (H. S.) memorandum	ark:/13030/tf4m3nb8sq
http://www.oac.cdlib.org/findaid/ark:/13030/kt9779s0zr	Bailey (Harry Lewis) etchings and sketches	ark:/13030/tf4m3nb8sq
http://www.oac.cdlib.org/findaid/ark:/13030/tf9m3nb3g6	Bailey (James F.) Collection	ark:/13030/tf0f59p354
http://www.oac.cdlib.org/findaid/ark:/13030/tf5t1nb3zh	Bailey (June T.) Papers	ark:/13030/tf0h4nb4sw
http://www.oac.cdlib.org/findaid/ark:/13030/kt8w10390w	Bailey (Margery) Papers	ark:/13030/tf458010c5
http://www.oac.cdlib.org/findaid/ark:/13030/kt1h4n981n	Bailey (Paul D.) Papers	ark:/13030/tf129008pn
http://www.oac.cdlib.org/findaid/ark:/13030/c88w3cn5	Bailey (Percival) Collection of Papers and Photographs.	ark:/13030/tf8h4nc0sw
http://www.oac.cdlib.org/findaid/ark:/13030/c8wh2rgw	Bailey (Philip E.) Collection	ark:/13030/c8zp473v
http://www.oac.cdlib.org/findaid/ark:/13030/kt009nd61f	Bailey (Stanley Fuller) Papers	ark:/13030/tf1489p250
http://www.oac.cdlib.org/findaid/ark:/13030/c82n50q0	Bailey (Thomas Andrew) Papers	ark:/13030/tf458010c5
http://www.oac.cdlib.org/findaid/ark:/13030/tf287005f6	Bailey (Tom). While Looking At Your Hair	ark:/13030/tf5r29p653
http://www.oac.cdlib.org/findaid/ark:/13030/c8j104pf	"Bailey-Fellows House, Carol DeSantis Papers on the"	ark:/13030/kt1d5nc252
http://www.oac.cdlib.org/findaid/ark:/13030/kt3z09r64h	Bailie (J. A.) collection	ark:/13030/tf4m3nb8sq
http://www.oac.cdlib.org/findaid/ark:/13030/tf258004v8	Baily (Norman A.) Papers	ark:/13030/tf5r29p653
http://www.oac.cdlib.org/findaid/ark:/13030/kt7p3038r5	Bain (Emily J.) collection of correspondence with Lindsley (Donald B. and Ellen F.)	ark:/13030/tf8h4nc0sw
http://www.oac.cdlib.org/findaid/ark:/13030/tf800006n7	Bain (Joe S.) Papers	ark:/13030/tf009nb42r
http://www.oac.cdlib.org/findaid/ark:/13030/kt400035mp	Bainbridge (David A.) Papers	ark:/13030/tf1489p250
http://www.oac.cdlib.org/findaid/ark:/13030/kt0b69r4gv	Baird (Jay W.) papers	ark:/13030/tf4m3nb8sq
http://www.oac.cdlib.org/findaid/ark:/13030/tf4c6004f0	"Baird (Joseph A., Jr.) Collection"	ark:/13030/tf1489p250
http://www.oac.cdlib.org/findaid/ark:/13030/kt996nf6b9	Baird (Joseph) Collection of 19th-century architectural photographs	ark:/13030/kt98703819
http://www.oac.cdlib.org/findaid/ark:/13030/tf7p30069s	"Baird, Lassen, Redding, and the Reading Adobe - Views"	ark:/13030/tf7r29p8s0
http://www.oac.cdlib.org/findaid/ark:/13030/c84m9670	Baird (Thomas) and sons telegram collection	ark:/13030/tf9d5nc0sj
http://www.oac.cdlib.org/findaid/ark:/13030/tf9b69p29v	Baird (William M.) Papers	ark:/13030/tf129008pn
http://www.oac.cdlib.org/findaid/ark:/13030/kt0v19r45g	Baital'skii (Mikhail D.) memoirs	ark:/13030/tf4m3nb8sq
http://www.oac.cdlib.org/findaid/ark:/13030/kt509nc884	Baja California (Paipai) Indian Archaeological and Ethnographic Collections	ark:/13030/tf0h4nb4rc
http://www.oac.cdlib.org/findaid/ark:/13030/c8s46t6x	Bak (Sunny) Photography Collection	ark:/13030/kt2n39q9dc
http://www.oac.cdlib.org/findaid/ark:/13030/kt8489p7h3	Baker (Betty) Papers	ark:/13030/tf129008pn
http://www.oac.cdlib.org/findaid/ark:/13030/kt409nd9nf	Baker (Charles Duane) speeches	ark:/13030/tf4m3nb8sq
http://www.oac.cdlib.org/findaid/ark:/13030/kt200002d5	Baker (Charles T.) Papers	ark:/13030/kt2j49q7f8
http://www.oac.cdlib.org/findaid/ark:/13030/c8rb739q	Baker (Charlotte) Diary Collection	ark:/13030/kt0g50151g
http://www.oac.cdlib.org/findaid/ark:/13030/kt6489s147	Baker (Clifford E) Photographs of Stanford Student Life	ark:/13030/tf458010c5
http://www.oac.cdlib.org/findaid/ark:/13030/kt7x0nf8q8	"Baker (David L.) Files on Political Issues in Orange County, California"	ark:/13030/tf1p3008cx
http://www.oac.cdlib.org/findaid/ark:/13030/kt9199s3bk	"Baker, (David M.) Papers"	ark:/13030/tf8j49p7c9
http://www.oac.cdlib.org/findaid/ark:/13030/kt787034cx	Baker (Elizabeth N.) miscellaneous papers	ark:/13030/tf4m3nb8sq
http://www.oac.cdlib.org/findaid/ark:/13030/c8rr1wp1	Baker (Frank) papers	ark:/13030/tf129008pn
http://www.oac.cdlib.org/findaid/ark:/13030/kt8c601608	Baker (Frederick) Collection of Avalon City Council Minutes	ark:/13030/tf129008pn
http://www.oac.cdlib.org/findaid/ark:/13030/tf7j49n8ws	Baker (George B.) Papers	ark:/13030/tf4m3nb8sq
http://www.oac.cdlib.org/findaid/ark:/13030/kt9j49s21q	Baker (George Holbrook) Papers	ark:/13030/kt8s2020gp
http://www.oac.cdlib.org/findaid/ark:/13030/kt1779q0j5	Baker (Herbert) Papers	ark:/13030/kt4199r6d2
http://www.oac.cdlib.org/findaid/ark:/13030/c8x928qg	Baker (Hortense and R. Merritt) Photograph Album	ark:/13030/tf4779p5jq
http://www.oac.cdlib.org/findaid/ark:/13030/tf0199n45j	Baker (Howard) The papers of Dorothy and Howard Baker	ark:/13030/tf5r29p4tz
http://www.oac.cdlib.org/findaid/ark:/13030/tf9v19p0gr	Baker (Lillian) Papers	ark:/13030/tf4m3nb8sq
http://www.oac.cdlib.org/findaid/ark:/13030/kt6r29r953	Baker (Mainerd) Collection of scripts	ark:/13030/kt4199r6d2
http://www.oac.cdlib.org/findaid/ark:/13030/kt0f59r759	Baker (Michael H.) Collection of Wire Recordings	ark:/13030/kt1v19q1s6
http://www.oac.cdlib.org/findaid/ark:/13030/kt6779r76c	Baker (O. E.) mimeograph	ark:/13030/tf4m3nb8sq
http://www.oac.cdlib.org/findaid/ark:/13030/kt067n97s8	"Baker, (Obadiah E.) Papers?"	ark:/13030/tf209nb609
http://www.oac.cdlib.org/findaid/ark:/13030/c81v5fg0	"Baker (Samuel K.) (--1864) Letters, 1851-1905"	ark:/13030/kt4c60381d
http://www.oac.cdlib.org/findaid/ark:/13030/c8dn45w1	"Baker (Viroque) (1889-1980) Collection, 1916-1948"	ark:/13030/kt4c60381d
http://www.oac.cdlib.org/findaid/ark:/13030/kt6q2nf2nq	Baker (Wilder DuPuy) papers	ark:/13030/tf4m3nb8sq
http://www.oac.cdlib.org/findaid/ark:/13030/c86w9cmc	Baker (William) Papers	ark:/13030/tf6g5012g8
http://www.oac.cdlib.org/findaid/ark:/13030/kt429025g8	Bakewell &amp; Brown Photograph Collection	ark:/13030/tf7r29p8s0
http://www.oac.cdlib.org/findaid/ark:/13030/kt558035mr	Bakhtadze (Erastii Efremovich) papers	ark:/13030/tf4m3nb8sq
http://www.oac.cdlib.org/findaid/ark:/13030/c81v5czf	Bakke (Allan) Vs. Regents of UC Collections	ark:/13030/kt2j49q7f8
http://www.oac.cdlib.org/findaid/ark:/13030/c82r3tcq	Bakken (Anthony W.) Collection.	ark:/13030/tf1489p250
http://www.oac.cdlib.org/findaid/ark:/13030/tf4f59n78d	Balakshin (Petr P.) Papers	ark:/13030/tf7r29p8s0
http://www.oac.cdlib.org/findaid/ark:/13030/kt2q2nd81m	Balcena (Antony) Papers	ark:/13030/tf129008pn
http://www.oac.cdlib.org/findaid/ark:/13030/c8r78czw	Balch (Allan C.) Papers	ark:/13030/kt4c60381d
http://www.oac.cdlib.org/findaid/ark:/13030/tf8w1008j0	Baldensperger (Fernand) papers	ark:/13030/tf129008pn
http://www.oac.cdlib.org/findaid/ark:/13030/kt2n39s0nj	Balderrama (Art) Files on the 1988 AIDS Walk Orange County	ark:/13030/tf1p3008cx
http://www.oac.cdlib.org/findaid/ark:/13030/kt9000382d	Baldizon Aviles (Alvaro Jose) miscellaneous papers	ark:/13030/tf4m3nb8sq
http://www.oac.cdlib.org/findaid/ark:/13030/kt0s2031m6	Baldridge (Elizabeth Coulter) Photograph Album	ark:/13030/tf458010c5
http://www.oac.cdlib.org/findaid/ark:/13030/kt7t1nd5xt	Baldwin &amp; Howell records	ark:/13030/tf809nb9vj
http://www.oac.cdlib.org/findaid/ark:/13030/c8p84ddb	Baldwin (Clifford Park) Collection	ark:/13030/kt8489r6nk
http://www.oac.cdlib.org/findaid/ark:/13030/kt9199s2wc	Baldwin (Cyrus Grandison) Papers	ark:/13030/kt9g5023wp
http://www.oac.cdlib.org/findaid/ark:/13030/kt6k40372c	"Baldwin (Cyrus Grandison) Papers, Water Resources Collection"	ark:/13030/kt9g5023wp
http://www.oac.cdlib.org/findaid/ark:/13030/c84b32np	Baldwin Family Clippings Collection	ark:/13030/kt8489r6nk
http://www.oac.cdlib.org/findaid/ark:/13030/tf109n97sx	Baldwin Family Papers	ark:/13030/tf209nb609
http://www.oac.cdlib.org/findaid/ark:/13030/c8wd428n	Baldwin (G. Lewis) Papers	ark:/13030/tf1p3008cx
http://www.oac.cdlib.org/findaid/ark:/13030/kt9t1nf3g6	Baldwin (Norman Lee) diary	ark:/13030/tf4m3nb8sq
http://www.oac.cdlib.org/findaid/ark:/13030/c8c8288b	"Baldwin, (W.T.) notes on California land grants"	ark:/13030/tf7v19p5n4
http://www.oac.cdlib.org/findaid/ark:/13030/tf8v19p03r	Baldwin-Lima-Hamilton Corporation Records	ark:/13030/tf5r29p4tz
http://www.oac.cdlib.org/findaid/ark:/13030/tf9t1nb4dz	Bale Family Papers	ark:/13030/tf7r29p8s0
http://www.oac.cdlib.org/findaid/ark:/13030/c8nz8611	Balibar (Etienne) Papers	ark:/13030/kt1m3nb11c
http://www.oac.cdlib.org/findaid/ark:/13030/kt7f59r9hm	Balk (A.) typescript	ark:/13030/tf4m3nb8sq
http://www.oac.cdlib.org/findaid/ark:/13030/c85t3nmd	Balkan (Adele) costume design drawings	ark:/13030/c8ff3t03
http://www.oac.cdlib.org/findaid/ark:/13030/kt1s203148	Balkan Institute records	ark:/13030/tf4m3nb8sq
http://www.oac.cdlib.org/findaid/ark:/13030/tf35800635	Balke (Bruno) Papers	ark:/13030/tf5r29p653
http://www.oac.cdlib.org/findaid/ark:/13030/kt567nb87g	Ball (Gordon H.) Papers	ark:/13030/tf129008pn
http://www.oac.cdlib.org/findaid/ark:/13030/kt6m3nb1jp	Ball (Jane E.) Papers	ark:/13030/tf129008pn
http://www.oac.cdlib.org/findaid/ark:/13030/tf1f59n4p7	Ballantine (Joseph W.) Papers	ark:/13030/tf4m3nb8sq
http://www.oac.cdlib.org/findaid/ark:/13030/kt9w1023cj	Ballantyne (R.M.) Papers	ark:/13030/tf129008pn
http://www.oac.cdlib.org/findaid/ark:/13030/kt909nf72p	Ballet Folklorico de Stanford Records	ark:/13030/tf458010c5
http://www.oac.cdlib.org/findaid/ark:/13030/c828060c	Ballet Russe de Monte Carlo Press Clipping Scrapbooks	ark:/13030/tf1p3008cx
http://www.oac.cdlib.org/findaid/ark:/13030/ft9g50098d	Ballin (Hugo) papers	ark:/13030/tf129008pn
http://www.oac.cdlib.org/findaid/ark:/13030/tf509nb32t	Ballitore Collection	ark:/13030/kt2j49q7f8
http://www.oac.cdlib.org/findaid/ark:/13030/tf7p3008v1	Balloon Newspaper Epoch	ark:/13030/tf5h4nb7td
http://www.oac.cdlib.org/findaid/ark:/13030/tf4r29n78c	Ballou (Sylvester A.) Papers	ark:/13030/tf209nb609
http://www.oac.cdlib.org/findaid/ark:/13030/kt3199n669	Balsas Valley Navigation and Improvement Company. Documents	ark:/13030/tf5r29p653
http://www.oac.cdlib.org/findaid/ark:/13030/c82f7qhp	Balser (Bob) papers	ark:/13030/tf129008pn
http://www.oac.cdlib.org/findaid/ark:/13030/c8pc3354	Balsley World War I Collection	ark:/13030/kt4c60381d
http://www.oac.cdlib.org/findaid/ark:/13030/kt129030pg	Balykov (V. P.) speech	ark:/13030/tf4m3nb8sq
http://www.oac.cdlib.org/findaid/ark:/13030/c8ht2pxk	"Balzano (Michael P.) Papers, White House Central Files, 1972-1973"	ark:/13030/c8tm79dx
http://www.oac.cdlib.org/findaid/ark:/13030/kt167nd853	Ban (Takeshi) Papers	ark:/13030/tf000007c3
http://www.oac.cdlib.org/findaid/ark:/13030/kt0x0nd91s	Banam (A.) collection	ark:/13030/tf4m3nb8sq
http://www.oac.cdlib.org/findaid/ark:/13030/tf5779p12v	Bancroft Family Correspondence	ark:/13030/tf5r29p653
http://www.oac.cdlib.org/findaid/ark:/13030/tf6n39n8vm	Bancroft (Hubert H.) Papers: Additions	ark:/13030/tf7r29p8s0
http://www.oac.cdlib.org/findaid/ark:/13030/c8ft8p78	Bancroft (Hubert Howe) Papers	ark:/13030/kt8s2020gp
http://www.oac.cdlib.org/findaid/ark:/13030/kt2199r61r	Bancroft Library Manuscript Collections Guide	ark:/13030/tf7r29p8s0
http://www.oac.cdlib.org/findaid/ark:/13030/kt8k4035nt	Bancroft Library. Regional Oral History Office interview transcripts	ark:/13030/tf4m3nb8sq
http://www.oac.cdlib.org/findaid/ark:/13030/tf0t1n98gp	Bancroft (Philip) Papers	ark:/13030/tf7r29p8s0
http://www.oac.cdlib.org/findaid/ark:/13030/tf2h4n99kc	Bancroft Reference Notes	ark:/13030/tf7r29p8s0
http://www.oac.cdlib.org/findaid/ark:/13030/kt496nb0bh	Bancroft Reference Notes for British Columbia and Alaska	ark:/13030/tf7r29p8s0
http://www.oac.cdlib.org/findaid/ark:/13030/kt0z09n4mh	Bancroft Reference Notes for California	ark:/13030/tf7r29p8s0
http://www.oac.cdlib.org/findaid/ark:/13030/tf9q2nb487	Bancroft Reference Notes for Central America	ark:/13030/tf7r29p8s0
http://www.oac.cdlib.org/findaid/ark:/13030/kt8290067g	Bancroft Reference Notes for Mexico	ark:/13030/tf7r29p8s0
http://www.oac.cdlib.org/findaid/ark:/13030/tf9r29p17z	"Bancroft reference notes for the western states, excluding California"	ark:/13030/tf7r29p8s0
http://www.oac.cdlib.org/findaid/ark:/13030/tf838nb2ck	Bandel (Eugene) Papers	ark:/13030/tf5r29p4sf
http://www.oac.cdlib.org/findaid/ark:/13030/c8n87bdb	"Bandini de Baker (Arcadia) Photographs, 1904"	ark:/13030/kt4c60381d
http://www.oac.cdlib.org/findaid/ark:/13030/tf329004g7	Bandini Family Papers	ark:/13030/tf129008pn
http://www.oac.cdlib.org/findaid/ark:/13030/kt1x0nd7vj	Bandini (Franco) papers	ark:/13030/tf4m3nb8sq
http://www.oac.cdlib.org/findaid/ark:/13030/kt567nd8z7	Bane (Suda Lorena) galley proofs	ark:/13030/tf4m3nb8sq
http://www.oac.cdlib.org/findaid/ark:/13030/c8jh3nxr	Bane (Tom) Papers	ark:/13030/tf6g5012g8
http://www.oac.cdlib.org/findaid/ark:/13030/tf3b69n71t	"Bangs (E. G.) Collection, ca. 1950-1969"	ark:/13030/tf5j49p46b
http://www.oac.cdlib.org/findaid/ark:/13030/kt2779q0rk	Bangs (John A.) collection of George Edwin Burnell and Mary Lamoreaux Burnell lectures	ark:/13030/tf129008pn
http://www.oac.cdlib.org/findaid/ark:/13030/kt4n39q26h	Banham (Reyner) Papers	ark:/13030/kt98703819
http://www.oac.cdlib.org/findaid/ark:/13030/c8h41pwv	Bank of Orange Cash Account Book	ark:/13030/tf1p3008cx
http://www.oac.cdlib.org/findaid/ark:/13030/tf7g5005pp	Bank of Willows Records	ark:/13030/tf5r29p4tz
http://www.oac.cdlib.org/findaid/ark:/13030/c8vq33fq	Banks (Della Murray) Papers on Yukon Alaska	ark:/13030/kt8489r6nk
http://www.oac.cdlib.org/findaid/ark:/13030/kt2w1033tj	Banks (Harvey O.) Papers	ark:/13030/tf009nb42r
http://www.oac.cdlib.org/findaid/ark:/13030/kt7z09r49c	Banks (Joseph) Correspondence	ark:/13030/tf8h4nc0sw
http://www.oac.cdlib.org/findaid/ark:/13030/tf5x0nb12r	Banning Co. Collection	ark:/13030/tf209nb609
http://www.oac.cdlib.org/findaid/ark:/13030/c8m0445h	Banning Co. Records Addenda I	ark:/13030/tf209nb609
http://www.oac.cdlib.org/findaid/ark:/13030/c8dn45mf	Banning Co. Records Addenda II	ark:/13030/tf209nb609
http://www.oac.cdlib.org/findaid/ark:/13030/c8s75h4z	"Banning Collection, ca. late 19th-early 20th century"	ark:/13030/kt4c60381d
http://www.oac.cdlib.org/findaid/ark:/13030/kt838nd3t1	"Banning Family Collection of Photographs, Part I"	ark:/13030/tf6t1nb9mj
http://www.oac.cdlib.org/findaid/ark:/13030/kt7c6029xt	"Banning Family Collection of Photographs, Part II"	ark:/13030/tf6t1nb9mj
http://www.oac.cdlib.org/findaid/ark:/13030/kt6779r9df	Banning Library District Local History Collection	ark:/13030/kt7q2nf6fv
http://www.oac.cdlib.org/findaid/ark:/13030/c8d50m80	Banowsky (William S.) Papers	ark:/13030/kt8g5040dk
http://www.oac.cdlib.org/findaid/ark:/13030/kt2g5032qw	Banque de France typescript and printed report	ark:/13030/tf4m3nb8sq
http://www.oac.cdlib.org/findaid/ark:/13030/c8h41t0v	Baptismal Certificate for Alvin Arlom	ark:/13030/tf9d5nc0sj
http://www.oac.cdlib.org/findaid/ark:/13030/kt0199p2w7	Baraka (Imamu A.) Papers	ark:/13030/tf129008pn
http://www.oac.cdlib.org/findaid/ark:/13030/kt4m3nf0t2	Baraka (Imamu Amiri) speech	ark:/13030/tf4m3nb8sq
http://www.oac.cdlib.org/findaid/ark:/13030/tf4t1nb3z6	Baraka (Imamu Amiri) The Baptism: a comedy in one act	ark:/13030/tf5r29p653
http://www.oac.cdlib.org/findaid/ark:/13030/c8j103zm	Baranco (Arnold Vernon) Papers	ark:/13030/kt9c6029ms
http://www.oac.cdlib.org/findaid/ark:/13030/kt4v19r76p	Baranovich (M.) papers	ark:/13030/tf4m3nb8sq
http://www.oac.cdlib.org/findaid/ark:/13030/kt7f59p7cp	Barantseff (George E.) Collection	ark:/13030/tf4m3nb8sq
http://www.oac.cdlib.org/findaid/ark:/13030/tf938nb6tj	Barati (George) Papers	ark:/13030/tf5h4nb7td
http://www.oac.cdlib.org/findaid/ark:/13030/tf0q2n97jk	Baratov (N. N.) Papers	ark:/13030/tf4m3nb8sq
http://www.oac.cdlib.org/findaid/ark:/13030/kt109nd6q3	Barbe (Angelika) writings	ark:/13030/tf4m3nb8sq
http://www.oac.cdlib.org/findaid/ark:/13030/kt42903332	Barbe (Henri) typescript	ark:/13030/tf4m3nb8sq
http://www.oac.cdlib.org/findaid/ark:/13030/kt6c6006mh	Barber (Alfred E.) Papers	ark:/13030/kt2j49q7f8
http://www.oac.cdlib.org/findaid/ark:/13030/kt8z09r8rb	Barber (Alvin B.) papers	ark:/13030/tf4m3nb8sq
http://www.oac.cdlib.org/findaid/ark:/13030/tf900006w5	Barber Family Papers	ark:/13030/tf5r29p4tz
http://www.oac.cdlib.org/findaid/ark:/13030/tf98701079	Barber (Leland A.) Papers	ark:/13030/tf0h4nb4sw
http://www.oac.cdlib.org/findaid/ark:/13030/kt1n39r790	Barber School of Speech scrapbook	ark:/13030/tf6t1nc15d
http://www.oac.cdlib.org/findaid/ark:/13030/kt509nf111	Barbie (Klaus) pre-trial records	ark:/13030/tf4m3nb8sq
http://www.oac.cdlib.org/findaid/ark:/13030/kt6r29r9k9	Barbour (George B.) papers	ark:/13030/tf4m3nb8sq
http://www.oac.cdlib.org/findaid/ark:/13030/kt3q2nf18m	Barclay (Thomas Swain) Papers	ark:/13030/tf458010c5
http://www.oac.cdlib.org/findaid/ark:/13030/tf7x0nb2km	Barcza Nagyalasonyi (Gyorgy) Papers	ark:/13030/tf4m3nb8sq
http://www.oac.cdlib.org/findaid/ark:/13030/kt5h4nd45c	Bard (Leland) Collection on Michael Seyfrit	ark:/13030/kt2n39q9dc
http://www.oac.cdlib.org/findaid/ark:/13030/tf0779n45v	Bardacke (Frank) Watsonville Canneries Strike Records	ark:/13030/tf7779p81b
http://www.oac.cdlib.org/findaid/ark:/13030/kt7p30382t	Bardell Fototone Miniatures Photographs of Stanford University	ark:/13030/tf458010c5
http://www.oac.cdlib.org/findaid/ark:/13030/kt2x0nd740	Bardin (William) collection	ark:/13030/tf4m3nb8sq
http://www.oac.cdlib.org/findaid/ark:/13030/c8jh3pc0	Barela (Tim) Leonard and Larry comic strips	ark:/13030/kt2n39q9dc
http://www.oac.cdlib.org/findaid/ark:/13030/c8028tqk	Barfoed (Janus) collection	ark:/13030/c8ff3t03
http://www.oac.cdlib.org/findaid/ark:/13030/kt9b69s1q8	Bargatzky (Walter) typescript	ark:/13030/tf4m3nb8sq
http://www.oac.cdlib.org/findaid/ark:/13030/kt2d5nf1hz	Barham (E. G.) Papers	ark:/13030/tf458010c5
http://www.oac.cdlib.org/findaid/ark:/13030/c8hx1f07	Barich (Bill) Papers	ark:/13030/tf1489p250
http://www.oac.cdlib.org/findaid/ark:/13030/kt0w1031xh	Bark (Dennis L.) papers	ark:/13030/tf4m3nb8sq
http://www.oac.cdlib.org/findaid/ark:/13030/kt3x0nd9wn	Barker (Burt Brown) papers	ark:/13030/tf4m3nb8sq
http://www.oac.cdlib.org/findaid/ark:/13030/kt0v19r73w	Barker (Chester W.) Scrapbook	ark:/13030/tf458010c5
http://www.oac.cdlib.org/findaid/ark:/13030/c85m6675	"Barker (Desmond J.), Jr. Papers, White House Special Files, 1971-1973"	ark:/13030/c8tm79dx
http://www.oac.cdlib.org/findaid/ark:/13030/kt687004w1	Barker (Donald) Papers?	ark:/13030/tf209nb609
http://www.oac.cdlib.org/findaid/ark:/13030/hb0t1n991f	Barker (Horace Albert) Papers	ark:/13030/tf7r29p8s0
http://www.oac.cdlib.org/findaid/ark:/13030/tf009n978v	Barker (Jacob) Papers	ark:/13030/tf209nb609
http://www.oac.cdlib.org/findaid/ark:/13030/ft3k4003wm	Barkin (Elaine) Collection of Musical Compositions and Papers	ark:/13030/kt4199r6d2
http://www.oac.cdlib.org/findaid/ark:/13030/c8pg1tg4	Barks (Carl) Correspondence Collection	ark:/13030/c8736rx6
http://www.oac.cdlib.org/findaid/ark:/13030/tf7t1nb5w2	Barlow Family Collection of Manuscripts	ark:/13030/tf5r29p653
http://www.oac.cdlib.org/findaid/ark:/13030/kt6v19r1wr	Barlow Medical Library Construction Photographs	ark:/13030/tf8h4nc0sw
http://www.oac.cdlib.org/findaid/ark:/13030/tf9h4nb618	Barlow Medical Library Records	ark:/13030/tf8h4nc0sw
http://www.oac.cdlib.org/findaid/ark:/13030/kt538nd9t0	Barnard (David) Papers	ark:/13030/tf8j49p7c9
http://www.oac.cdlib.org/findaid/ark:/13030/c8tq632m	"Barneberg (Grace E.) Papers, 1912-1953"	ark:/13030/kt529026qp
http://www.oac.cdlib.org/findaid/ark:/13030/c8q81fb1	Barnes (B.W. Grant) papers	ark:/13030/kt2n39q9dc
http://www.oac.cdlib.org/findaid/ark:/13030/kt7779r87p	Barnes (E. Richard ) Papers	ark:/13030/tf4779p5jq
http://www.oac.cdlib.org/findaid/ark:/13030/tf82900674	Barnes (Earl) Papers	ark:/13030/tf458010c5
http://www.oac.cdlib.org/findaid/ark:/13030/kt7j49q745	Barnes (George) Collection	ark:/13030/kt4199r6d2
http://www.oac.cdlib.org/findaid/ark:/13030/c8v1243c	Barnes (Gerard) Collection	ark:/13030/kt4c60381d
http://www.oac.cdlib.org/findaid/ark:/13030/kt0t1nf15s	Barnes (Grant) collection	ark:/13030/tf4m3nb8sq
http://www.oac.cdlib.org/findaid/ark:/13030/kt6x0nf41p	Barnes (Grover) Papers	ark:/13030/kt2j49q7f8
