rel=cannonical	title	parent
http://www.oac.cdlib.org/findaid/ark:/13030/tf3h4n99b2	Beeckman (John H.) Papers	ark:/13030/tf5r29p4sf
http://www.oac.cdlib.org/findaid/ark:/13030/kt7c6042f3	Beekeeping Supply Catalog Collection	ark:/13030/tf1489p250
http://www.oac.cdlib.org/findaid/ark:/13030/tf4779n7d5	Beel (Sigmund S.) Memorabilia	ark:/13030/tf4000119v
http://www.oac.cdlib.org/findaid/ark:/13030/kt5j49r9ck	Beer (Alice Baldwin) collection	ark:/13030/tf4m3nb8sq
http://www.oac.cdlib.org/findaid/ark:/13030/kt7w1036tj	Beer (F. F.) collection	ark:/13030/tf4m3nb8sq
http://www.oac.cdlib.org/findaid/ark:/13030/c87080tg	Beerbohm (Max) Collection of Majl Ewing	ark:/13030/tf9n39p92k
http://www.oac.cdlib.org/findaid/ark:/13030/kt8199n9fx	"Beerbohm (Max, Sir) Papers"	ark:/13030/tf129008pn
http://www.oac.cdlib.org/findaid/ark:/13030/c8pv6njn	Beers (Jinx) papers	ark:/13030/tf129008pn
http://www.oac.cdlib.org/findaid/ark:/13030/kt638nf1zz	Bees of America miscellaneous records	ark:/13030/tf4m3nb8sq
http://www.oac.cdlib.org/findaid/ark:/13030/kt0c6000sb	Beever (Susanna) Papers?	ark:/13030/tf209nb609
http://www.oac.cdlib.org/findaid/ark:/13030/c8v40t5t	Begg (Eugene) Irvine Campus Soil Survey Report	ark:/13030/kt3v19n8bk
http://www.oac.cdlib.org/findaid/ark:/13030/kt996nf4x4	Beggs (James Montgomery) papers	ark:/13030/tf4m3nb8sq
http://www.oac.cdlib.org/findaid/ark:/13030/c8m046rz	Beginnings of Arts and Crafts in California	ark:/13030/kt8489r6nk
http://www.oac.cdlib.org/findaid/ark:/13030/c8765hfp	Behlmer (Rudy) papers	ark:/13030/c8ff3t03
http://www.oac.cdlib.org/findaid/ark:/13030/kt0g5030ww	Behn (Noel) Papers	ark:/13030/tf5r29p4tz
http://www.oac.cdlib.org/findaid/ark:/13030/kt4c603551	Behnke (Albert Richard) papers	ark:/13030/tf4m3nb8sq
http://www.oac.cdlib.org/findaid/ark:/13030/kt5g5020c7	Behr (Peter H.) Papers	ark:/13030/tf6g5012g8
http://www.oac.cdlib.org/findaid/ark:/13030/kt3q2nd7vv	Behr (Robert McLean) papers	ark:/13030/tf4m3nb8sq
http://www.oac.cdlib.org/findaid/ark:/13030/c82806k0	Behrendt Christmas Card Collection	ark:/13030/kt4c60381d
http://www.oac.cdlib.org/findaid/ark:/13030/kt696nf0x8	Behrendt (Hans-Otto) typescript	ark:/13030/tf4m3nb8sq
http://www.oac.cdlib.org/findaid/ark:/13030/kt1t1nd7rb	Behrendt (Karl-Otto) writings	ark:/13030/tf4m3nb8sq
http://www.oac.cdlib.org/findaid/ark:/13030/c8ht2pw4	Behrendt Manuscript Collection	ark:/13030/kt4c60381d
http://www.oac.cdlib.org/findaid/ark:/13030/c8nz894m	"Behrendt (Sam) Collection, ca.1870-1920"	ark:/13030/kt4c60381d
http://www.oac.cdlib.org/findaid/ark:/13030/kt638nf1wx	Behrens (Earl C.) typescript	ark:/13030/tf4m3nb8sq
http://www.oac.cdlib.org/findaid/ark:/13030/c88w3g2s	Behrens (J.D.) East Asian Collection	ark:/13030/c8cn7290
http://www.oac.cdlib.org/findaid/ark:/13030/kt887036qc	Beichman (Arnold) papers	ark:/13030/tf4m3nb8sq
http://www.oac.cdlib.org/findaid/ark:/13030/kt8580294x	Beilenson (Anthony C.) Papers	ark:/13030/tf129008pn
http://www.oac.cdlib.org/findaid/ark:/13030/kt2f59q891	Beilenson (Peter) Collection	ark:/13030/kt2j49q7f8
http://www.oac.cdlib.org/findaid/ark:/13030/kt2k403258	Beittel (Will) Papers	ark:/13030/kt9v19r2dx
http://www.oac.cdlib.org/findaid/ark:/13030/kt7d5nd51r	Bejarano (Guillermo) Papers	ark:/13030/kt187015vw
http://www.oac.cdlib.org/findaid/ark:/13030/kt7000351t	Bekeart (Laura H.) typescript	ark:/13030/tf4m3nb8sq
http://www.oac.cdlib.org/findaid/ark:/13030/kt700039x6	Belanger (J. J.) Papers	ark:/13030/kt2n39q9dc
http://www.oac.cdlib.org/findaid/ark:/13030/tf0h4n97ks	Belangie (Michael L.) Papers	ark:/13030/tf5r29p4tz
http://www.oac.cdlib.org/findaid/ark:/13030/tf7290058v	Belarusian subject collection	ark:/13030/tf4m3nb8sq
http://www.oac.cdlib.org/findaid/ark:/13030/kt7q2nf2mh	Belaruski narodny front adradzhen'ne issuances	ark:/13030/tf4m3nb8sq
http://www.oac.cdlib.org/findaid/ark:/13030/tf7779n8ts	Belchenko (Andrei T.) Papers	ark:/13030/tf4m3nb8sq
http://www.oac.cdlib.org/findaid/ark:/13030/tf3r29n61z	Belcher and Belcher Collection	ark:/13030/tf5r29p4sf
http://www.oac.cdlib.org/findaid/ark:/13030/kt2d5nc6hg	Belcher Atlas of Humboldt County	ark:/13030/tf609nb7vz
http://www.oac.cdlib.org/findaid/ark:/13030/tf196nb0b7	Belcher (Ernest) Papers	ark:/13030/tf129008pn
http://www.oac.cdlib.org/findaid/ark:/13030/c8r49s87	Belcher (Frank J.) Collection	ark:/13030/tf5r29p653
http://www.oac.cdlib.org/findaid/ark:/13030/kt596nd37m	Belden (Jack) Papers	ark:/13030/tf4m3nb8sq
http://www.oac.cdlib.org/findaid/ark:/13030/tf167n98g2	Belden (Josiah) Papers	ark:/13030/tf7r29p8s0
http://www.oac.cdlib.org/findaid/ark:/13030/kt3r29p4s5	Belden (Louis D.) Papers	ark:/13030/kt2j49q7f8
http://www.oac.cdlib.org/findaid/ark:/13030/kt7t1nc8w9	Belgian Congo Photograph Album	ark:/13030/kt2j49q7f8
http://www.oac.cdlib.org/findaid/ark:/13030/tf3h4n99p7	Belgian Subject Collection	ark:/13030/tf4m3nb8sq
http://www.oac.cdlib.org/findaid/ark:/13030/kt9v19r9jc	Belgium. Cour de cassation letter	ark:/13030/tf4m3nb8sq
http://www.oac.cdlib.org/findaid/ark:/13030/kt8779s1bm	"Belgium (Territory under German occupation, 1914-1918) issuances"	ark:/13030/tf4m3nb8sq
http://www.oac.cdlib.org/findaid/ark:/13030/kt4f59r91f	"Belgium (Territory under German occupation, 1940-1944) Militarbefehlshaber in Belgien und in Nordfrankreich. Propaganda-Abteilung Belgien records"	ark:/13030/tf4m3nb8sq
http://www.oac.cdlib.org/findaid/ark:/13030/kt3q2nd9g4	"Belgium (Territory under German Occupation, 1940-1944) Wirtschaftsministerium typescript"	ark:/13030/tf4m3nb8sq
http://www.oac.cdlib.org/findaid/ark:/13030/c8c53p02	Belitsky (Dr. Tatiana) Collection	ark:/13030/c8zp473v
http://www.oac.cdlib.org/findaid/ark:/13030/kt1v19r6zn	Belkin (Aaron) collection	ark:/13030/tf4m3nb8sq
http://www.oac.cdlib.org/findaid/ark:/13030/kt8c6008r5	Bell (Alexander G.) Collection of Material	ark:/13030/tf129008pn
http://www.oac.cdlib.org/findaid/ark:/13030/tf9199p2v5	Bell (Alphonzo E.) Papers	ark:/13030/tf129008pn
http://www.oac.cdlib.org/findaid/ark:/13030/kt5b69s2ng	Bell (Alphonzo) papers	ark:/13030/tf1p3009z6
http://www.oac.cdlib.org/findaid/ark:/13030/tf996nb431	Bell (Clair H.) Papers	ark:/13030/tf7r29p8s0
http://www.oac.cdlib.org/findaid/ark:/13030/kt2f59q8k5	Bell (Eric Temple) papers	ark:/13030/tf938nc278
http://www.oac.cdlib.org/findaid/ark:/13030/tf9z09p3t1	Bell (Eric Temple) Papers	ark:/13030/tf5h4nb7td
http://www.oac.cdlib.org/findaid/ark:/13030/c8154jjv	Bell Family Collection	ark:/13030/c8zp473v
http://www.oac.cdlib.org/findaid/ark:/13030/kt5f59s2gj	Bell Family Collection about Education of the Deaf	ark:/13030/tf8h4nc0sw
http://www.oac.cdlib.org/findaid/ark:/13030/kt967nd5qd	Bell (Geoffrey) Papers	ark:/13030/tf7r29p8s0
http://www.oac.cdlib.org/findaid/ark:/13030/kt9w1009j4	Bell (Henry H.) Letter	ark:/13030/kt2j49q7f8
http://www.oac.cdlib.org/findaid/ark:/13030/tf5489n78r	Bell (James A.) Papers	ark:/13030/tf209nb609
http://www.oac.cdlib.org/findaid/ark:/13030/tf809nb2k1	Bell (James F.) Papers	ark:/13030/tf4m3nb8sq
http://www.oac.cdlib.org/findaid/ark:/13030/kt2j49r5b6	Bell (Johannes) memorandum	ark:/13030/tf4m3nb8sq
http://www.oac.cdlib.org/findaid/ark:/13030/tf55800408	"Bell (John R., Captain) - Journal of: official journalist for the"	ark:/13030/tf5r29p4tz
http://www.oac.cdlib.org/findaid/ark:/13030/kt567nf2pn	Bell Labs Early Stereo Collection	ark:/13030/kt1v19q1s6
http://www.oac.cdlib.org/findaid/ark:/13030/kt0199r3mg	Bell (Lillian) slide collection	ark:/13030/tf4m3nb8sq
http://www.oac.cdlib.org/findaid/ark:/13030/kt596nf4st	"Bell (Lynn Morley), ""Belgium at the Paris Peace Conference"" Typescript"	ark:/13030/tf458010c5
http://www.oac.cdlib.org/findaid/ark:/13030/kt4h4nb277	Bell (Mackenzie) Papers	ark:/13030/tf129008pn
http://www.oac.cdlib.org/findaid/ark:/13030/kt8z09s31h	Bell (Russell W.) papers	ark:/13030/tf4m3nb8sq
http://www.oac.cdlib.org/findaid/ark:/13030/tf0d5n97tr	Bell (Susan G.) An Annotated bibliography of British Women's autobiographies	ark:/13030/tf5r29p4tz
http://www.oac.cdlib.org/findaid/ark:/13030/kt3r29r5r1	Bell (Susan G.) correspondence	ark:/13030/tf4m3nb8sq
http://www.oac.cdlib.org/findaid/ark:/13030/kt0j49r9jm	Bell (Susan G.) Curriculum Materials	ark:/13030/tf458010c5
http://www.oac.cdlib.org/findaid/ark:/13030/kt0q2nc4cs	Bellamy (Fenton G.) Collection	ark:/13030/tf5h4nb7td
http://www.oac.cdlib.org/findaid/ark:/13030/kt5290381r	Bellamy (Ralph) papers	ark:/13030/kt4199r6d2
http://www.oac.cdlib.org/findaid/ark:/13030/kt7c6007fq	Bellem (Robert) Papers	ark:/13030/tf129008pn
http://www.oac.cdlib.org/findaid/ark:/13030/k6sb43pq	Belli (Melvin M.) papers	ark:/13030/tf7r29p8s0
http://www.oac.cdlib.org/findaid/ark:/13030/kt2c6031hn	Bellin (William) Papers	ark:/13030/kt4199r6d2
http://www.oac.cdlib.org/findaid/ark:/13030/c8cz38fv	Bellinger (Terry R.) Anthropology Thesis	ark:/13030/kt8489r6nk
http://www.oac.cdlib.org/findaid/ark:/13030/kt387004bt	Bell-Muir Family Papers	ark:/13030/tf129008pn
http://www.oac.cdlib.org/findaid/ark:/13030/tf1j49n7sw	"Bellon (Walter) - Report... concerning Borego, Vallecito and Carrizo units, San Diego County"	ark:/13030/tf5r29p653
http://www.oac.cdlib.org/findaid/ark:/13030/tf8h4nb64h	Bellon (Walter) - Reports and other documents	ark:/13030/tf5r29p653
http://www.oac.cdlib.org/findaid/ark:/13030/c8hh6mfw	Bellon (Walter) Papers	ark:/13030/kt0g50151g
http://www.oac.cdlib.org/findaid/ark:/13030/kt9n39s2d2	Belloni (Charles) Letters	ark:/13030/kt8s2020gp
http://www.oac.cdlib.org/findaid/ark:/13030/tf567nb0kf	Bellquist (Eric C.) papers	ark:/13030/tf4m3nb8sq
http://www.oac.cdlib.org/findaid/ark:/13030/kt8t1nf3jx	Belmont (Alan H.) typescript	ark:/13030/tf4m3nb8sq
http://www.oac.cdlib.org/findaid/ark:/13030/kt8199s167	Belodubrovskii (Evgenii) collection	ark:/13030/tf4m3nb8sq
http://www.oac.cdlib.org/findaid/ark:/13030/c8cn74q6	Belorussian Liberation Front publications	ark:/13030/tf4m3nb8sq
http://www.oac.cdlib.org/findaid/ark:/13030/c85d8t1m	Belorusskii kongress demokraticheskikh profsoiuzov records	ark:/13030/tf4m3nb8sq
http://www.oac.cdlib.org/findaid/ark:/13030/tf8d5nb2kn	Belotti (Frank P.) Papers	ark:/13030/tf6g5012g8
http://www.oac.cdlib.org/findaid/ark:/13030/kt2199r6k1	Belt (Elmer) Papers	ark:/13030/tf8h4nc0sw
http://www.oac.cdlib.org/findaid/ark:/13030/kt4c6036j6	Beltrami (Giuliana) papers	ark:/13030/tf4m3nb8sq
http://www.oac.cdlib.org/findaid/ark:/13030/kt2k4034jx	Beltramo (Anthony) Collection	ark:/13030/kt187015vw
http://www.oac.cdlib.org/findaid/ark:/13030/c88g8jpf	"Beluga (steamer-bark, whaler) logbook"	ark:/13030/tf9d5nc0sj
http://www.oac.cdlib.org/findaid/ark:/13030/kt867nf2tn	Bemerkungen zur Frage des Gliederung der deutschen Wirtschaft : typescript	ark:/13030/tf4m3nb8sq
http://www.oac.cdlib.org/findaid/ark:/13030/c8jq11t8	Benbough Family Collection	ark:/13030/kt0g50151g
http://www.oac.cdlib.org/findaid/ark:/13030/tf3m3nb387	Bendel Family Papers	ark:/13030/tf609nb7wg
http://www.oac.cdlib.org/findaid/ark:/13030/tf8z09p0d2	Bender (Albert M.) Papers	ark:/13030/tf5r29p4tz
http://www.oac.cdlib.org/findaid/ark:/13030/tf8x0nb3jw	Bender (Albert M.) Papers	ark:/13030/tf1w10112n
http://www.oac.cdlib.org/findaid/ark:/13030/kt938nf7c0	Bender (John B.) Papers	ark:/13030/tf458010c5
http://www.oac.cdlib.org/findaid/ark:/13030/tf0f59n434	Bendetsen (Karl R.) papers	ark:/13030/tf4m3nb8sq
http://www.oac.cdlib.org/findaid/ark:/13030/c86d5rdw	Bendick (Walter) West Hollywood Veterans Day Parade Photographs	ark:/13030/kt2n39q9dc
http://www.oac.cdlib.org/findaid/ark:/13030/c8gm883r	Benedet (Javier) papers	ark:/13030/tf4m3nb8sq
http://www.oac.cdlib.org/findaid/ark:/13030/kt7b69s0f1	Benedict (Murray Reed) Papers	ark:/13030/tf7r29p8s0
http://www.oac.cdlib.org/findaid/ark:/13030/kt0h4nd89t	Benemelis (Juan F.) typescript	ark:/13030/tf4m3nb8sq
http://www.oac.cdlib.org/findaid/ark:/13030/kt487033xs	Benes (Edvard) speech	ark:/13030/tf4m3nb8sq
http://www.oac.cdlib.org/findaid/ark:/13030/kt700039zq	Benford (Gregory) papers	ark:/13030/tf6t1nc14w
http://www.oac.cdlib.org/findaid/ark:/13030/tf2f59n61p	Benicia School Board records	ark:/13030/tf7r29p8s0
http://www.oac.cdlib.org/findaid/ark:/13030/tf6p30056f	Benicia Tax Collector Records	ark:/13030/tf7r29p8s0
http://www.oac.cdlib.org/findaid/ark:/13030/tf3m3n99rx	Benin Subject Collection	ark:/13030/tf4m3nb8sq
http://www.oac.cdlib.org/findaid/ark:/13030/kt0489r3m4	Benitez (Jose Conrado) typescript	ark:/13030/tf4m3nb8sq
http://www.oac.cdlib.org/findaid/ark:/13030/kt1n39r5gm	Benitez (Tomas) Collection	ark:/13030/kt187015vw
http://www.oac.cdlib.org/findaid/ark:/13030/kt9p3036zx	Benjamin (Alfred) typescript	ark:/13030/tf4m3nb8sq
http://www.oac.cdlib.org/findaid/ark:/13030/c8057j3v	Benjamin (Gilbert G.) Jr. Subversive Activities Collection	ark:/13030/c8q52qnq
http://www.oac.cdlib.org/findaid/ark:/13030/tf4v19n9d2	Benjamin (John A.) Papers	ark:/13030/tf8h4nc0sw
http://www.oac.cdlib.org/findaid/ark:/13030/kt2f59s06h	Benjamin (John A.) Papers Addendum	ark:/13030/tf8h4nc0sw
http://www.oac.cdlib.org/findaid/ark:/13030/c82r3s8z	Benner (Robert S.) photographs of boatswains' whistles	ark:/13030/tf9d5nc0sj
http://www.oac.cdlib.org/findaid/ark:/13030/c8rb73k9	Bennett &amp; Bennett records	ark:/13030/kt8779s1dn
http://www.oac.cdlib.org/findaid/ark:/13030/kt167nd6nc	Bennett (A. E.) collection	ark:/13030/tf4m3nb8sq
http://www.oac.cdlib.org/findaid/ark:/13030/c8k076bd	Bennett (Ann) Theater Reviews	ark:/13030/tf5h4nb7td
http://www.oac.cdlib.org/findaid/ark:/13030/tf0q2n97f1	Bennett (Anne M.) Papers	ark:/13030/tf6g5012hs
http://www.oac.cdlib.org/findaid/ark:/13030/tf729005w5	Bennett (Arnold) Papers	ark:/13030/tf7r29p8s0
http://www.oac.cdlib.org/findaid/ark:/13030/c88p612g	"Bennett (Grace) Sheet Music Collection, 1891-1957"	ark:/13030/kt4c60381d
http://www.oac.cdlib.org/findaid/ark:/13030/kt1p3033k9	Bennett (H. C.) letter excerpts	ark:/13030/tf4m3nb8sq
http://www.oac.cdlib.org/findaid/ark:/13030/kt3h4nc705	Bennett (Harve) Papers	ark:/13030/kt4199r6d2
http://www.oac.cdlib.org/findaid/ark:/13030/kt8f59r9gd	Bennett (John J.) papers	ark:/13030/tf4m3nb8sq
http://www.oac.cdlib.org/findaid/ark:/13030/kt609nf5m2	Bennett (John M.) Collection	ark:/13030/tf7r29p8s0
http://www.oac.cdlib.org/findaid/ark:/13030/c81g0jqp	Bennett (Ken) San Francisco Pride Parade Photographs	ark:/13030/kt2n39q9dc
http://www.oac.cdlib.org/findaid/ark:/13030/tf4x0nb3ts	Bennett (Leslie L.) Papers	ark:/13030/tf0h4nb4sw
http://www.oac.cdlib.org/findaid/ark:/13030/tf238nb1c7	"Bennett (Leslie L.) Papers, 1921-85"	ark:/13030/tf0h4nb4sw
http://www.oac.cdlib.org/findaid/ark:/13030/tf9v19p3hq	"Bennett (Leslie L.) Papers, 1962-88"	ark:/13030/tf0h4nb4sw
http://www.oac.cdlib.org/findaid/ark:/13030/kt3199s1ds	Bennett (Merrill K.) Papers	ark:/13030/tf458010c5
http://www.oac.cdlib.org/findaid/ark:/13030/tf6n39n837	Bennett (Milly) Papers	ark:/13030/tf4m3nb8sq
http://www.oac.cdlib.org/findaid/ark:/13030/kt387030nw	Bennett (Paul G.) miscellaneous papers	ark:/13030/tf4m3nb8sq
http://www.oac.cdlib.org/findaid/ark:/13030/kt309nf0dm	Bennett (Raphael F.) The shelter of the cloth	ark:/13030/tf129008pn
http://www.oac.cdlib.org/findaid/ark:/13030/kt8z09q764	Bennett (Walter E.) photographic collection	ark:/13030/tf129008pn
http://www.oac.cdlib.org/findaid/ark:/13030/kt1489r5nx	Bennett (William John) speeches and writings	ark:/13030/tf4m3nb8sq
http://www.oac.cdlib.org/findaid/ark:/13030/kt6z09s05h	Bennigsen (Graf Adam Pavlovich) papers	ark:/13030/tf4m3nb8sq
http://www.oac.cdlib.org/findaid/ark:/13030/c81838nj	Bennis (Warren) papers	ark:/13030/kt800021wp
http://www.oac.cdlib.org/findaid/ark:/13030/c87946wf	Bennis (Warren) papers	ark:/13030/kt800021wp
http://www.oac.cdlib.org/findaid/ark:/13030/tf7d5nb4gr	Benny (Jack) Papers	ark:/13030/tf129008pn
http://www.oac.cdlib.org/findaid/ark:/13030/kt5g5027cm	Benoist-Mechin (Jacques) Papers	ark:/13030/tf4m3nb8sq
http://www.oac.cdlib.org/findaid/ark:/13030/kt4j49q8z4	Bense (Buzz) Records of the 890 Folsom Clubhouse	ark:/13030/tf8j49p7c9
http://www.oac.cdlib.org/findaid/ark:/13030/kt8n39s3cq	Bense (Henry) Papers	ark:/13030/kt8s2020gp
http://www.oac.cdlib.org/findaid/ark:/13030/tf9t1nb439	Benshoff (Will A.) Collection	ark:/13030/tf787013z0
http://www.oac.cdlib.org/findaid/ark:/13030/kt1c6010rk	Bensin (Basil M.) Papers	ark:/13030/tf4m3nb8sq
http://www.oac.cdlib.org/findaid/ark:/13030/tf5c6006nc	Benson (Arthur C.) Papers	ark:/13030/tf129008pn
http://www.oac.cdlib.org/findaid/ark:/13030/kt8580064k	Benson (E.F.) Papers	ark:/13030/tf129008pn
http://www.oac.cdlib.org/findaid/ark:/13030/tf4p3003xq	Benson (Jackson J.) Research material about Wallace Stegner	ark:/13030/tf5r29p4tz
http://www.oac.cdlib.org/findaid/ark:/13030/ft7580050r	"Benson (Jackson J.) True adventures of John Steinbeck, writer : research materials"	ark:/13030/tf5r29p4tz
http://www.oac.cdlib.org/findaid/ark:/13030/kt3k40110m	"Benson (Mary) research material about the African National Congress, South Africa"	ark:/13030/tf129008pn
http://www.oac.cdlib.org/findaid/ark:/13030/kt4p30364z	Benson (Robert L.) papers	ark:/13030/tf129008pn
http://www.oac.cdlib.org/findaid/ark:/13030/c8319wpx	Bentley (Ester F.) photographs and papers	ark:/13030/kt2n39q9dc
http://www.oac.cdlib.org/findaid/ark:/13030/kt0j49p883	Bentley Family papers	ark:/13030/tf129008pn
http://www.oac.cdlib.org/findaid/ark:/13030/c8p84d73	Bentley (Wilder) Autobiographical Manuscript	ark:/13030/kt8489r6nk
http://www.oac.cdlib.org/findaid/ark:/13030/tf9b69p2cw	Bentley (Wilder) Papers	ark:/13030/tf9n39p92k
http://www.oac.cdlib.org/findaid/ark:/13030/c8mk6bw1	Benton (Arthur) photograph collection	ark:/13030/kt8779s1dn
http://www.oac.cdlib.org/findaid/ark:/13030/tf7z09n9f5	Benton (Irving W.) Collection	ark:/13030/tf787013z0
http://www.oac.cdlib.org/findaid/ark:/13030/tf1779n4c8	Benton (Joseph A.) Papers	ark:/13030/tf5r29p4sf
http://www.oac.cdlib.org/findaid/ark:/13030/c8vh5ptc	Benzer (Seymour) papers	ark:/13030/tf938nc278
http://www.oac.cdlib.org/findaid/ark:/13030/kt958036fw	Berbig (Reinhard) memoirs	ark:/13030/tf4m3nb8sq
http://www.oac.cdlib.org/findaid/ark:/13030/kt0d5nf0zk	Berckmans (Jean) Architectural drawings	ark:/13030/kt98703819
http://www.oac.cdlib.org/findaid/ark:/13030/c8j9683h	Bercovici (Leonardo) papers	ark:/13030/c8ff3t03
http://www.oac.cdlib.org/findaid/ark:/13030/kt9870383b	Bereczky (Dr.) sound recording	ark:/13030/tf4m3nb8sq
http://www.oac.cdlib.org/findaid/ark:/13030/kt5779r9fn	Berends Family Papers	ark:/13030/kt2j49q7f8
http://www.oac.cdlib.org/findaid/ark:/13030/kt2x0nf131	Berenson (Bernard) Correspondence	ark:/13030/tf5r29p653
http://www.oac.cdlib.org/findaid/ark:/13030/kt5q2nd45p	Berenson (Doc) ships postcard collection	ark:/13030/tf9d5nc0sj
http://www.oac.cdlib.org/findaid/ark:/13030/kt0q2nb6nf	Beresney (Timothy A.) Papers	ark:/13030/tf4m3nb8sq
http://www.oac.cdlib.org/findaid/ark:/13030/kt7489r6sb	Berezhkov (V. M.) interview	ark:/13030/tf4m3nb8sq
http://www.oac.cdlib.org/findaid/ark:/13030/c88s4nwz	Berg (August) Military Papers	ark:/13030/kt4c60381d
http://www.oac.cdlib.org/findaid/ark:/13030/c8rn38nv	Berg (August) Photographs	ark:/13030/kt4c60381d
http://www.oac.cdlib.org/findaid/ark:/13030/c8w094z6	Berg (Jacob) design for architectural panels	ark:/13030/kt8779s1dn
http://www.oac.cdlib.org/findaid/ark:/13030/kt5p303606	Berg (Paul) Discusses the Beckman Center [videorecording]	ark:/13030/tf458010c5
http://www.oac.cdlib.org/findaid/ark:/13030/tf1x0n98jp	Berg (Paul) Papers	ark:/13030/tf458010c5
http://www.oac.cdlib.org/findaid/ark:/13030/tf3s2006tz	Berg (Peter). Planetedge	ark:/13030/tf5r29p653
http://www.oac.cdlib.org/findaid/ark:/13030/kt3c6035x3	"Bergel (Kurt) Collection of Viennese Dance, Theater, and Music Programs"	ark:/13030/tf1p3008cx
http://www.oac.cdlib.org/findaid/ark:/13030/kt038nd9b6	Bergen (Polly) Musical Arrangements Collection	ark:/13030/kt4199r6d2
http://www.oac.cdlib.org/findaid/ark:/13030/kt538nd9kc	Berger (Bennett M.) Papers	ark:/13030/tf1489p250
http://www.oac.cdlib.org/findaid/ark:/13030/kt2290342d	Berger Gould (Benina) processed volume	ark:/13030/tf4m3nb8sq
http://www.oac.cdlib.org/findaid/ark:/13030/c8b859km	Berger (Sanford L.) Papers	ark:/13030/c8x068dv
http://www.oac.cdlib.org/findaid/ark:/13030/kt709nf5mc	Berger (Sid) collection on B. Traven	ark:/13030/tf6t1nc14w
http://www.oac.cdlib.org/findaid/ark:/13030/kt8199s0w3	Berger (Y.) typescript	ark:/13030/tf4m3nb8sq
http://www.oac.cdlib.org/findaid/ark:/13030/tf7z09n91z	Bergery (Gaston) Papers	ark:/13030/tf4m3nb8sq
http://www.oac.cdlib.org/findaid/ark:/13030/kt667nd9dr	Bergeson (Marian) papers	ark:/13030/tf1p3008cx
http://www.oac.cdlib.org/findaid/ark:/13030/kt2x0nd8k6	Bergeson (Marian) Papers	ark:/13030/tf6g5012g8
http://www.oac.cdlib.org/findaid/ark:/13030/kt1000374g	Bergman (Stefan) Papers	ark:/13030/tf458010c5
http://www.oac.cdlib.org/findaid/ark:/13030/kt0k4031vh	"Bergson (Abram) mimeograph : Disposition of the gross national product of the USSR in 1937, 1940 and 1948"	ark:/13030/tf4m3nb8sq
http://www.oac.cdlib.org/findaid/ark:/13030/c8pk0htj	Bergstrom (Francis) Photographic Slides	ark:/13030/tf458010c5
http://www.oac.cdlib.org/findaid/ark:/13030/kt3z09r9j5	Bergstrom (Francis William) Scrapbook	ark:/13030/tf458010c5
http://www.oac.cdlib.org/findaid/ark:/13030/kt2t1nf0k4	Bericht uber die anti-nationalsozialistische Tatigkeit der bayerischen Heimatbewegung : typescript	ark:/13030/tf4m3nb8sq
http://www.oac.cdlib.org/findaid/ark:/13030/kt2p30311c	Bericht uber die kirchliche Lage in der Erzdiozese Salzburg seit Marz 1938 typescript	ark:/13030/tf4m3nb8sq
http://www.oac.cdlib.org/findaid/ark:/13030/kt4v19r78q	Beringer (Robin Marie) typescript	ark:/13030/tf4m3nb8sq
http://www.oac.cdlib.org/findaid/ark:/13030/kt8x0nf3n4	Berk (Stephen M.) typescript	ark:/13030/tf4m3nb8sq
http://www.oac.cdlib.org/findaid/ark:/13030/tf000006zd	"Berkeley and Oakland Businesses and Scenes, ca. 1900-ca. 1939"	ark:/13030/tf7r29p8s0
http://www.oac.cdlib.org/findaid/ark:/13030/c8cn75f1	Berkeley Branch Railroad Cash Book	ark:/13030/tf0f59p354
http://www.oac.cdlib.org/findaid/ark:/13030/kt4h4nc4mb	Berkeley (Calif.)	ark:/13030/tf7r29p8s0
http://www.oac.cdlib.org/findaid/ark:/13030/tf8p30071f	"Berkeley, Calif. Views - Pictorial Miscellany"	ark:/13030/tf7r29p8s0
http://www.oac.cdlib.org/findaid/ark:/13030/tf4b69n78r	"Berkeley Club Members, Board Members of the California Institution for the Deaf and Blind, and Others - Portrait Album"	ark:/13030/tf7r29p8s0
http://www.oac.cdlib.org/findaid/ark:/13030/tf296n991s	Berkeley Club Papers	ark:/13030/tf7r29p8s0
http://www.oac.cdlib.org/findaid/ark:/13030/tf3199n6fk	Berkeley Day Nursery Records	ark:/13030/tf7r29p8s0
http://www.oac.cdlib.org/findaid/ark:/13030/kt000023gz	Berkeley (Edmund C.) Papers	ark:/13030/kt5q2nd3pz
http://www.oac.cdlib.org/findaid/ark:/13030/tf7k400673	Berkeley Festival and Exhibition Collection	ark:/13030/tf4000119v
http://www.oac.cdlib.org/findaid/ark:/13030/tf7489n8kh	Berkeley Free Church Collection	ark:/13030/tf6g5012hs
http://www.oac.cdlib.org/findaid/ark:/13030/kt500023rn	Berkeley History Online	ark:/13030/kt187019nq
http://www.oac.cdlib.org/findaid/ark:/13030/tf5r29n9mt	Berkeley (Martin) Collection	ark:/13030/kt4199r6d2
http://www.oac.cdlib.org/findaid/ark:/13030/tf8w10073s	Berkeley Musical Association Programs	ark:/13030/tf4000119v
http://www.oac.cdlib.org/findaid/ark:/13030/tf6k4005gx	Berkeley Police Dept. Records	ark:/13030/tf7r29p8s0
http://www.oac.cdlib.org/findaid/ark:/13030/c8639rfr	Berkeley Presbyterian Missionary Homes Collection	ark:/13030/tf6g5012hs
http://www.oac.cdlib.org/findaid/ark:/13030/hb2b69n7b5	Berkeley Software Distribution records	ark:/13030/tf6x0nb9j5
http://www.oac.cdlib.org/findaid/ark:/13030/c8jd4w37	Berkeley Student Protest Collection	ark:/13030/kt4c60381d
http://www.oac.cdlib.org/findaid/ark:/13030/kt9n39r89z	Berkeley-Albany Church Women United	ark:/13030/tf6g5012hs
http://www.oac.cdlib.org/findaid/ark:/13030/c8xk8h8k	Berkeley-Albany Religious Census	ark:/13030/tf6g5012hs
http://www.oac.cdlib.org/findaid/ark:/13030/kt538nf1s2	Berkman 2004.11	ark:/13030/kt2g501822
http://www.oac.cdlib.org/findaid/ark:/13030/tf1d5nb15s	Berkson (Bill) 3 + 1 (Oil)	ark:/13030/tf5r29p653
http://www.oac.cdlib.org/findaid/ark:/13030/tf9199p3t4	Berkson (Bill) 7 Autobiographical Sketches	ark:/13030/tf5r29p653
http://www.oac.cdlib.org/findaid/ark:/13030/c8mp53ws	Berlandt (Konstantin) Papers	ark:/13030/tf8j49p7c9
http://www.oac.cdlib.org/findaid/ark:/13030/kt1n39n742	Berley Studios fashion drawings	ark:/13030/tf1p3008cx
http://www.oac.cdlib.org/findaid/ark:/13030/kt4z09r8r3	Berlin Document Center computer printout	ark:/13030/tf4m3nb8sq
http://www.oac.cdlib.org/findaid/ark:/13030/kt867nf5nh	Berliner Schriftleitung miscellaneous records	ark:/13030/tf4m3nb8sq
http://www.oac.cdlib.org/findaid/ark:/13030/kt4q2nf1qn	Berling (Zygmunt) papers	ark:/13030/tf4m3nb8sq
http://www.oac.cdlib.org/findaid/ark:/13030/kt9r29s1cq	Berlon (Lieutenant-Colonel) report	ark:/13030/tf4m3nb8sq
http://www.oac.cdlib.org/findaid/ark:/13030/tf8v19p32p	Berman (Daniel M.) Papers	ark:/13030/tf0h4nb4sw
http://www.oac.cdlib.org/findaid/ark:/13030/kt387030mc	Berman (Geoffrey) collection	ark:/13030/tf4m3nb8sq
http://www.oac.cdlib.org/findaid/ark:/13030/kt2779p9gb	Berman (Howard L.) Papers	ark:/13030/tf6g5012g8
http://www.oac.cdlib.org/findaid/ark:/13030/kt0m3nd6sr	Berman (Jakub) papers	ark:/13030/tf4m3nb8sq
http://www.oac.cdlib.org/findaid/ark:/13030/kt6f59s256	Berman (Lawrence V.) Papers	ark:/13030/tf458010c5
http://www.oac.cdlib.org/findaid/ark:/13030/kt729038b1	Berman (Lila) papers	ark:/13030/kt8f59q5cg
http://www.oac.cdlib.org/findaid/ark:/13030/kt638nf36j	Berman (Ralph) and Wagner (Roberta) Collection	ark:/13030/tf4779p5jq
http://www.oac.cdlib.org/findaid/ark:/13030/c8pz584c	Berman (Steve) Papers	ark:/13030/kt2n39q9dc
http://www.oac.cdlib.org/findaid/ark:/13030/kt2b69r8hx	Bermudez Varela (Enrique) papers	ark:/13030/tf4m3nb8sq
http://www.oac.cdlib.org/findaid/ark:/13030/c8rf5vkp	Bernal and Fisher Survey Records	ark:/13030/kt4c60381d
http://www.oac.cdlib.org/findaid/ark:/13030/kt5q2nf4kb	Bernal Family Papers	ark:/13030/tf209nb609
