rel=cannonical	title	parent
http://www.oac.cdlib.org/findaid/ark:/13030/kt8z09r286	Brewer (Leo) Papers	ark:/13030/tf7r29p8s0
http://www.oac.cdlib.org/findaid/ark:/13030/c8gq707w	Brewer (Lyman A.) Collection	ark:/13030/kt8489r6nk
http://www.oac.cdlib.org/findaid/ark:/13030/c8br8tnp	Brewer (Shirley G.) Collection	ark:/13030/c8zp473v
http://www.oac.cdlib.org/findaid/ark:/13030/tf5b69n73g	Brewster (Georgiana) Papers	ark:/13030/tf5r29p4sf
http://www.oac.cdlib.org/findaid/ark:/13030/kt158016d0	Brewster (James A.) Papers	ark:/13030/tf5h4nb7td
http://www.oac.cdlib.org/findaid/ark:/13030/tf3x0n99k9	Brewster (Marjorie A.) Papers	ark:/13030/kt058018bm
http://www.oac.cdlib.org/findaid/ark:/13030/kt3m3nd89d	Bricard (Jacques) report	ark:/13030/tf4m3nb8sq
http://www.oac.cdlib.org/findaid/ark:/13030/c8xw4m18	Brichta (Augustus) Lynx Creek Manuscript	ark:/13030/kt8489r6nk
http://www.oac.cdlib.org/findaid/ark:/13030/kt5v19s1bm	Brickell (John C.) Papers	ark:/13030/kt8s2020gp
http://www.oac.cdlib.org/findaid/ark:/13030/c8r78cmd	Bricker (Eugene) Photographs	ark:/13030/kt2n39q9dc
http://www.oac.cdlib.org/findaid/ark:/13030/kt62903367	Brickman (William W.) papers	ark:/13030/tf4m3nb8sq
http://www.oac.cdlib.org/findaid/ark:/13030/kt3k4035h6	The Bridge Building photographs for the Historic American Buildings Survey (HABS)	ark:/13030/tf458010c5
http://www.oac.cdlib.org/findaid/ark:/13030/kt4m3nf387	Bridge Memory Book	ark:/13030/tf458010c5
http://www.oac.cdlib.org/findaid/ark:/13030/kt1r29r9cn	Bridgeford (Jefferson) Letters	ark:/13030/kt8s2020gp
http://www.oac.cdlib.org/findaid/ark:/13030/tf1k4001n1	Bridges (Harry R.) Papers	ark:/13030/tf7q2nb9fm
http://www.oac.cdlib.org/findaid/ark:/13030/c8n87cvk	Bridges (Sandie) scrapbook	ark:/13030/kt800021wp
http://www.oac.cdlib.org/findaid/ark:/13030/tf638nb1cg	Bridgman (Lilian) Papers	ark:/13030/tf7r29p8s0
http://www.oac.cdlib.org/findaid/ark:/13030/tf4779p064	"Bridgman (Lilian) Photograph Collection, ca. 1881-1940"	ark:/13030/tf7r29p8s0
http://www.oac.cdlib.org/findaid/ark:/13030/kt2c60357f	"A Brief History of International Students at Stanford, 1891-1990."	ark:/13030/tf458010c5
http://www.oac.cdlib.org/findaid/ark:/13030/tf696nb1ft	Briegleb Collection	ark:/13030/tf4m3nb8sq
http://www.oac.cdlib.org/findaid/ark:/13030/kt6d5nf0qt	Brigger (A.L.) Papers	ark:/13030/kt9v19r2dx
http://www.oac.cdlib.org/findaid/ark:/13030/c8gh9gnr	"Briggs (Benjamin Bennett, M.D.) family papers"	ark:/13030/tf1p3009z6
http://www.oac.cdlib.org/findaid/ark:/13030/kt409nd9qg	Briggs (David Garrison) writings	ark:/13030/tf4m3nb8sq
http://www.oac.cdlib.org/findaid/ark:/13030/kt8n39s3j9	Briggs family papers	ark:/13030/tf129008pn
http://www.oac.cdlib.org/findaid/ark:/13030/kt4779s09c	"Briggs (John C.), ""A Professorial Life: An Autobiographical Account"" account"	ark:/13030/tf458010c5
http://www.oac.cdlib.org/findaid/ark:/13030/kt3199q2x4	Briggs (John V.) Papers	ark:/13030/tf6g5012g8
http://www.oac.cdlib.org/findaid/ark:/13030/kt6k40361c	Briggs (Mitchell Pirie) collection	ark:/13030/tf4m3nb8sq
http://www.oac.cdlib.org/findaid/ark:/13030/kt496nd976	Briggs (Otis Emmons) typescript	ark:/13030/tf4m3nb8sq
http://www.oac.cdlib.org/findaid/ark:/13030/kt5s20373w	Briggs (Robert M.) Papers	ark:/13030/tf4779p5jq
http://www.oac.cdlib.org/findaid/ark:/13030/tf1290044f	Brigham (Charles B.) Papers	ark:/13030/tf0h4nb4sw
http://www.oac.cdlib.org/findaid/ark:/13030/kt367nb16z	Bright (Reginald G.) Papers	ark:/13030/tf129008pn
http://www.oac.cdlib.org/findaid/ark:/13030/kt7779q458	Brightfield (Myron F.) Papers	ark:/13030/tf129008pn
http://www.oac.cdlib.org/findaid/ark:/13030/kt8g5006c5	Brighton Press Archive	ark:/13030/tf5r29p653
http://www.oac.cdlib.org/findaid/ark:/13030/ft0000019j	Brill (Charlie) Collection of Country Music Sound Recordings	ark:/13030/kt4199r6d2
http://www.oac.cdlib.org/findaid/ark:/13030/kt9w10421s	Brin (David) papers	ark:/13030/tf6t1nc14w
http://www.oac.cdlib.org/findaid/ark:/13030/kt1w10325x	Brindley (Thomas A.) typescript	ark:/13030/tf4m3nb8sq
http://www.oac.cdlib.org/findaid/ark:/13030/c8m61mqd	Brinley (Charles H.) Collection	ark:/13030/kt8489r6nk
http://www.oac.cdlib.org/findaid/ark:/13030/c8qc05pv	"Brinley (Edward, Jr.) Papers"	ark:/13030/tf209nb609
http://www.oac.cdlib.org/findaid/ark:/13030/c8ng4sqp	Brinskele (Angela) photographs	ark:/13030/tf129008pn
http://www.oac.cdlib.org/findaid/ark:/13030/kt700034nn	Brinton (Jasper T.) collection	ark:/13030/tf4m3nb8sq
http://www.oac.cdlib.org/findaid/ark:/13030/kt3t1nd0wn	Brisbane Library History Collection	ark:/13030/kt1k40300d
http://www.oac.cdlib.org/findaid/ark:/13030/kt7c60248k	"Briscoe (Jerry) Collection of Stockton, California Oral Histories"	ark:/13030/tf609nb7wg
http://www.oac.cdlib.org/findaid/ark:/13030/kt5g502295	Briscoe (Jerry) Papers on California Recall Elections	ark:/13030/tf609nb7wg
http://www.oac.cdlib.org/findaid/ark:/13030/kt5z09s28q	Briscoe (Peter) collection on B. Traven	ark:/13030/tf6t1nc14w
http://www.oac.cdlib.org/findaid/ark:/13030/c8t72jfk	Bristol (Horace) papers	ark:/13030/tf5h4nb7td
http://www.oac.cdlib.org/findaid/ark:/13030/c8vt1tbb	Bristow (Gwen)	ark:/13030/c8736rx6
http://www.oac.cdlib.org/findaid/ark:/13030/ft5d5nb0k4	"Britain (Radie) Collection of Published Editions, Photocopies, and Ozalid Copies"	ark:/13030/kt4199r6d2
http://www.oac.cdlib.org/findaid/ark:/13030/tf338nb1xt	British and American Book Auction Catalogs collection	ark:/13030/tf129008pn
http://www.oac.cdlib.org/findaid/ark:/13030/hb7199p4w1	British and British Commonwealth war posters from the Second World war	ark:/13030/tf7r29p8s0
http://www.oac.cdlib.org/findaid/ark:/13030/kt567nb8w9	British Army in Northern Pakistan Photograph Album	ark:/13030/kt2j49q7f8
http://www.oac.cdlib.org/findaid/ark:/13030/kt3p3012xq	British Army in Pakistan and Northern India Photograph Album	ark:/13030/kt2j49q7f8
http://www.oac.cdlib.org/findaid/ark:/13030/tf758005h4	British authors collection	ark:/13030/tf5r29p4tz
http://www.oac.cdlib.org/findaid/ark:/13030/tf5580041s	British Autograph Collection - Autographs of the Kings &amp; Queens &amp; Eminent Men of Great Britain	ark:/13030/tf5r29p4tz
http://www.oac.cdlib.org/findaid/ark:/13030/tf5870063f	British Charity Commission Endowed School Department Records	ark:/13030/tf129008pn
http://www.oac.cdlib.org/findaid/ark:/13030/kt538nb0v8	British Cotton Growing Assn. Records	ark:/13030/tf5r29p4tz
http://www.oac.cdlib.org/findaid/ark:/13030/kt9q2nc240	British in Egypt/World War I Photograph Album	ark:/13030/kt2j49q7f8
http://www.oac.cdlib.org/findaid/ark:/13030/c8x92c9b	British Land Patent	ark:/13030/kt8489r6nk
http://www.oac.cdlib.org/findaid/ark:/13030/kt7r29r7sr	British Library of Information collection	ark:/13030/tf4m3nb8sq
http://www.oac.cdlib.org/findaid/ark:/13030/kt4v19r6rg	"British Manuals and Guides to Magic Tricks, Conjuring, Illusions, and Prestidigination, 1915-1964"	ark:/13030/kt2j49q7f8
http://www.oac.cdlib.org/findaid/ark:/13030/tf2z09n60f	British Manuscripts Collection	ark:/13030/tf5r29p4tz
http://www.oac.cdlib.org/findaid/ark:/13030/kt8w10218q	British Military in Egypt and Iraq Photograph Album	ark:/13030/kt2j49q7f8
http://www.oac.cdlib.org/findaid/ark:/13030/kt4n39p660	British Military in India and Burma Photograph Album	ark:/13030/kt2j49q7f8
http://www.oac.cdlib.org/findaid/ark:/13030/kt8c6036dc	British Ministry of Information Library collection	ark:/13030/tf4m3nb8sq
http://www.oac.cdlib.org/findaid/ark:/13030/kt909nd7bc	British Pictorial	ark:/13030/tf4m3nb8sq
http://www.oac.cdlib.org/findaid/ark:/13030/hb409nb6wc	British political campaign posters and broadsides	ark:/13030/tf7r29p8s0
http://www.oac.cdlib.org/findaid/ark:/13030/kt9s2016q2	British Political Engravings Collection	ark:/13030/tf129008pn
http://www.oac.cdlib.org/findaid/ark:/13030/kt1z09q1m8	British Soldier's Photograph Album - Northeastern India	ark:/13030/kt2j49q7f8
http://www.oac.cdlib.org/findaid/ark:/13030/tf5870043g	British subject collection	ark:/13030/tf4m3nb8sq
http://www.oac.cdlib.org/findaid/ark:/13030/kt9g50385p	British Trade Corporation prospectus	ark:/13030/tf4m3nb8sq
http://www.oac.cdlib.org/findaid/ark:/13030/hb6g5011c7	British war posters from the First World War	ark:/13030/tf7r29p8s0
http://www.oac.cdlib.org/findaid/ark:/13030/hb4n39p2w2	British war posters from the Second World War	ark:/13030/tf7r29p8s0
http://www.oac.cdlib.org/findaid/ark:/13030/kt3g5003ms	British Women Romantic Poets	ark:/13030/tf1489p250
http://www.oac.cdlib.org/findaid/ark:/13030/kt3k4035ww	Brittin (Charles) Papers	ark:/13030/kt98703819
http://www.oac.cdlib.org/findaid/ark:/13030/tf0489n6jv	Britton (Nan) Papers	ark:/13030/tf129008pn
http://www.oac.cdlib.org/findaid/ark:/13030/c80000fb	Broadbent (Sylvia M.) papers	ark:/13030/kt2f59r49j
http://www.oac.cdlib.org/findaid/ark:/13030/c8b85b80	Broadcasting Equipment photographs	ark:/13030/tf129008pn
http://www.oac.cdlib.org/findaid/ark:/13030/kt0m3nc91c	"Broadside Ballads from England, Ireland, and the United States collection"	ark:/13030/tf129008pn
http://www.oac.cdlib.org/findaid/ark:/13030/kt8z09s24k	Broadside Collection	ark:/13030/kt2j49q7f8
http://www.oac.cdlib.org/findaid/ark:/13030/c8m61ktb	Broadus (Amber Dunkerley) and Field (Katherine) Western Sketches	ark:/13030/kt4c60381d
http://www.oac.cdlib.org/findaid/ark:/13030/kt929038vd	Brockett (Donald G.) Collection	ark:/13030/tf6g5012hs
http://www.oac.cdlib.org/findaid/ark:/13030/tf6290052f	Brodenova (Lida) Collection	ark:/13030/tf4779p5jq
http://www.oac.cdlib.org/findaid/ark:/13030/kt3d5nc6tf	Brodie (Bernard) Papers	ark:/13030/tf129008pn
http://www.oac.cdlib.org/findaid/ark:/13030/tf0x0n97nf	Brodie (Donald M.) Miscellaneous Papers	ark:/13030/tf4m3nb8sq
http://www.oac.cdlib.org/findaid/ark:/13030/kt6c6035cr	Brodin (Nils-Eric) papers	ark:/13030/tf4m3nb8sq
http://www.oac.cdlib.org/findaid/ark:/13030/c8kk9cmp	Brodkin (Karen) Research files and recorded interviews	ark:/13030/tf129008pn
http://www.oac.cdlib.org/findaid/ark:/13030/c8k35w48	Brodsky (Joseph)	ark:/13030/tf5r29p4tz
http://www.oac.cdlib.org/findaid/ark:/13030/kt5x0nf061	Brodsky (Joseph) trial transcript	ark:/13030/tf4m3nb8sq
http://www.oac.cdlib.org/findaid/ark:/13030/c8gf0v88	"Brody, David. Papers."	ark:/13030/tf1489p250
http://www.oac.cdlib.org/findaid/ark:/13030/kt3t1nd9jt	Brody (General) speech	ark:/13030/tf4m3nb8sq
http://www.oac.cdlib.org/findaid/ark:/13030/kt6199s4m8	Brody (Judit) - Thomas Kovari correspondence	ark:/13030/tf4m3nb8sq
http://www.oac.cdlib.org/findaid/ark:/13030/tf3p30041f	Brody (Ralph M.) Papers	ark:/13030/tf009nb42r
http://www.oac.cdlib.org/findaid/ark:/13030/kt2g50376j	Broida (Herbert P.) Papers	ark:/13030/kt2j49q7f8
http://www.oac.cdlib.org/findaid/ark:/13030/tf3p300330	Brokensha (David) Collection	ark:/13030/tf4m3nb8sq
http://www.oac.cdlib.org/findaid/ark:/13030/kt7m3nf343	Brombart (David) papers	ark:/13030/tf4m3nb8sq
http://www.oac.cdlib.org/findaid/ark:/13030/kt667nf0gw	Bromberg (A. T.) collection	ark:/13030/tf4m3nb8sq
http://www.oac.cdlib.org/findaid/ark:/13030/tf5f59p1rh	Bromige (David) Correspondence	ark:/13030/tf5r29p653
http://www.oac.cdlib.org/findaid/ark:/13030/c8xp76fr	Bromilow (Peter) collection on gay motorcycle clubs	ark:/13030/kt2n39q9dc
http://www.oac.cdlib.org/findaid/ark:/13030/c8hd7w89	Bromley (David) Collection	ark:/13030/kt2j49q7f8
http://www.oac.cdlib.org/findaid/ark:/13030/kt2489r52f	Brondgeest (Carel A. M.) memoir	ark:/13030/tf4m3nb8sq
http://www.oac.cdlib.org/findaid/ark:/13030/kt300031jd	Broneer (Oscar Theodore) sound recording	ark:/13030/tf4m3nb8sq
http://www.oac.cdlib.org/findaid/ark:/13030/tf538nb0fq	Bronson (Anna D.) Collection	ark:/13030/tf209nb609
http://www.oac.cdlib.org/findaid/ark:/13030/kt096nd8vs	Bronson (Lillian) papers	ark:/13030/tf6t1nc15d
http://www.oac.cdlib.org/findaid/ark:/13030/c8125tdq	Bronstein (Sidney) papers	ark:/13030/kt2n39q9dc
http://www.oac.cdlib.org/findaid/ark:/13030/kt5s2034ck	Bronston (William) Papers	ark:/13030/tf7r29p8s0
http://www.oac.cdlib.org/findaid/ark:/13030/c83t9hw0	Bronzan (Bruce) Papers	ark:/13030/tf6g5012g8
http://www.oac.cdlib.org/findaid/ark:/13030/kt7v19r266	The Bronze Screen: 100 Years of the Latino Image in Hollywood Cinema Documentary Film Production Materials	ark:/13030/kt187015vw
http://www.oac.cdlib.org/findaid/ark:/13030/kt0p303018	Brooke (Bob) Lux Video Theatre Collection	ark:/13030/kt4199r6d2
http://www.oac.cdlib.org/findaid/ark:/13030/kt867nf2zq	Brooke (Henry) 13 Weeks on the Lord Warden	ark:/13030/tf129008pn
http://www.oac.cdlib.org/findaid/ark:/13030/tf4199n998	Brooke (Jocelyn) Papers	ark:/13030/tf5r29p653
http://www.oac.cdlib.org/findaid/ark:/13030/kt8n39r9pt	Brookes (Ralph H.) typescript	ark:/13030/tf4m3nb8sq
http://www.oac.cdlib.org/findaid/ark:/13030/kt9v19r97q	Brookings Institution Seminar on Problems of U.S. Foreign Policy records	ark:/13030/tf4m3nb8sq
http://www.oac.cdlib.org/findaid/ark:/13030/kt0489r3ch	Brookins (Walter R.) Aviation Collection	ark:/13030/kt9g5023wp
http://www.oac.cdlib.org/findaid/ark:/13030/c86d5w6v	Brooks (Allan C.) papers	ark:/13030/c8dj5g7k
http://www.oac.cdlib.org/findaid/ark:/13030/kt987040v9	"Brooks (E. Howard), Vice Provost, Records"	ark:/13030/tf458010c5
http://www.oac.cdlib.org/findaid/ark:/13030/c87d2wvj	Brooks (Frederick A.) Papers	ark:/13030/tf1489p250
http://www.oac.cdlib.org/findaid/ark:/13030/kt1580234	Brooks (Gwendolyn) Papers	ark:/13030/tf7r29p8s0
http://www.oac.cdlib.org/findaid/ark:/13030/kt1580234v	Brooks (Gwendolyn) Papers	ark:/13030/tf7r29p8s0
http://www.oac.cdlib.org/findaid/ark:/13030/c8ws8v71	Brooks (John Edward) Papers	ark:/13030/kt9c6029ms
http://www.oac.cdlib.org/findaid/ark:/13030/c8d21zzf	Brooks (Richard) papers	ark:/13030/c8ff3t03
http://www.oac.cdlib.org/findaid/ark:/13030/c8g44r4n	Brooks (Ronald A.) Papers	ark:/13030/kt8489r6nk
http://www.oac.cdlib.org/findaid/ark:/13030/kt3x0nd9q2	Brooks (Sidney) papers	ark:/13030/tf4m3nb8sq
http://www.oac.cdlib.org/findaid/ark:/13030/c8zs2z82	Broom Newspapers Collection	ark:/13030/c8q52qnq
http://www.oac.cdlib.org/findaid/ark:/13030/c8br8sth	Broomstick magazine records	ark:/13030/tf129008pn
http://www.oac.cdlib.org/findaid/ark:/13030/c8dv1mn6	Broseamle (John) Suddenly A Giant: A History of CSUN Collection	ark:/13030/c8tx3gc4
http://www.oac.cdlib.org/findaid/ark:/13030/kt8t1nf378	Bross (Werner) typescript	ark:/13030/tf4m3nb8sq
http://www.oac.cdlib.org/findaid/ark:/13030/kt709nf1q0	Brossard (E. B.) papers	ark:/13030/tf4m3nb8sq
http://www.oac.cdlib.org/findaid/ark:/13030/kt6t1nf3x0	"Brother Henry F.S.C., Microfilm Collection of Early Roman Catholic California"	ark:/13030/kt9k402381
http://www.oac.cdlib.org/findaid/ark:/13030/tf8t1nb2xf	"Brotherhood of Locomotive Engineers, Pacific Division, No. 110 Collection"	ark:/13030/tf0f59p354
http://www.oac.cdlib.org/findaid/ark:/13030/tf2r29n5dv	Brotherhood of Locomotive Firemen	ark:/13030/tf0f59p354
http://www.oac.cdlib.org/findaid/ark:/13030/c83b60p4	Brotherhood of Railroad Trainmen. Sutter Lodge No. 340 Collection	ark:/13030/tf0f59p354
http://www.oac.cdlib.org/findaid/ark:/13030/tf3m3n99jt	"Brotherhood of Railway and Steamship Clerks, Freight Handlers, Express and Station Employees"	ark:/13030/tf0f59p354
http://www.oac.cdlib.org/findaid/ark:/13030/c8jw8h14	"BROTHERHOOD OF RAILWAY CARMEN OF AMERICA, KLAMATH FALLS LODGE, NO. 1332 RECORDS"	ark:/13030/tf0f59p354
http://www.oac.cdlib.org/findaid/ark:/13030/c83b61w7	Brotsky (Allan) Oral History	ark:/13030/tf7779p81b
http://www.oac.cdlib.org/findaid/ark:/13030/c8r21330	Brough (Walter) collection	ark:/13030/c8474c6x
http://www.oac.cdlib.org/findaid/ark:/13030/c8z32146	Broughton (James) Collection	ark:/13030/kt6d5nf5mp
http://www.oac.cdlib.org/findaid/ark:/13030/kt5489r83b	Broughton (Nicholas) papers	ark:/13030/tf4m3nb8sq
http://www.oac.cdlib.org/findaid/ark:/13030/c8p55pvt	Broussard (Allen E.) Papers	ark:/13030/kt4870381r
http://www.oac.cdlib.org/findaid/ark:/13030/c8jm2bfd	Brousseau World War I Collection	ark:/13030/kt4c60381d
http://www.oac.cdlib.org/findaid/ark:/13030/kt938nd1vw	Brower (David R.) Motion Picture Collection	ark:/13030/tf7r29p8s0
http://www.oac.cdlib.org/findaid/ark:/13030/hb8g5011x4	Brower (David R.) Papers	ark:/13030/tf7r29p8s0
http://www.oac.cdlib.org/findaid/ark:/13030/c8g73g23	Brower (J. V. [Jacob Vradenberg]) Autobiographical Manuscript	ark:/13030/kt8489r6nk
http://www.oac.cdlib.org/findaid/ark:/13030/c81n82t0	Brown (Amanda) Photograph Collection	ark:/13030/kt9c6029ms
http://www.oac.cdlib.org/findaid/ark:/13030/c8cn737h	Brown (Andreas) Collection	ark:/13030/kt0g50151g
http://www.oac.cdlib.org/findaid/ark:/13030/kt0779r3n9	"Brown (Andreas) collection,"	ark:/13030/tf4m3nb8sq
http://www.oac.cdlib.org/findaid/ark:/13030/c87p9000	Brown (Arch) Collection	ark:/13030/kt2n39q9dc
http://www.oac.cdlib.org/findaid/ark:/13030/tf2m3n98w6	Brown (Archie) Collection	ark:/13030/tf7779p81b
http://www.oac.cdlib.org/findaid/ark:/13030/c8hd7w6d	Brown (Arthur) Collection	ark:/13030/tf0f59p354
http://www.oac.cdlib.org/findaid/ark:/13030/kt5k4026zk	"Brown (Arthur, Jr.) papers"	ark:/13030/tf7r29p8s0
http://www.oac.cdlib.org/findaid/ark:/13030/kt3d5nd20j	"Brown (Arthur, Jr.) Photograph Collection"	ark:/13030/tf7r29p8s0
http://www.oac.cdlib.org/findaid/ark:/13030/kt5w1035sx	Brown (Arthur) Papers	ark:/13030/tf458010c5
http://www.oac.cdlib.org/findaid/ark:/13030/c8st7rrj	Brown (Barry) Collection.	ark:/13030/tf1489p250
http://www.oac.cdlib.org/findaid/ark:/13030/kt196nb6s6	Brown (Bob) papers	ark:/13030/tf129008pn
http://www.oac.cdlib.org/findaid/ark:/13030/kt6w1040c2	Brown (Charles Reynolds) Syllabi	ark:/13030/tf458010c5
http://www.oac.cdlib.org/findaid/ark:/13030/kt1c60352j	Brown (Dennis L.)	ark:/13030/tf6g5012g8
http://www.oac.cdlib.org/findaid/ark:/13030/c8w097fq	Brown Derby Restaurants photographs	ark:/13030/c8ff3t03
http://www.oac.cdlib.org/findaid/ark:/13030/kt4n39r7rn	Brown (Dillon S.) Papers	ark:/13030/tf1489p250
http://www.oac.cdlib.org/findaid/ark:/13030/c8rf5vv8	Brown (E. Coll) Collection	ark:/13030/kt4c60381d
http://www.oac.cdlib.org/findaid/ark:/13030/kt609nf3d0	Brown (Edmund G.) Edmund G. Brown Press conference recording	ark:/13030/tf4m3nb8sq
http://www.oac.cdlib.org/findaid/ark:/13030/c8zp44gj	Brown (Edward J.) Papers	ark:/13030/tf458010c5
http://www.oac.cdlib.org/findaid/ark:/13030/c8fx78fn	Brown (Edwin J.) Papers	ark:/13030/tf9v19p891
http://www.oac.cdlib.org/findaid/ark:/13030/tf3k4002v7	Brown (Elizabeth C.) papers	ark:/13030/tf4m3nb8sq
http://www.oac.cdlib.org/findaid/ark:/13030/tf1t1nb22b	Brown (Ellen) Papers	ark:/13030/tf0h4nb4sw
http://www.oac.cdlib.org/findaid/ark:/13030/kt7p3022rt	Brown (Evelyn Berger) Collection	ark:/13030/tf6g5012hs
http://www.oac.cdlib.org/findaid/ark:/13030/kt7779r7kc	Brown (Everett Somerville) papers	ark:/13030/tf4m3nb8sq
http://www.oac.cdlib.org/findaid/ark:/13030/tf0h4n973j	Brown Family Papers	ark:/13030/tf5r29p4sf
http://www.oac.cdlib.org/findaid/ark:/13030/c83779qn	Brown Family Papers	ark:/13030/kt9c6029ms
http://www.oac.cdlib.org/findaid/ark:/13030/tf4s20045g	Brown for Governor Campaign Committee Records	ark:/13030/tf7r29p8s0
http://www.oac.cdlib.org/findaid/ark:/13030/kt500036zn	Brown (Forbes H.) collection	ark:/13030/tf4m3nb8sq
http://www.oac.cdlib.org/findaid/ark:/13030/kt5q2nf475	"Brown (George I.) Papers, 1955-1990"	ark:/13030/kt2j49q7f8
http://www.oac.cdlib.org/findaid/ark:/13030/ft8v19p102	"Brown (George I.) Papers, 1962-1990"	ark:/13030/kt2j49q7f8
http://www.oac.cdlib.org/findaid/ark:/13030/kt0h4nf128	Brown (Harold Chapman) Papers	ark:/13030/tf458010c5
http://www.oac.cdlib.org/findaid/ark:/13030/kt0p3033n1	Brown (Harold K.) Papers	ark:/13030/tf4779p5jq
http://www.oac.cdlib.org/findaid/ark:/13030/kt3b69n6dc	Brown (Henry B.) Drawings?	ark:/13030/tf209nb609
http://www.oac.cdlib.org/findaid/ark:/13030/kt787034gg	Brown (Hugh Henry) miscellany	ark:/13030/tf4m3nb8sq
http://www.oac.cdlib.org/findaid/ark:/13030/c8fq9x8z	Brown (Ian Fraser) Photographs	ark:/13030/tf458010c5
http://www.oac.cdlib.org/findaid/ark:/13030/tf1b69n4gg	Brown (James A.) Papers	ark:/13030/tf5r29p4sf
http://www.oac.cdlib.org/findaid/ark:/13030/c85h7hqh	Brown (Jean) papers	ark:/13030/kt98703819
http://www.oac.cdlib.org/findaid/ark:/13030/kt6n39q41h	Brown (Joan) Papers	ark:/13030/tf7r29p8s0
http://www.oac.cdlib.org/findaid/ark:/13030/c8mc91hf	Brown (John) Letter	ark:/13030/c8736rx6
http://www.oac.cdlib.org/findaid/ark:/13030/c8z038q2	"Brown (John R. ), III Papers, White House Special Files, 1969"	ark:/13030/c8tm79dx
http://www.oac.cdlib.org/findaid/ark:/13030/tf867nb3kt	Brown (Lloyd N.) Papers	ark:/13030/tf009nb42r
http://www.oac.cdlib.org/findaid/ark:/13030/tf309nb2xn	Brown (Mary L.) Collection of Muiriana	ark:/13030/tf609nb7wg
http://www.oac.cdlib.org/findaid/ark:/13030/kt929022s1	Brown (Moses) Papers	ark:/13030/tf1489p250
http://www.oac.cdlib.org/findaid/ark:/13030/c8rf5sdm	Brown (Nate) Western Sound Archive Collection	ark:/13030/kt1v19q1s6
http://www.oac.cdlib.org/findaid/ark:/13030/kt6m3nd4kj	Brown (Norman O.) Papers	ark:/13030/tf5h4nb7td
http://www.oac.cdlib.org/findaid/ark:/13030/kt0s20229k	Brown (Orville Harry) Papers.	ark:/13030/tf8h4nc0sw
http://www.oac.cdlib.org/findaid/ark:/13030/kt387030pd	Brown (Percy) papers	ark:/13030/tf4m3nb8sq
http://www.oac.cdlib.org/findaid/ark:/13030/ft9f59p16v	Brown (Richard Blake) Manuscript and Correspondence	ark:/13030/tf1p3008cx
http://www.oac.cdlib.org/findaid/ark:/13030/kt5w1036tx	Brown (Richard) Obituaries	ark:/13030/kt8s2020gp
http://www.oac.cdlib.org/findaid/ark:/13030/kt4n39s02c	Brown (Robert McAfee) Collection	ark:/13030/tf6g5012hs
http://www.oac.cdlib.org/findaid/ark:/13030/kt7489r8bk	Brown (Ross) theater photographs	ark:/13030/tf6t1nc15d
http://www.oac.cdlib.org/findaid/ark:/13030/kt3d5nf0wg	Brown (Samuel W.) Diary and Letters	ark:/13030/tf7v19p5mm
http://www.oac.cdlib.org/findaid/ark:/13030/c8s184q3	Brown (Steve) Papers	ark:/13030/tf5h4nb7td
http://www.oac.cdlib.org/findaid/ark:/13030/kt238nb85v	Brown (Theodore V.) Papers	ark:/13030/tf129008pn
http://www.oac.cdlib.org/findaid/ark:/13030/tf5d5nb2xw	Brown (Truesdell S.) Papers	ark:/13030/tf129008pn
http://www.oac.cdlib.org/findaid/ark:/13030/ft496nb13d	Brown (Vanessa) Papers	ark:/13030/tf129008pn
http://www.oac.cdlib.org/findaid/ark:/13030/kt65803518	Brown (Walter Lyman) papers	ark:/13030/tf4m3nb8sq
http://www.oac.cdlib.org/findaid/ark:/13030/c8cz35wf	Brown (William L.) Collection	ark:/13030/kt4c60381d
http://www.oac.cdlib.org/findaid/ark:/13030/kt7j49r9js	Browne (Clyde) and the Abbey Press Collection	ark:/13030/tf9n39p92k
http://www.oac.cdlib.org/findaid/ark:/13030/kt287032t4	Browne (Elmer H. Stanleigh) papers	ark:/13030/tf4m3nb8sq
http://www.oac.cdlib.org/findaid/ark:/13030/kt2n39s07b	Browne (Eppes Wayles) Correspondence	ark:/13030/tf458010c5
http://www.oac.cdlib.org/findaid/ark:/13030/kt3s20369w	Browne (J. Ross ) Collection	ark:/13030/tf609nb7wg
http://www.oac.cdlib.org/findaid/ark:/13030/tf8p3006zx	Browne (John R.) Papers	ark:/13030/tf7r29p8s0
http://www.oac.cdlib.org/findaid/ark:/13030/kt558038t9	Browne (Kendall Carly) scripts	ark:/13030/kt4199r6d2
http://www.oac.cdlib.org/findaid/ark:/13030/tf8n39n9m3	Browne (Louis E.) Papers	ark:/13030/tf4m3nb8sq
http://www.oac.cdlib.org/findaid/ark:/13030/kt5b69r976	Browne (Mildred) Collection	ark:/13030/kt4c6034tc
http://www.oac.cdlib.org/findaid/ark:/13030/kt896nf4zb	Brownell (Samuel Miller) papers	ark:/13030/tf4m3nb8sq
http://www.oac.cdlib.org/findaid/ark:/13030/kt867nd5cx	Browner (Tara) Collection 2004.10	ark:/13030/kt2g501822
http://www.oac.cdlib.org/findaid/ark:/13030/kt538nf42n	"Browning (Christine) Files on Lesbian, Gay, Bisexual, and Transgender Issues at the University of California, Irvine"	ark:/13030/kt3v19n8bk
http://www.oac.cdlib.org/findaid/ark:/13030/tf4t1nb0jj	Brownlee (Aleta) Papers	ark:/13030/tf4m3nb8sq
http://www.oac.cdlib.org/findaid/ark:/13030/c87m08jc	Brownwell (W.A.W) drawings	ark:/13030/kt8779s1dn
http://www.oac.cdlib.org/findaid/ark:/13030/kt8j49r9w8	Brozen (Yale) papers	ark:/13030/tf4m3nb8sq
http://www.oac.cdlib.org/findaid/ark:/13030/c83f4rcg	Bérubé (Allan) Papers	ark:/13030/tf8j49p7c9
http://www.oac.cdlib.org/findaid/ark:/13030/tf3m3nb37q	Brubeck (Dave and Iola) Collection	ark:/13030/tf609nb7wg
http://www.oac.cdlib.org/findaid/ark:/13030/kt9f59r2jc	Brubeck (Howard) Papers	ark:/13030/tf609nb7wg
http://www.oac.cdlib.org/findaid/ark:/13030/kt7199r0ss	Brubeck (Iola) Susan Matheson Collection	ark:/13030/tf609nb7wg
http://www.oac.cdlib.org/findaid/ark:/13030/ft196n98kn	Bruccoli (Matthew J.) Research Materials on Kenneth Millar	ark:/13030/tf1p3008cx
http://www.oac.cdlib.org/findaid/ark:/13030/kt4w1021tr	Bruce Geller papers	ark:/13030/kt4199r6d2
http://www.oac.cdlib.org/findaid/ark:/13030/kt0199q5w4	Bruce (James Stuart and Stevey) Papers	ark:/13030/tf5r29p653
http://www.oac.cdlib.org/findaid/ark:/13030/tf2b69n84j	Brueckner (Keith A.). First years at UCSD	ark:/13030/tf5r29p653
http://www.oac.cdlib.org/findaid/ark:/13030/tf3199n909	Brueckner (Keith A.) Papers	ark:/13030/tf5r29p653
http://www.oac.cdlib.org/findaid/ark:/13030/c8pk0jbp	Bruff (J. Goldsborough) Journal and Drawings	ark:/13030/tf209nb609
http://www.oac.cdlib.org/findaid/ark:/13030/kt6p304353	Bruff (Susanna) Scrapbook	ark:/13030/tf4779p5jq
http://www.oac.cdlib.org/findaid/ark:/13030/tf996nb4f6	Brugui&amp;egrave;re (&amp;Eacute;mile A.) Collection	ark:/13030/tf4000119v
http://www.oac.cdlib.org/findaid/ark:/13030/c86m386q	Bruin Belles. Awards and scrapbooks.	ark:/13030/tf1d5nb4kf
http://www.oac.cdlib.org/findaid/ark:/13030/tf6k4007dv	"Bruin Belles. Constitution, handbooks, publications, and rosters."	ark:/13030/tf1d5nb4kf
http://www.oac.cdlib.org/findaid/ark:/13030/c89g5p5j	"Bruin Belles. Notebooks of officers: agendas, minutes and reports."	ark:/13030/tf1d5nb4kf
http://www.oac.cdlib.org/findaid/ark:/13030/c8tb18tv	Bruland (Richard) Bebop Records Art Posters Collection	ark:/13030/c8q52qnq
http://www.oac.cdlib.org/findaid/ark:/13030/tf0489n3jd	Brumagim (Mark) Collection	ark:/13030/tf7v19p5n4
http://www.oac.cdlib.org/findaid/ark:/13030/tf9t1nb6w5	Bruman (Henry J.) papers	ark:/13030/tf129008pn
