rel=cannonical	title	parent
http://www.oac.cdlib.org/findaid/ark:/13030/kt1w1034tq	"Blake (Thomas B.) Typescript, ""A semester at Stanford"""	ark:/13030/tf458010c5
http://www.oac.cdlib.org/findaid/ark:/13030/c8125tgm	Blakeney (Lena Stovall) Art and Personal Papers	ark:/13030/kt8489r6nk
http://www.oac.cdlib.org/findaid/ark:/13030/c83x88kq	Blancarte (Esther) Autograph Albums and Portrait	ark:/13030/tf1p3008cx
http://www.oac.cdlib.org/findaid/ark:/13030/tf5779p07z	Blanchard (Frederick T.) Papers	ark:/13030/tf129008pn
http://www.oac.cdlib.org/findaid/ark:/13030/c82n54hz	Blanchard (J. Richard) Papers	ark:/13030/tf1489p250
http://www.oac.cdlib.org/findaid/ark:/13030/c89p32m7	"Blanchard (Nathan W.) collection, circa 1800s-1900s"	ark:/13030/kt6n39s11z
http://www.oac.cdlib.org/findaid/ark:/13030/kt038nf1fb	Blanco Aguinaga (Carlos). Third World Studies Program Documents	ark:/13030/tf5r29p653
http://www.oac.cdlib.org/findaid/ark:/13030/tf509nb35c	Bland (Henry M.) Collection	ark:/13030/tf609nb7wg
http://www.oac.cdlib.org/findaid/ark:/13030/tf9v19p0vf	Bland (Henry M.) Papers	ark:/13030/tf7r29p8s0
http://www.oac.cdlib.org/findaid/ark:/13030/tf0t1n97qt	Bland (Raymond L.) Papers	ark:/13030/tf4m3nb8sq
http://www.oac.cdlib.org/findaid/ark:/13030/tf1d5n98kx	Blaney (Harry F.) Papers	ark:/13030/tf009nb42r
http://www.oac.cdlib.org/findaid/ark:/13030/kt9n39q6ss	Blaney (Harry F.) Papers	ark:/13030/tf129008pn
http://www.oac.cdlib.org/findaid/ark:/13030/kt6779r75v	Blank (Patrice A.) collection	ark:/13030/tf4m3nb8sq
http://www.oac.cdlib.org/findaid/ark:/13030/kt8g5037wr	Blankenhorn (Heber) typescript	ark:/13030/tf4m3nb8sq
http://www.oac.cdlib.org/findaid/ark:/13030/kt1t1nf1vf	"Blankfort, Michael and Dorothy Papers"	ark:/13030/kt5q2nf3wh
http://www.oac.cdlib.org/findaid/ark:/13030/c83f4rt9	Blankfort (Michael) papers	ark:/13030/c8ff3t03
http://www.oac.cdlib.org/findaid/ark:/13030/kt8v19s23d	Blankman (Harold) Papers	ark:/13030/kt8s2020gp
http://www.oac.cdlib.org/findaid/ark:/13030/kt0d5nf354	Blasdel (Henry Goode) Papers	ark:/13030/kt8s2020gp
http://www.oac.cdlib.org/findaid/ark:/13030/kt5w1021fc	Blass (Simcha) Hydrology of Israel Collection	ark:/13030/tf5r29p4tz
http://www.oac.cdlib.org/findaid/ark:/13030/tf9b69p05t	Blathwayt (William) Papers	ark:/13030/tf209nb609
http://www.oac.cdlib.org/findaid/ark:/13030/kt1199n4mx	Blathwayt (William) Papers?	ark:/13030/tf209nb609
http://www.oac.cdlib.org/findaid/ark:/13030/c8dn46tj	Blau (Rosalie M.) Collection	ark:/13030/c8q52qnq
http://www.oac.cdlib.org/findaid/ark:/13030/kt1199q2h9	Blauding (Captain) Photograph album	ark:/13030/tf5h4nb7td
http://www.oac.cdlib.org/findaid/ark:/13030/kt4779r6x4	Blauwvoetbond. Tak Brussel records	ark:/13030/tf4m3nb8sq
http://www.oac.cdlib.org/findaid/ark:/13030/tf9p3010q5	Blazek (Douglas). An Owl inside my head dead leaves	ark:/13030/tf5r29p653
http://www.oac.cdlib.org/findaid/ark:/13030/tf2199n75m	Bleefield (Therese) Papers	ark:/13030/tf129008pn
http://www.oac.cdlib.org/findaid/ark:/13030/c8qj7g1f	Blejer (Hector P.) Collection	ark:/13030/tf8h4nc0sw
http://www.oac.cdlib.org/findaid/ark:/13030/tf609nb3b8	Blevins (Melvin L.) Collection of Material about Water Resources in the San Fernando Valley	ark:/13030/tf129008pn
http://www.oac.cdlib.org/findaid/ark:/13030/ft567nb1h8	Bligh (Eric Walter) Collection	ark:/13030/kt2j49q7f8
http://www.oac.cdlib.org/findaid/ark:/13030/tf6f59n94x	Blinder (Naoum and Eugenia) Papers	ark:/13030/tf4000119v
http://www.oac.cdlib.org/findaid/ark:/13030/c8cv4j9q	Blinn (Marjeanne J.) collection on Frances Clarke Sayers	ark:/13030/tf129008pn
http://www.oac.cdlib.org/findaid/ark:/13030/kt3p3033tj	Blinov (Michael) papers	ark:/13030/tf4m3nb8sq
http://www.oac.cdlib.org/findaid/ark:/13030/tf5z09n8f2	Bliss (Arthur) Papers	ark:/13030/tf4000119v
http://www.oac.cdlib.org/findaid/ark:/13030/c8dz078c	Bliss (Robert) Journal	ark:/13030/kt0g50151g
http://www.oac.cdlib.org/findaid/ark:/13030/tf0s2000z6	Bliss (Tasker H.) Papers	ark:/13030/tf4m3nb8sq
http://www.oac.cdlib.org/findaid/ark:/13030/tf5489n7mx	Bliven (Bruce) - Five Million Words Later	ark:/13030/tf5r29p4tz
http://www.oac.cdlib.org/findaid/ark:/13030/tf5b69n7d4	Bliven (Bruce) Papers	ark:/13030/tf5r29p4tz
http://www.oac.cdlib.org/findaid/ark:/13030/tf5k40049j	Bloch (E. Maurice) papers	ark:/13030/kt98703819
http://www.oac.cdlib.org/findaid/ark:/13030/tf9r29p1f2	Bloch (Ernest) Papers	ark:/13030/tf4000119v
http://www.oac.cdlib.org/findaid/ark:/13030/kt3580367x	Bloch (Felix) Papers	ark:/13030/tf458010c5
http://www.oac.cdlib.org/findaid/ark:/13030/kt0d5nd93j	Bloch (Louis) mimeograph	ark:/13030/tf4m3nb8sq
http://www.oac.cdlib.org/findaid/ark:/13030/kt167nd9b5	Bloch symposium: a Stanford centennial symposium celebrating the work of Felix Bloch	ark:/13030/tf458010c5
http://www.oac.cdlib.org/findaid/ark:/13030/c8cv4k3f	Blochman Family Collection	ark:/13030/kt0g50151g
http://www.oac.cdlib.org/findaid/ark:/13030/kt8199s3md	Block (Al) Broadcast Collection	ark:/13030/kt1v19q1s6
http://www.oac.cdlib.org/findaid/ark:/13030/c80k2b3m	Block CA Society Records	ark:/13030/kt3z09r97h
http://www.oac.cdlib.org/findaid/ark:/13030/c8gt5m5q	Block (Fritz) papers	ark:/13030/kt8779s1dn
http://www.oac.cdlib.org/findaid/ark:/13030/c87d2wh2	"Block Leisure, Jacqueline (UCLA 1947). Student memorabilia."	ark:/13030/tf1d5nb4kf
http://www.oac.cdlib.org/findaid/ark:/13030/kt5q2nd3mx	Block (Martin F.) Papers	ark:/13030/kt2n39q9dc
http://www.oac.cdlib.org/findaid/ark:/13030/kt1199r5dn	Blocus de l'empire britannique par la flotte aerienne allemande en 1942 printed material	ark:/13030/tf4m3nb8sq
http://www.oac.cdlib.org/findaid/ark:/13030/kt0s20010j	Blodgett (Webster P.) Papers	ark:/13030/kt2j49q7f8
http://www.oac.cdlib.org/findaid/ark:/13030/kt1c6031t0	Blodnieks (Adolfs) holograph	ark:/13030/tf4m3nb8sq
http://www.oac.cdlib.org/findaid/ark:/13030/c8nk3gr2	Blom (Frans) Papers	ark:/13030/tf7r29p8s0
http://www.oac.cdlib.org/findaid/ark:/13030/tf8p300960	Blomquist Collection of Locomotive Fuel Consumption Studies	ark:/13030/tf609nb7wg
http://www.oac.cdlib.org/findaid/ark:/13030/tf7r29n9hw	Blood on the Border : typescript	ark:/13030/tf5r29p4tz
http://www.oac.cdlib.org/findaid/ark:/13030/c8t155qp	Blood Relatives and Tomorrow Never Comes motion picture scripts and publicity material	ark:/13030/tf129008pn
http://www.oac.cdlib.org/findaid/ark:/13030/c89g5pqq	"Bloom, Henry S. Papers"	ark:/13030/kt0r29r83q
http://www.oac.cdlib.org/findaid/ark:/13030/kt6779q55f	Bloom (Nancy J. Fostvedt Tice) Collection of Family Photographs by Will Connell	ark:/13030/tf129008pn
http://www.oac.cdlib.org/findaid/ark:/13030/kt6k40404g	Bloomenshine (Helen) Balboa Park Protective Association Collection	ark:/13030/kt0g50151g
http://www.oac.cdlib.org/findaid/ark:/13030/tf6q2nb2s3	Blote (Martin H.) Papers	ark:/13030/tf009nb42r
http://www.oac.cdlib.org/findaid/ark:/13030/c8jm2cv6	"Bludworth, (Frances ""Fannie"") Papers"	ark:/13030/kt8s2020gp
http://www.oac.cdlib.org/findaid/ark:/13030/c8ms3v83	Blue and Gold Dairy Club Records	ark:/13030/kt3z09r97h
http://www.oac.cdlib.org/findaid/ark:/13030/kt609nc08k	Blue (Ben) Papers	ark:/13030/tf129008pn
http://www.oac.cdlib.org/findaid/ark:/13030/kt258035qc	Blue Hog Channel of Frontier Mining Property Report	ark:/13030/tf7v19p5n4
http://www.oac.cdlib.org/findaid/ark:/13030/c8p84dng	Blum (Arlene) papers	ark:/13030/tf5r29p4tz
http://www.oac.cdlib.org/findaid/ark:/13030/kt6r29s3d8	Blume (John A.) Papers	ark:/13030/tf458010c5
http://www.oac.cdlib.org/findaid/ark:/13030/tf7n39p055	Blumenfeld (Aaron) Papers	ark:/13030/tf4000119v
http://www.oac.cdlib.org/findaid/ark:/13030/kt0t1nf06t	Blumenthal (Louis and Emma) Papers	ark:/13030/tf7r29p8s0
http://www.oac.cdlib.org/findaid/ark:/13030/c84q7x2q	Blumofe (Robert F.) papers	ark:/13030/c8ff3t03
http://www.oac.cdlib.org/findaid/ark:/13030/c8w094b4	Blumoff (Walt) Photographs	ark:/13030/kt2n39q9dc
http://www.oac.cdlib.org/findaid/ark:/13030/kt4489q9vf	"Blumoff (Walter ""Butterfly"") Papers and Photographs"	ark:/13030/tf8j49p7c9
http://www.oac.cdlib.org/findaid/ark:/13030/kt7290352f	Blunk (Paul) mimeograph	ark:/13030/tf4m3nb8sq
http://www.oac.cdlib.org/findaid/ark:/13030/tf7x0nb67c	Bly (Robert) Note	ark:/13030/tf5r29p653
http://www.oac.cdlib.org/findaid/ark:/13030/ft5z09n8nj	B'nai B'rith Collection of post Civil War pamphlets	ark:/13030/tf5r29p4tz
http://www.oac.cdlib.org/findaid/ark:/13030/c83t9jz9	"B'nai B'rith, District Grand Lodge No. 4 Records"	ark:/13030/tf7r29p8s0
http://www.oac.cdlib.org/findaid/ark:/13030/kt8r29s3hf	B'nai B'rith Hillel Foundation at Stanford University Photographs	ark:/13030/tf458010c5
http://www.oac.cdlib.org/findaid/ark:/13030/kt7p3038z8	B'nai B'rith Hillel Foundation at Stanford University Records	ark:/13030/tf458010c5
http://www.oac.cdlib.org/findaid/ark:/13030/tf3779n70n	Board Of Admissions And Relations With Schools Minutes	ark:/13030/tf6x0nb9j5
http://www.oac.cdlib.org/findaid/ark:/13030/kt5199s059	Board of Control Records	ark:/13030/tf6g5012g8
http://www.oac.cdlib.org/findaid/ark:/13030/kt1b69q431	Board of Education Records	ark:/13030/tf6g5012g8
http://www.oac.cdlib.org/findaid/ark:/13030/tf009n983r	Board of Educational Development Records	ark:/13030/tf6x0nb9j5
http://www.oac.cdlib.org/findaid/ark:/13030/kt787034k1	"Board of State and Territorial Commissioners of the North, Central and South American Exposition - Minutes of meetings"	ark:/13030/tf129008pn
http://www.oac.cdlib.org/findaid/ark:/13030/kt7290279k	Board of Supervisors Records	ark:/13030/kt509nc89n
http://www.oac.cdlib.org/findaid/ark:/13030/kt0g503491	Board of Trustees: Art Exhibit Records	ark:/13030/tf6g5012hs
http://www.oac.cdlib.org/findaid/ark:/13030/tf6s2004tx	"Board of Trustees, Committee on Faculty and Staff Affairs"	ark:/13030/tf7d5nb9d4
http://www.oac.cdlib.org/findaid/ark:/13030/tf2k4001z0	Board of Trustees of the California State University Collection	ark:/13030/tf7d5nb9d4
http://www.oac.cdlib.org/findaid/ark:/13030/kt5m3nf041	Boardman (Roger Sherman) typescript	ark:/13030/tf4m3nb8sq
http://www.oac.cdlib.org/findaid/ark:/13030/kt5q2nf4pw	Boardman (True) papers	ark:/13030/kt4199r6d2
http://www.oac.cdlib.org/findaid/ark:/13030/tf4x0nb0d4	Boatner (Haydon L.) Papers	ark:/13030/tf4m3nb8sq
http://www.oac.cdlib.org/findaid/ark:/13030/kt7j49r115	Boatwright (Daniel E.) Papers	ark:/13030/tf6g5012g8
http://www.oac.cdlib.org/findaid/ark:/13030/k6x34vd2	Bob Blauner research notes	ark:/13030/tf7r29p8s0
http://www.oac.cdlib.org/findaid/ark:/13030/kt8g5039gh	Bob Cormack Papers	ark:/13030/kt8489r6nk
http://www.oac.cdlib.org/findaid/ark:/13030/c8sq9278	Boberg (Dorothy) Collection	ark:/13030/c8q52qnq
http://www.oac.cdlib.org/findaid/ark:/13030/c8j96733	"Bob's Airmail Service Collection, ca.1932-1935"	ark:/13030/kt4c60381d
http://www.oac.cdlib.org/findaid/ark:/13030/tf2w100283	Boca and Loyalton Railroad Collection	ark:/13030/tf0f59p354
http://www.oac.cdlib.org/findaid/ark:/13030/tf4r29n6xq	Boccioni (Umberto) papers	ark:/13030/kt98703819
http://www.oac.cdlib.org/findaid/ark:/13030/kt0m3nd7dj	Bochan (Jean) processed volume	ark:/13030/tf4m3nb8sq
http://www.oac.cdlib.org/findaid/ark:/13030/tf1s2003xf	Bochner (Lloyd) Collection	ark:/13030/kt4199r6d2
http://www.oac.cdlib.org/findaid/ark:/13030/kt2z09r515	Bochroder (Claus) papers	ark:/13030/tf4m3nb8sq
http://www.oac.cdlib.org/findaid/ark:/13030/kt496nd955	Bock (Fedor von) typescript	ark:/13030/tf4m3nb8sq
http://www.oac.cdlib.org/findaid/ark:/13030/kt1k4031j5	Bodde (Derk) miscellaneous writings	ark:/13030/tf4m3nb8sq
http://www.oac.cdlib.org/findaid/ark:/13030/c8qj7kf2	Bodeen (DeWitt) papers	ark:/13030/c8ff3t03
http://www.oac.cdlib.org/findaid/ark:/13030/kt0b69p84q	Boder (David P.) Papers	ark:/13030/tf129008pn
http://www.oac.cdlib.org/findaid/ark:/13030/kt709nf544	Bodie (Calif.) Papers	ark:/13030/tf209nb609
http://www.oac.cdlib.org/findaid/ark:/13030/kt158009xr	Bodie Consolidated Mining Company Collection	ark:/13030/kt3g50036k
http://www.oac.cdlib.org/findaid/ark:/13030/c8s46shj	Bodilsen (F. J.) papers	ark:/13030/tf9d5nc0sj
http://www.oac.cdlib.org/findaid/ark:/13030/c8416zdb	Bodine (Louis Albert Sayre) photographs	ark:/13030/tf1870105s
http://www.oac.cdlib.org/findaid/ark:/13030/tf6w100515	Bodine (Thomas R.) Papers	ark:/13030/tf4m3nb8sq
http://www.oac.cdlib.org/findaid/ark:/13030/tf6290087g	"Bodington, (Arthur E.) Correspondence with Lawrason Brown"	ark:/13030/tf0h4nb4sw
http://www.oac.cdlib.org/findaid/ark:/13030/kt9m3nc1r5	Bodisco (Vladimir) Papers	ark:/13030/tf4m3nb8sq
http://www.oac.cdlib.org/findaid/ark:/13030/kt258032cr	Bodson (Victor) typescript	ark:/13030/tf4m3nb8sq
http://www.oac.cdlib.org/findaid/ark:/13030/c8s1846c	Bodybuilding Photographs	ark:/13030/kt2n39q9dc
http://www.oac.cdlib.org/findaid/ark:/13030/c8d21z71	"Boe (Nils A.) Papers, White House Central Files, 1969-1971"	ark:/13030/c8tm79dx
http://www.oac.cdlib.org/findaid/ark:/13030/kt609nf3bz	Boehm (Dr.) report	ark:/13030/tf4m3nb8sq
http://www.oac.cdlib.org/findaid/ark:/13030/tf1r29n50b	"Boeing Strike -- Seattle, Washington Collection"	ark:/13030/tf7779p81b
http://www.oac.cdlib.org/findaid/ark:/13030/kt4j49r56r	Boeke (Richard F. )Collection	ark:/13030/tf6g5012hs
http://www.oac.cdlib.org/findaid/ark:/13030/kt3t1nd9h9	"Boels (Jean Frederic Amedee, Baron) holograph"	ark:/13030/tf4m3nb8sq
http://www.oac.cdlib.org/findaid/ark:/13030/kt8489r78c	Boetticher (Friedrich von) typescript	ark:/13030/tf4m3nb8sq
http://www.oac.cdlib.org/findaid/ark:/13030/kt9p3036xd	Bogacz (Theodore W.) writings	ark:/13030/tf4m3nb8sq
http://www.oac.cdlib.org/findaid/ark:/13030/kt129034x1	Bogan (Gerald F.) Special Collection	ark:/13030/kt9f59s474
http://www.oac.cdlib.org/findaid/ark:/13030/kt3q2nf1wx	Bogardus (Emory) papers	ark:/13030/kt800021wp
http://www.oac.cdlib.org/findaid/ark:/13030/kt409nd9pz	Bogdanov (A.) writings	ark:/13030/tf4m3nb8sq
http://www.oac.cdlib.org/findaid/ark:/13030/kt2k4018t3	Bogert (Vincent) papers	ark:/13030/kt4199r6d2
http://www.oac.cdlib.org/findaid/ark:/13030/kt0d5nd7pc	Bogigian Fruit Ranch Receipts Collection.	ark:/13030/kt9g5023wp
http://www.oac.cdlib.org/findaid/ark:/13030/kt6w10376d	Bogoiavlensky (Nikolai) Vasil'evich correspondence	ark:/13030/tf4m3nb8sq
http://www.oac.cdlib.org/findaid/ark:/13030/kt9779s448	"Bogue (George R.) Scrapbook, ""Reminiscences of Football Days at Stanford"""	ark:/13030/tf458010c5
http://www.oac.cdlib.org/findaid/ark:/13030/tf038n973x	Bohannan (Charles T. R.) Papers	ark:/13030/tf4m3nb8sq
http://www.oac.cdlib.org/findaid/ark:/13030/kt9v19s1t3	Bohart (R.M.) Papers	ark:/13030/tf1489p250
http://www.oac.cdlib.org/findaid/ark:/13030/kt600004ph	Bohemian Grove and California Views	ark:/13030/tf7r29p8s0
http://www.oac.cdlib.org/findaid/ark:/13030/kt8199s1nz	Bohmer (Peter) Collection	ark:/13030/tf4779p5jq
http://www.oac.cdlib.org/findaid/ark:/13030/kt4r29q7sc	Bohn (Ronald) Collection of Film and Television Music Sound Recordings	ark:/13030/kt4199r6d2
http://www.oac.cdlib.org/findaid/ark:/13030/kt5x0nd2ww	Bohnett-Evans Family Papers	ark:/13030/tf7r29p8s0
http://www.oac.cdlib.org/findaid/ark:/13030/kt0489r72s	Boime (Albert) papers	ark:/13030/tf129008pn
http://www.oac.cdlib.org/findaid/ark:/13030/c8bg2pss	"Bois de Boulogne, Château de Saint-Cloud, and Mont-Saint-Michel Photograph album"	ark:/13030/tf129008pn
http://www.oac.cdlib.org/findaid/ark:/13030/kt696nf4gg	"Boisjoly, Roger and Roberta (NASA Challenger Disaster Collection)"	ark:/13030/kt4779r888
http://www.oac.cdlib.org/findaid/ark:/13030/kt200030f2	Boisot (Marcel) writings	ark:/13030/tf4m3nb8sq
http://www.oac.cdlib.org/findaid/ark:/13030/kt1489r854	Boivin (Sherman Burns) Photographs	ark:/13030/tf458010c5
http://www.oac.cdlib.org/findaid/ark:/13030/tf3j49n67r	Bok (Mariia Petrovna) Papers	ark:/13030/tf4m3nb8sq
http://www.oac.cdlib.org/findaid/ark:/13030/kt7489q96j	Bolan (Robert K.) Papers	ark:/13030/tf0h4nb4sw
http://www.oac.cdlib.org/findaid/ark:/13030/kt8t1nf357	Boland (Francis Halsey) miscellany	ark:/13030/tf4m3nb8sq
http://www.oac.cdlib.org/findaid/ark:/13030/kt8g5036r6	Boland (Paula) Papers	ark:/13030/tf6g5012g8
http://www.oac.cdlib.org/findaid/ark:/13030/kt4199r6p6	Bolander (Louis H.) mimeograph	ark:/13030/tf4m3nb8sq
http://www.oac.cdlib.org/findaid/ark:/13030/tf4r29p0f1	Boldrey (Edwin B.) Papers	ark:/13030/tf0h4nb4sw
http://www.oac.cdlib.org/findaid/ark:/13030/kt809nf5q7	Boldyreff (Constantin W.) papers	ark:/13030/tf4m3nb8sq
http://www.oac.cdlib.org/findaid/ark:/13030/kt7c6037k4	Boldyrev (Vasilii Grigorievich) typescript	ark:/13030/tf4m3nb8sq
http://www.oac.cdlib.org/findaid/ark:/13030/kt4779q0nn	Bolen (David Benjamin) Papers	ark:/13030/tf4m3nb8sq
http://www.oac.cdlib.org/findaid/ark:/13030/c80r9rk7	Bolger (Ray) papers	ark:/13030/tf129008pn
http://www.oac.cdlib.org/findaid/ark:/13030/kt2w1035d9	Bolin (Rolf Ling) Drawings	ark:/13030/tf458010c5
http://www.oac.cdlib.org/findaid/ark:/13030/c8t43rgv	Bolinger (Dwight Le Merton) Papers	ark:/13030/tf458010c5
http://www.oac.cdlib.org/findaid/ark:/13030/tf1870017v	Bolivian Subject Collection	ark:/13030/tf4m3nb8sq
http://www.oac.cdlib.org/findaid/ark:/13030/kt6m3nf2mj	Boll (Maximilian A. W.) papers	ark:/13030/tf4m3nb8sq
http://www.oac.cdlib.org/findaid/ark:/13030/kt0h4nb7m3	Boll (Theophilus E.M.) Papers	ark:/13030/tf129008pn
http://www.oac.cdlib.org/findaid/ark:/13030/tf7b69n8nv	Bolloten (Burnett) Papers	ark:/13030/tf4m3nb8sq
http://www.oac.cdlib.org/findaid/ark:/13030/kt758035jb	Bolsa Chica Papers	ark:/13030/kt9g5023wp
http://www.oac.cdlib.org/findaid/ark:/13030/kt9c603694	Bol'she sveta : video tape	ark:/13030/tf4m3nb8sq
http://www.oac.cdlib.org/findaid/ark:/13030/kt758035v0	Bolshevik Leninist Party of India bulletin	ark:/13030/tf4m3nb8sq
http://www.oac.cdlib.org/findaid/ark:/13030/tf1p30055c	Bolt Family Papers	ark:/13030/tf609nb7wg
http://www.oac.cdlib.org/findaid/ark:/13030/kt9489r2nz	Boltenstern (Werner von) Postcard Collection	ark:/13030/kt9k402381
http://www.oac.cdlib.org/findaid/ark:/13030/kt2d5nf0hg	Bolton (Arthur L.) family papers	ark:/13030/kt9k4037h1
http://www.oac.cdlib.org/findaid/ark:/13030/kt8r29p928	Bolton Family Papers	ark:/13030/tf7r29p8s0
http://www.oac.cdlib.org/findaid/ark:/13030/c8bv7hzn	Bolton (Herbert Eugene) Collection	ark:/13030/kt8489r6nk
http://www.oac.cdlib.org/findaid/ark:/13030/kt9z09s1s7	Bolton (Herbert Eugene) papers	ark:/13030/tf7r29p8s0
http://www.oac.cdlib.org/findaid/ark:/13030/tf700005qg	Bolton-Wilder-Brower Family Photographs	ark:/13030/tf7r29p8s0
http://www.oac.cdlib.org/findaid/ark:/13030/c8rr1wm4	Bomar (Thomas F.) Papers	ark:/13030/kt0g50151g
http://www.oac.cdlib.org/findaid/ark:/13030/kt5z09r644	Bond (Marshall) diary	ark:/13030/tf4m3nb8sq
http://www.oac.cdlib.org/findaid/ark:/13030/tf0779n3vq	Bond (Pat) Papers	ark:/13030/tf8j49p7c9
http://www.oac.cdlib.org/findaid/ark:/13030/kt6n39r1nt	Bond (W. Langhorne) Papers	ark:/13030/tf4m3nb8sq
http://www.oac.cdlib.org/findaid/ark:/13030/tf0t1nb195	Bond (William) Papers	ark:/13030/tf5r29p653
http://www.oac.cdlib.org/findaid/ark:/13030/c8dv1mk9	Bondarenko (K.) papers	ark:/13030/tf4m3nb8sq
http://www.oac.cdlib.org/findaid/ark:/13030/c85t3hz7	Bondi (Don) collection of dance programs and publications	ark:/13030/tf6t1nc15d
http://www.oac.cdlib.org/findaid/ark:/13030/tf6d5nb1fg	Bone (Sydney W.) Collection	ark:/13030/tf0f59p354
http://www.oac.cdlib.org/findaid/ark:/13030/c80p0xfd	Bonelli (Frank G.) Collection	ark:/13030/kt4c60381d
http://www.oac.cdlib.org/findaid/ark:/13030/kt096nc5rb	Bonelli (Richard) Collection	ark:/13030/kt1v19q1s6
http://www.oac.cdlib.org/findaid/ark:/13030/kt0d5nd17r	"Bongio (Enrico) Papers, 1952-1993(bulk 1983)"	ark:/13030/kt529026qp
http://www.oac.cdlib.org/findaid/ark:/13030/kt2h4nf22c	Bonham (Mildred A.) Papers	ark:/13030/kt2j49q7f8
http://www.oac.cdlib.org/findaid/ark:/13030/kt9870220f	Boni (Albert) Collection of Material about Photography	ark:/13030/tf129008pn
http://www.oac.cdlib.org/findaid/ark:/13030/tf4t1nb37b	Bonica (John J.) Papers	ark:/13030/tf8h4nc0sw
http://www.oac.cdlib.org/findaid/ark:/13030/c8kk9cb3	Bonine (E. A.) Photographs of Indians of the Southwest	ark:/13030/tf6t1nb9mj
http://www.oac.cdlib.org/findaid/ark:/13030/c8xw4hrf	Bonnemaison (Joachim) Collection of Panorama Photographs	ark:/13030/kt98703819
http://www.oac.cdlib.org/findaid/ark:/13030/tf7z09p04m	Bonner (Frank E.) Papers	ark:/13030/tf009nb42r
http://www.oac.cdlib.org/findaid/ark:/13030/kt30003586	Bonner (James) papers	ark:/13030/tf938nc278
http://www.oac.cdlib.org/findaid/ark:/13030/kt5d5nc8r0	Bonner (Michael) Papers	ark:/13030/tf1489p250
http://www.oac.cdlib.org/findaid/ark:/13030/kt996nd0d0	Bonner (Mitchell I.) Photographs and Ephemera	ark:/13030/tf529010fv
http://www.oac.cdlib.org/findaid/ark:/13030/kt3489q4t6	Bonner (Priscilla) Collection	ark:/13030/kt4199r6d2
http://www.oac.cdlib.org/findaid/ark:/13030/kt5t1nf0v6	Bonnet (Henri) typescript	ark:/13030/tf4m3nb8sq
http://www.oac.cdlib.org/findaid/ark:/13030/kt2g5032rd	Bonnet rouge (Paris) article proof sheets	ark:/13030/tf4m3nb8sq
http://www.oac.cdlib.org/findaid/ark:/13030/k6f769g4	Bonney (Thérèse) Photograph Collection	ark:/13030/tf7r29p8s0
http://www.oac.cdlib.org/findaid/ark:/13030/kt1j49r61q	Bonomi (John) Papers	ark:/13030/tf000007c3
http://www.oac.cdlib.org/findaid/ark:/13030/tf1z09n7jw	Bonpane (Blase) Papers	ark:/13030/tf129008pn
http://www.oac.cdlib.org/findaid/ark:/13030/tf6f59n84f	Bontempelli (Massimo) Papers	ark:/13030/kt98703819
http://www.oac.cdlib.org/findaid/ark:/13030/kt7290213k	Bontine (Anne Elizabeth) Diaries and Other Materials	ark:/13030/tf1p3008cx
http://www.oac.cdlib.org/findaid/ark:/13030/kt7x0nc8qc	Boodin (John E.) Papers	ark:/13030/tf129008pn
http://www.oac.cdlib.org/findaid/ark:/13030/hb6d5nb8db	Book Artifacts Collection	ark:/13030/tf7r29p8s0
http://www.oac.cdlib.org/findaid/ark:/13030/k6vd6wc8	Book Club of California records	ark:/13030/tf7r29p8s0
http://www.oac.cdlib.org/findaid/ark:/13030/kt4199r70b	Book Fair Poster Collection	ark:/13030/tf9n39p92k
http://www.oac.cdlib.org/findaid/ark:/13030/c8df6sxm	Book History Ephemera Collection	ark:/13030/c8cn7290
http://www.oac.cdlib.org/findaid/ark:/13030/c8zp45fh	Book of Drawings of Public School Children	ark:/13030/kt4c60381d
http://www.oac.cdlib.org/findaid/ark:/13030/kt387010bb	Book of Wealth and the Book of the Fair (H.H. Bancroft &amp; Co.) Collection	ark:/13030/tf129008pn
http://www.oac.cdlib.org/findaid/ark:/13030/ft3z09n667	Book Publishers Assn. of Southern Calif.	ark:/13030/tf129008pn
http://www.oac.cdlib.org/findaid/ark:/13030/tf4p3003qm	"Bookbinders and Bindery Women's Union, Local 31-125 Records"	ark:/13030/tf7779p81b
http://www.oac.cdlib.org/findaid/ark:/13030/c86111b0	Booker (Bob) scripts and record albums	ark:/13030/tf129008pn
http://www.oac.cdlib.org/findaid/ark:/13030/tf0z09n7h2	Booker (Henry G.) papers	ark:/13030/tf5r29p653
http://www.oac.cdlib.org/findaid/ark:/13030/c8gx4d2j	Bookplate Collection	ark:/13030/kt8489r6nk
http://www.oac.cdlib.org/findaid/ark:/13030/tf9x0nb6c2	Bookplate Collection	ark:/13030/tf129008pn
http://www.oac.cdlib.org/findaid/ark:/13030/kt8r29r2hh	Bookplate Collection	ark:/13030/kt2j49q7f8
http://www.oac.cdlib.org/findaid/ark:/13030/kt8k4035pb	Bookplate collection	ark:/13030/tf4m3nb8sq
http://www.oac.cdlib.org/findaid/ark:/13030/c8f47q42	Books and Periodicals	ark:/13030/c8j1025w
http://www.oac.cdlib.org/findaid/ark:/13030/kt0q2nc1gw	Booksellers' Correspondence and Letters Written by Women	ark:/13030/tf129008pn
http://www.oac.cdlib.org/findaid/ark:/13030/kt367nf39t	"Bookstore Records (University of California, Irvine)"	ark:/13030/kt3v19n8bk
http://www.oac.cdlib.org/findaid/ark:/13030/kt4k4032gj	Boone (Elton D.) diary transcript	ark:/13030/tf4m3nb8sq
http://www.oac.cdlib.org/findaid/ark:/13030/kt7290351x	Boone (Turin Bradford) memoirs	ark:/13030/tf4m3nb8sq
http://www.oac.cdlib.org/findaid/ark:/13030/tf8q2nb5cz	Booth (Bradford A.) Papers	ark:/13030/tf129008pn
http://www.oac.cdlib.org/findaid/ark:/13030/c82r3q2f	Booth (Colin) Photographs	ark:/13030/kt2n39q9dc
http://www.oac.cdlib.org/findaid/ark:/13030/c8ws8vg5	Booth (Edwin) Family Collection	ark:/13030/c8736rx6
http://www.oac.cdlib.org/findaid/ark:/13030/tf3t1n99np	Boothe (Charles B.) Papers	ark:/13030/tf4m3nb8sq
http://www.oac.cdlib.org/findaid/ark:/13030/kt358033d2	Bor (Jeno) papers	ark:/13030/tf4m3nb8sq
http://www.oac.cdlib.org/findaid/ark:/13030/tf0n39n8j3	"Borax Industry, ca. 1898-ca. 1915 - Views"	ark:/13030/tf7r29p8s0
http://www.oac.cdlib.org/findaid/ark:/13030/kt0t1nc989	Borcherdt (Donn) Collection 1966.01	ark:/13030/kt2g501822
http://www.oac.cdlib.org/findaid/ark:/13030/kt4t1nd2dp	Borcherdt (Donn) Collection 1966.02	ark:/13030/kt2g501822
http://www.oac.cdlib.org/findaid/ark:/13030/kt7199r060	Borcherdt (Donn) Collection 1966.03	ark:/13030/kt2g501822
http://www.oac.cdlib.org/findaid/ark:/13030/c8125vq5	Borchers (Donald P.) papers	ark:/13030/c8ff3t03
http://www.oac.cdlib.org/findaid/ark:/13030/c8416zhp	Borden (Elizabeth) Scrapbook	ark:/13030/c8kp82ph
http://www.oac.cdlib.org/findaid/ark:/13030/kt5k403413	Borden Merit Award Committee records	ark:/13030/tf4m3nb8sq
http://www.oac.cdlib.org/findaid/ark:/13030/c8g73fhh	Border Newspaper Collection	ark:/13030/kt0g50151g
http://www.oac.cdlib.org/findaid/ark:/13030/kt9v19r95p	Border States Seminar conference papers	ark:/13030/tf4m3nb8sq
http://www.oac.cdlib.org/findaid/ark:/13030/tf1k4001pj	Bordwell (Walter) Papers	ark:/13030/tf5r29p4tz
http://www.oac.cdlib.org/findaid/ark:/13030/c88051xd	Borein (Edward) Drawings	ark:/13030/kt8489r6nk
http://www.oac.cdlib.org/findaid/ark:/13030/kt4290332j	Borel' (Vera Alekseeva de) typescript	ark:/13030/tf4m3nb8sq
http://www.oac.cdlib.org/findaid/ark:/13030/kt3z09r651	Boreysza (Boleslaw) papers	ark:/13030/tf4m3nb8sq
http://www.oac.cdlib.org/findaid/ark:/13030/c8ng4rcs	Borg (Carl Oscar) Personal Papers and Newspaper Clippings	ark:/13030/kt8489r6nk
http://www.oac.cdlib.org/findaid/ark:/13030/c8pc34gk	"Borgens, Sr. (Edward G.), and Donofrio (Helen Z.) Collection of Religious Sheet Music"	ark:/13030/tf6g5012hs
http://www.oac.cdlib.org/findaid/ark:/13030/kt658034zr	Borisavljevic family papers	ark:/13030/tf4m3nb8sq
