rel=cannonical	title
http://www.oac.cdlib.org/findaid/ark:/13030/c8w66mjj	"W. H. Talbot (built 1891; schooner, 4m) logbook and newspaper clipping"
http://www.oac.cdlib.org/findaid/ark:/13030/tf7s2005dh	"W. P. Fuller &amp; Co. (San Francisco, Calif.) Records"
http://www.oac.cdlib.org/findaid/ark:/13030/kt3489r8dc	Wachhold (Allen Glen) typescript
http://www.oac.cdlib.org/findaid/ark:/13030/c82r3sdr	Wachs (Joel) Papers
http://www.oac.cdlib.org/findaid/ark:/13030/kt6k4022pt	Wachsmann (Klaus) Collection
http://www.oac.cdlib.org/findaid/ark:/13030/kt5n39r9vg	Wachsmann (Klaus) Collection
http://www.oac.cdlib.org/findaid/ark:/13030/c8gh9kdv	Wachsner (Frank and Trixie) Collection
http://www.oac.cdlib.org/findaid/ark:/13030/kt2j49p478	Waddell (Charles W.) papers
http://www.oac.cdlib.org/findaid/ark:/13030/c880544b	Waddell (Richard) Typescript and Drafts
http://www.oac.cdlib.org/findaid/ark:/13030/c8v125gq	Waddell (Thomas) papers
http://www.oac.cdlib.org/findaid/ark:/13030/kt867nd57v	Waddingham Slide Collection and Papers
http://www.oac.cdlib.org/findaid/ark:/13030/kt7n39q6k2	Wade (Benjamin F.) Correspondence
http://www.oac.cdlib.org/findaid/ark:/13030/c81r6pv5	Wade (Charles J.) Account Books
http://www.oac.cdlib.org/findaid/ark:/13030/kt3w1035jp	Wade (Nigel) collection
http://www.oac.cdlib.org/findaid/ark:/13030/kt929016fb	Wade (Ruth C.) Papers
http://www.oac.cdlib.org/findaid/ark:/13030/tf967nb36f	Wadsworth (Eden) Papers
http://www.oac.cdlib.org/findaid/ark:/13030/kt1q2nd8g1	Waffen-SS. 15 Grenadier-Division records
http://www.oac.cdlib.org/findaid/ark:/13030/kt8k4036zz	"Waffen-SS. 7 Panzer-Division ""Leibstandarte Adolf Hitler"" logbook"
http://www.oac.cdlib.org/findaid/ark:/13030/c8mc90sm	Waggoner (W.W.) Papers
http://www.oac.cdlib.org/findaid/ark:/13030/c8cj8f19	"Wagner, Betty Ann: Wayfarers Ministry Newsletters"
http://www.oac.cdlib.org/findaid/ark:/13030/kt8f59s18w	Wagner (Blanche Collet) Manuscripts
http://www.oac.cdlib.org/findaid/ark:/13030/c8m909zg	Wagner (Charles) Collection
http://www.oac.cdlib.org/findaid/ark:/13030/kt6m3nc13d	Wagner (Eleanor R.) papers
http://www.oac.cdlib.org/findaid/ark:/13030/tf167nb0gn	Wagner (Gordon) Papers
http://www.oac.cdlib.org/findaid/ark:/13030/tf6779n8g9	Wagner (Henry R.) Papers
http://www.oac.cdlib.org/findaid/ark:/13030/kt0m3n99kr	Wagner (Henry R.) Papers
http://www.oac.cdlib.org/findaid/ark:/13030/c8qf8vct	Wagner (Henry Raup) Collection
http://www.oac.cdlib.org/findaid/ark:/13030/kt7b69r7x6	Wagner (Henry Raup) Collection
http://www.oac.cdlib.org/findaid/ark:/13030/c8p84cn2	Wagner (Jack R.) papers
http://www.oac.cdlib.org/findaid/ark:/13030/c8m90972	Wagner (Jack Russell) Collection
http://www.oac.cdlib.org/findaid/ark:/13030/c8736rqh	Wagner (Joseph) Papers
http://www.oac.cdlib.org/findaid/ark:/13030/tf996nb3b5	Wagner (Otto) Correspondence
http://www.oac.cdlib.org/findaid/ark:/13030/kt2n39n8xr	Wagner (Rob) papers
http://www.oac.cdlib.org/findaid/ark:/13030/kt6g50365s	Wagner (Sally Roesch) Papers
http://www.oac.cdlib.org/findaid/ark:/13030/kt0x0nf26f	Wagstaff (Samuel) Papers
http://www.oac.cdlib.org/findaid/ark:/13030/tf687005ff	Wahl (Henry C.) Papers
http://www.oac.cdlib.org/findaid/ark:/13030/kt4k4034q4	Wainwright (W. A.) photographs
http://www.oac.cdlib.org/findaid/ark:/13030/c8736rp2	"Waite (C.B.) Collection, ca. 1900"
http://www.oac.cdlib.org/findaid/ark:/13030/c8zg6qnh	Waite (Charles B.) photographs
http://www.oac.cdlib.org/findaid/ark:/13030/kt8k4022ft	Waite (Morrison R.) Collection
http://www.oac.cdlib.org/findaid/ark:/13030/kt6v19s0v6	Waite (Willis Willard) photographs and memorabilia
http://www.oac.cdlib.org/findaid/ark:/13030/c84f1sgd	Wakeling (Gwen) costume design drawings
http://www.oac.cdlib.org/findaid/ark:/13030/c80p10s3	Wakeman (Captain Edgar) papers
http://www.oac.cdlib.org/findaid/ark:/13030/c8dz09rg	Walcott (C. D.) Letter
http://www.oac.cdlib.org/findaid/ark:/13030/c81j9cf4	Wald (Karen Lee) Cuban research audio visual collection
http://www.oac.cdlib.org/findaid/ark:/13030/kt0c6029p1	Waldau (Otto Hoffman von) diary
http://www.oac.cdlib.org/findaid/ark:/13030/c8dn44bf	Waldeck (Jacob E.) Theater Scrapbook
http://www.oac.cdlib.org/findaid/ark:/13030/kt1j49r428	Waldeck (Meyer) memoir
http://www.oac.cdlib.org/findaid/ark:/13030/kt9t1nf650	Walden (John) collection
http://www.oac.cdlib.org/findaid/ark:/13030/kt42903400	Waldheim (Kurt) interview transcript
http://www.oac.cdlib.org/findaid/ark:/13030/tf2r29n94n	Waldie (John) Papers
http://www.oac.cdlib.org/findaid/ark:/13030/tf3c6006b3	Waldman (Anne) 100 Memories
http://www.oac.cdlib.org/findaid/ark:/13030/tf058003x6	Waldman (Anne) Checkbook
http://www.oac.cdlib.org/findaid/ark:/13030/tf5p3007wf	Waldman (Anne) Near
http://www.oac.cdlib.org/findaid/ark:/13030/c8ws8v0w	"Waldman, (Anne) Papers"
http://www.oac.cdlib.org/findaid/ark:/13030/ft9x0nb508	Waldmüller (Hans) Collection on Thomas Mann
http://www.oac.cdlib.org/findaid/ark:/13030/kt609nf4h1	Waldo (Arthur L.) collection
http://www.oac.cdlib.org/findaid/ark:/13030/kt8p3036x3	Waldron (Clarence Loring) papers
http://www.oac.cdlib.org/findaid/ark:/13030/kt0d5nf34m	Walecka (John Dirk) Notebooks and Papers
http://www.oac.cdlib.org/findaid/ark:/13030/tf5c600413	Wales (Nym) papers
http://www.oac.cdlib.org/findaid/ark:/13030/kt3m3nf22b	Walka z kosciolem w Polsce mimeograph
http://www.oac.cdlib.org/findaid/ark:/13030/kt8199s4ds	Walker (A. B. C) Papers
http://www.oac.cdlib.org/findaid/ark:/13030/tf2t1nb0xm	Walker (Albert R.) Papers
http://www.oac.cdlib.org/findaid/ark:/13030/c8ng4p1g	Walker and Meyers Los Angeles Pride Parade Photographs
http://www.oac.cdlib.org/findaid/ark:/13030/kt067nd9sk	Walker (Bruce) papers
http://www.oac.cdlib.org/findaid/ark:/13030/c8np23qq	Walker (Charles Heussy) collection
http://www.oac.cdlib.org/findaid/ark:/13030/kt8q2nc2jw	Walker (Charls E.) Papers
http://www.oac.cdlib.org/findaid/ark:/13030/kt458033fw	Walker (Donald E.) Papers
http://www.oac.cdlib.org/findaid/ark:/13030/kt9m3nb5zr	Walker (Emery) papers
http://www.oac.cdlib.org/findaid/ark:/13030/kt4x0nf1d9	Walker (Esther) collection
http://www.oac.cdlib.org/findaid/ark:/13030/c8hd7wn7	Walker (Esther) Papers
http://www.oac.cdlib.org/findaid/ark:/13030/kt4k4037sm	Walker Family Papers
http://www.oac.cdlib.org/findaid/ark:/13030/kt7r29s192	Walker (Frank Fish) Papers
http://www.oac.cdlib.org/findaid/ark:/13030/kt8k4036xf	Walker (Fred L.) papers
http://www.oac.cdlib.org/findaid/ark:/13030/kt796nf2nd	Walker (Fred Livingood) typescript
http://www.oac.cdlib.org/findaid/ark:/13030/kt529026sq	Walker (Harry B.) Papers
http://www.oac.cdlib.org/findaid/ark:/13030/kt7q2nc9t3	Walker (Harry O.) Slide Collection
http://www.oac.cdlib.org/findaid/ark:/13030/kt109n97ts	Walker (James F) Papers
http://www.oac.cdlib.org/findaid/ark:/13030/c8wh2qzr	Walker (Joel P.) Manuscript
http://www.oac.cdlib.org/findaid/ark:/13030/kt4s2035d8	Walker (Richard Louis) interview
http://www.oac.cdlib.org/findaid/ark:/13030/kt667nb92p	Walker (Rob) Papers
http://www.oac.cdlib.org/findaid/ark:/13030/kt3v19s1km	Walker (Robert Averill) Papers
http://www.oac.cdlib.org/findaid/ark:/13030/kt500013b0	Walker (Robert L.) Papers
http://www.oac.cdlib.org/findaid/ark:/13030/kt3m3nd8hh	Walker (Samuel Sloan) papers
http://www.oac.cdlib.org/findaid/ark:/13030/kt529034jk	Walker Scott Department Store Records
http://www.oac.cdlib.org/findaid/ark:/13030/kt438nd2b2	"Walker, Spinning, and Durrell Families Papers"
http://www.oac.cdlib.org/findaid/ark:/13030/c8rv0m29	Walker (Thane) Collection on The Prosperos
http://www.oac.cdlib.org/findaid/ark:/13030/kt509nf174	Walker (Theodore) A trip to the West Indies
http://www.oac.cdlib.org/findaid/ark:/13030/c8fb54dx	"Walkup, (Fairfax Proudfit) Theatre Collection"
http://www.oac.cdlib.org/findaid/ark:/13030/tf9290100c	Wall (Frank G.) Correspondence
http://www.oac.cdlib.org/findaid/ark:/13030/kt5f59s04d	Wallace (Earle S.) collection
http://www.oac.cdlib.org/findaid/ark:/13030/c8z036kf	Wallace (F. L.) World AIDS Day Photographs
http://www.oac.cdlib.org/findaid/ark:/13030/kt1q2nd9rn	Wallace (Irving) papers
http://www.oac.cdlib.org/findaid/ark:/13030/kt0t1nc9x4	Wallace J. Miller Watercolors and Pen and Ink Drawings
http://www.oac.cdlib.org/findaid/ark:/13030/kt3j49q2mr	Wallace (Lewis) Collection
http://www.oac.cdlib.org/findaid/ark:/13030/kt9z09s3jk	Wallen (E. Carl) papers
http://www.oac.cdlib.org/findaid/ark:/13030/kt5r29r8bw	Wallenstein (Gerd D.) papers
http://www.oac.cdlib.org/findaid/ark:/13030/kt229034dk	"Waller (Kenneth L.) Bataan Prisoner of War Collection, circa 1941-1980"
http://www.oac.cdlib.org/findaid/ark:/13030/kt3v19s1fj	Walley (David) research material about Ernie Kovacs
http://www.oac.cdlib.org/findaid/ark:/13030/kt92903894	Wallgren (Albian A.) cartoon
http://www.oac.cdlib.org/findaid/ark:/13030/tf567nb104	Walling (Anna Strunsky) papers
http://www.oac.cdlib.org/findaid/ark:/13030/c8251kjf	Wallis (Hal) papers
http://www.oac.cdlib.org/findaid/ark:/13030/tf296nb1sr	Wallis (John K.) California Diary
http://www.oac.cdlib.org/findaid/ark:/13030/kt00001816	Wallner (William E.) photographs
http://www.oac.cdlib.org/findaid/ark:/13030/c8h995rm	"Walls, Andrew F.  Audio Tapes"
http://www.oac.cdlib.org/findaid/ark:/13030/kt2k4002h3	Wallsten (Robert) Papers
http://www.oac.cdlib.org/findaid/ark:/13030/tf887008z8	Walnut Grove Japanese Methodist Church Records
http://www.oac.cdlib.org/findaid/ark:/13030/kt2x0nd7j6	Walsh (Arthur J.) papers
http://www.oac.cdlib.org/findaid/ark:/13030/tf4779n6sc	Walsh (Henry L.) Papers
http://www.oac.cdlib.org/findaid/ark:/13030/kt9c6029dp	Walsh (James P.) Papers
http://www.oac.cdlib.org/findaid/ark:/13030/c8sx6dtz	Walsh (James R.) sketchbook
http://www.oac.cdlib.org/findaid/ark:/13030/c8930vfh	Walsh (Matthew Joseph) collection
http://www.oac.cdlib.org/findaid/ark:/13030/kt6v19p6sq	Walsh (Robert) Files on Southeast Asian Refugee Resettlement and Education
http://www.oac.cdlib.org/findaid/ark:/13030/c8z038xr	Walsh (Stuart P.) collection
http://www.oac.cdlib.org/findaid/ark:/13030/kt4m3nf1q0	Walsh (Warren Bartlett) translations
http://www.oac.cdlib.org/findaid/ark:/13030/tf358002vm	Walsworth Family Papers
http://www.oac.cdlib.org/findaid/ark:/13030/kt738nd080	Walt Disney Productions
http://www.oac.cdlib.org/findaid/ark:/13030/kt8199s40k	Walt Disney Productions and Walt Disney ephemera
http://www.oac.cdlib.org/findaid/ark:/13030/tf3r29n6bm	"Walter (Alonzo J., Jr.) Motion Picture Film"
http://www.oac.cdlib.org/findaid/ark:/13030/kt6s2036gd	Walter (David) collection
http://www.oac.cdlib.org/findaid/ark:/13030/kt0m3nb4zg	Walter (H. A.) - India/Kashmir Photograph Album
http://www.oac.cdlib.org/findaid/ark:/13030/tf009n99sk	Walter Lantz Productions Collection of Music for Woody Woodpecker Cartoons and Other Productions
http://www.oac.cdlib.org/findaid/ark:/13030/c8rb76rs	Walter Lantz Productions scripts and music cue sheets
http://www.oac.cdlib.org/findaid/ark:/13030/c89z969w	Walter (Mildred) Manuscripts and Papers
http://www.oac.cdlib.org/findaid/ark:/13030/kt5779r9st	Walter Mondale Rally at Stanford
http://www.oac.cdlib.org/findaid/ark:/13030/c8wm1c32	Walter Wohlfeiler papers
http://www.oac.cdlib.org/findaid/ark:/13030/kt8g50391s	Walters (Ray P.) writings
http://www.oac.cdlib.org/findaid/ark:/13030/c8514144	Walters (Richard F.) Papers
http://www.oac.cdlib.org/findaid/ark:/13030/kt596nf2d5	Walther (Oskar) correspondence
http://www.oac.cdlib.org/findaid/ark:/13030/kt0489r5bz	Walton (Jean) Papers
http://www.oac.cdlib.org/findaid/ark:/13030/kt7q2nf3nh	Wanda Roehr Foundation motion picture film
http://www.oac.cdlib.org/findaid/ark:/13030/c8ht2q4p	Wanderbird (yacht) logbooks and papers
http://www.oac.cdlib.org/findaid/ark:/13030/tf3q2n99n1	Wang (Fanxi) Correspondence
http://www.oac.cdlib.org/findaid/ark:/13030/kt2w1032t2	Wang (Guanquan) page proofs
http://www.oac.cdlib.org/findaid/ark:/13030/c8j96716	Wang (Sheng) papers
http://www.oac.cdlib.org/findaid/ark:/13030/c8w0974p	Wang (Yue-che) papers
http://www.oac.cdlib.org/findaid/ark:/13030/kt9z09s3h2	Wang (Zuorong) papers
http://www.oac.cdlib.org/findaid/ark:/13030/kt9c6040tf	Wangenheim (Julius) Papers
http://www.oac.cdlib.org/findaid/ark:/13030/kt1r29r6nb	Wanniski (Jude) papers
http://www.oac.cdlib.org/findaid/ark:/13030/tf3h4n9981	War Council Records
http://www.oac.cdlib.org/findaid/ark:/13030/c88c9v7p	"War History Committee for Los Angeles County Records, 1914-1921"
http://www.oac.cdlib.org/findaid/ark:/13030/c8rx99tj	War History Committee of California Records
http://www.oac.cdlib.org/findaid/ark:/13030/c8183875	War Memorabilia Collection
http://www.oac.cdlib.org/findaid/ark:/13030/tf158000zk	War Propaganda Collection
http://www.oac.cdlib.org/findaid/ark:/13030/c8jm2cdc	War Relocation Authority Collection
http://www.oac.cdlib.org/findaid/ark:/13030/tf596nb4h0	War Relocation Authority Photographs of Japanese-American Evacuation and Resettlement
http://www.oac.cdlib.org/findaid/ark:/13030/kt3b69q445	War Relocation Authority records
http://www.oac.cdlib.org/findaid/ark:/13030/kt3489r8fw	Warburg (James Paul) typescript
http://www.oac.cdlib.org/findaid/ark:/13030/kt08703156	Ward (Barbara E.) papers
http://www.oac.cdlib.org/findaid/ark:/13030/ft2p30034k	Ward (Edward) Collection
http://www.oac.cdlib.org/findaid/ark:/13030/kt909nf58t	Ward (F. Champion) papers
http://www.oac.cdlib.org/findaid/ark:/13030/c85m672b	Ward (Florence Nightingale) Papers
http://www.oac.cdlib.org/findaid/ark:/13030/c81r6sf1	Ward (Lincoln) Collection
http://www.oac.cdlib.org/findaid/ark:/13030/tf2b69n852	Ward (Michael P.) Papers
http://www.oac.cdlib.org/findaid/ark:/13030/kt6x0nf3jz	Ward (Robert Edward) papers
http://www.oac.cdlib.org/findaid/ark:/13030/c84x567k	Ward (Vernon) Papers
http://www.oac.cdlib.org/findaid/ark:/13030/tf6g500742	Warde (Frederick B.) Prompt Book Collection
http://www.oac.cdlib.org/findaid/ark:/13030/kt7x0nf5tc	Warden (A. A.) writings
http://www.oac.cdlib.org/findaid/ark:/13030/ft5w1007dw	Warder (Michael) Collection
http://www.oac.cdlib.org/findaid/ark:/13030/kt1z09r6qp	Wardlaw (Ana) papers
http://www.oac.cdlib.org/findaid/ark:/13030/kt4v19s0sj	Ward-Perkins Family Papers
http://www.oac.cdlib.org/findaid/ark:/13030/c80003vz	Ware (Harriet) Collection
http://www.oac.cdlib.org/findaid/ark:/13030/c88g8nd3	Warga (Wayne) papers
http://www.oac.cdlib.org/findaid/ark:/13030/tf8870100c	Waring (James) Poetry manuscripts
http://www.oac.cdlib.org/findaid/ark:/13030/tf8d5nb6m3	Waring (Richard) - Miller &amp;amp; Lux Collection
http://www.oac.cdlib.org/findaid/ark:/13030/kt2j49r64k	Warlick (James B.) typescript
http://www.oac.cdlib.org/findaid/ark:/13030/kt8d5nf2gs	Warlimont (Walter) writings
http://www.oac.cdlib.org/findaid/ark:/13030/kt0s20324f	Warne (William E.) Collection
http://www.oac.cdlib.org/findaid/ark:/13030/tf629005wv	Warne (William E.) Papers
http://www.oac.cdlib.org/findaid/ark:/13030/kt4c60384z	"Warnecke (John Carl), ""Stanford Architecture at the Crossroads"""
http://www.oac.cdlib.org/findaid/ark:/13030/c8gm87zj	Warner &amp; Gray Inc. drawings of the El Mirasol condominiums
http://www.oac.cdlib.org/findaid/ark:/13030/kt5h4nf1r5	Warner Brothers Studios Music Collection
http://www.oac.cdlib.org/findaid/ark:/13030/c8v125jm	Warner (Daniel) Papers
http://www.oac.cdlib.org/findaid/ark:/13030/tf7q2nb22j	Warner Family Papers
http://www.oac.cdlib.org/findaid/ark:/13030/kt1779r4q4	Warner (Gordon) photograph collection
http://www.oac.cdlib.org/findaid/ark:/13030/c8m32v3k	Warner (Iva) Papers
http://www.oac.cdlib.org/findaid/ark:/13030/c8542mxr	Warner (William Jack) Collection
http://www.oac.cdlib.org/findaid/ark:/13030/kt2b69p3cj	Warner (Willis H.) Papers
http://www.oac.cdlib.org/findaid/ark:/13030/c8jh3mzs	Warner's Ranch Collection
http://www.oac.cdlib.org/findaid/ark:/13030/kt8m3nd0c4	Warren (Charles) Papers
http://www.oac.cdlib.org/findaid/ark:/13030/kt287034gx	Warren (Dennis) sound recording collection
http://www.oac.cdlib.org/findaid/ark:/13030/tf4b69n6gc	Warren (Earl) Papers
http://www.oac.cdlib.org/findaid/ark:/13030/ft900007nd	Warren (Gerald L.) Papers
http://www.oac.cdlib.org/findaid/ark:/13030/c8222vhn	"Warren (Gerald L.) Papers, White House Special Files, 1971-1972"
http://www.oac.cdlib.org/findaid/ark:/13030/kt3199p66r	Warren (Gerald) Papers
http://www.oac.cdlib.org/findaid/ark:/13030/kt196nb6wr	Warren (James L. La Fayette) Papers
http://www.oac.cdlib.org/findaid/ark:/13030/tf0c6000zk	Warren (James L.) Papers
http://www.oac.cdlib.org/findaid/ark:/13030/kt3t1nf0vk	Warren (Lansing) papers
http://www.oac.cdlib.org/findaid/ark:/13030/kt9x0nb418	Warren (Stafford L.) papers
http://www.oac.cdlib.org/findaid/ark:/13030/tf3z09n95s	Warren (Viola L.) Papers
http://www.oac.cdlib.org/findaid/ark:/13030/kt2199r5hh	Warsaw uprising motion picture film
http://www.oac.cdlib.org/findaid/ark:/13030/kt8t1nf6th	Wartime activities of William Bowers Bourn
http://www.oac.cdlib.org/findaid/ark:/13030/kt0t1nb70r	Warton (Robert G.) Papers
http://www.oac.cdlib.org/findaid/ark:/13030/c8fx7b87	Washburn &amp; Sons collection on Pest Control
http://www.oac.cdlib.org/findaid/ark:/13030/c88p6200	"Washburn (Frank Layton) (1867-1950) Collection, ca.1900-1935"
http://www.oac.cdlib.org/findaid/ark:/13030/kt8t1nd16b	Washburn (Henry) photographs and scrapbooks
http://www.oac.cdlib.org/findaid/ark:/13030/kt1t1nc2zk	Washburn (J.) Civil War Letter
http://www.oac.cdlib.org/findaid/ark:/13030/tf9199p0mk	Washburn (S. L.) Papers
http://www.oac.cdlib.org/findaid/ark:/13030/c8668dz0	Washington Apple Pi collection
http://www.oac.cdlib.org/findaid/ark:/13030/c8z89d0b	Washington (George) Bicentennial Collection
http://www.oac.cdlib.org/findaid/ark:/13030/kt309nf1qr	Washington (Harold George) collection
http://www.oac.cdlib.org/findaid/ark:/13030/c8n29xhd	"Washington, James Melvin: Papers"
http://www.oac.cdlib.org/findaid/ark:/13030/c8736rkq	Wass &amp; Chard drawing of the Mrs. Mary R. Dennison house
http://www.oac.cdlib.org/findaid/ark:/13030/c8s46skf	Wasserburg (Gerald J.) papers
http://www.oac.cdlib.org/findaid/ark:/13030/kt6x0nf3kg	Wassiltschikow (Lydia) typescript
http://www.oac.cdlib.org/findaid/ark:/13030/tf7j49n8mn	Water Resources Control Board Records
http://www.oac.cdlib.org/findaid/ark:/13030/tf167nb4rq	"Water Supply Methods in California Missions, 1945 - Views Related to"
http://www.oac.cdlib.org/findaid/ark:/13030/c83b61gv	Watercolor Sketches of Nazca Design
http://www.oac.cdlib.org/findaid/ark:/13030/tf6t1nb1zv	Watercolors of birds on the Pacific slope
http://www.oac.cdlib.org/findaid/ark:/13030/kt809nd1td	Waterhouse (Clark B.) Photograph Collection
http://www.oac.cdlib.org/findaid/ark:/13030/tf067n9785	Waterhouse (Ellis Kirkham) notebooks and research files
http://www.oac.cdlib.org/findaid/ark:/13030/kt500041jg	Waterhouse Family
http://www.oac.cdlib.org/findaid/ark:/13030/tf0m3n9804	Waterman Family Papers
http://www.oac.cdlib.org/findaid/ark:/13030/tf9r29p4p4	Waterman (R. W.) - California Views ca. 1865-1900
http://www.oac.cdlib.org/findaid/ark:/13030/kt8v19s3pp	Waterman (R. W.) papers
http://www.oac.cdlib.org/findaid/ark:/13030/kt6x0nf5gw	Waterman (Wilhelm Hallet) Photograph Album
http://www.oac.cdlib.org/findaid/ark:/13030/c80k2b7d	Waters (Chuck) Papers
http://www.oac.cdlib.org/findaid/ark:/13030/c8dr2wt3	"Waters (Frank), Book of the Hopi Manuscript"
http://www.oac.cdlib.org/findaid/ark:/13030/kt700038g0	Waters' Nickel Series Photographs of Stanford University
http://www.oac.cdlib.org/findaid/ark:/13030/c8w37xh5	Waters (Norman) Papers
http://www.oac.cdlib.org/findaid/ark:/13030/tf5b69p3h6	"Waters (R. J. and Co.) Views of Donner Lake, California, ca. 1915"
http://www.oac.cdlib.org/findaid/ark:/13030/kt1489n4q4	Watkins (Carleton) collection of photographs
http://www.oac.cdlib.org/findaid/ark:/13030/c8r78g11	"Watkins (Carleton E.) (1829-1916) Collection, ca. 1880"
http://www.oac.cdlib.org/findaid/ark:/13030/tf5z09n83w	Watkins (Carleton E.) Arizona photographs
http://www.oac.cdlib.org/findaid/ark:/13030/tf2x0nb5r3	"Watkins (Carleton E.) Collection of Photographs, ca. 1874-1890"
http://www.oac.cdlib.org/findaid/ark:/13030/tf5q2nb80s	"Watkins (Carleton E.), Franciscan Missions of California by"
http://www.oac.cdlib.org/findaid/ark:/13030/tf8p3009b2	"Watkins (Carleton E.) Hearst Mining Collection of Views, 1871-1876"
http://www.oac.cdlib.org/findaid/ark:/13030/tf6r29p4m5	"Watkins (Carleton E.), Logging Operations in Little River, California Photographs, ca. 1870"
http://www.oac.cdlib.org/findaid/ark:/13030/tf6b69n89c	Watkins (Carleton E.) Mammoth Plate Landscape Photographs from the George Davidson Collection
http://www.oac.cdlib.org/findaid/ark:/13030/tf82900695	Watkins (Carleton E.) Mammoth Plate Photographs of Yosemite Valley
http://www.oac.cdlib.org/findaid/ark:/13030/hb5580068c	Watkins (Carleton E.) Mammoth Plate Views in California and Oregon
http://www.oac.cdlib.org/findaid/ark:/13030/tf496nb60w	"Watkins (Carleton E.), Mendocino Coast, 1863"
http://www.oac.cdlib.org/findaid/ark:/13030/hb687006v4	Watkins (Carleton E.) Miscellaneous Mammoth Plate Photographs
http://www.oac.cdlib.org/findaid/ark:/13030/tf458008b2	"Watkins (Carleton E.) Photographic Views of El Verano and Vicinity, Sonoma Valley, California"
http://www.oac.cdlib.org/findaid/ark:/13030/hb9n39p2s2	"Watkins (Carleton E.) Photographic Views of the Golden Gate Mining Claim [and the Golden Feather Mining Claim] Situated on Feather River, Butte County, Cal."
http://www.oac.cdlib.org/findaid/ark:/13030/hb6489p0j8	Watkins (Carleton E.) Photographs of California Scenes: A Mammoth Plate Miscellany
http://www.oac.cdlib.org/findaid/ark:/13030/tf3r29p0j8	"Watkins (Carleton E.), Photographs of the Mariposa Estate and Environs"
http://www.oac.cdlib.org/findaid/ark:/13030/hb6m3nb3nv	"Watkins (Carleton E.) Photographs of Yosemite: with Additional Views of Mt. Shasta, Calif. and Cape Horn, Columbia River, Oregon"
http://www.oac.cdlib.org/findaid/ark:/13030/tf32900882	"Watkins (Carleton E.) San Francisco Photographs, ca. 1872- ca. 1879"
http://www.oac.cdlib.org/findaid/ark:/13030/tf4p300915	Watkins (Carleton E.) Scenic California
http://www.oac.cdlib.org/findaid/ark:/13030/hb8f59p1d8	Watkins (Carleton E.) Selected Mammoth Plate Photographic Prints from the Keith McHenry Pond Collection
http://www.oac.cdlib.org/findaid/ark:/13030/tf5n39p1xd	"Watkins (Carleton E.) Stereo Views of the West, ca. 1865-ca. 1880"
http://www.oac.cdlib.org/findaid/ark:/13030/tf68701128	Watkins (Carleton E.) Stereographic Views from the Eugene Compton Collection
http://www.oac.cdlib.org/findaid/ark:/13030/tf3c60095z	Watkins (Carleton E.) Sun Sketches of San Mateo
http://www.oac.cdlib.org/findaid/ark:/13030/tf0199n8hn	"Watkins (Carleton E.) Views of San Francisco, Yosemite, and Monterey, ca. 1876 - ca. 1890"
http://www.oac.cdlib.org/findaid/ark:/13030/tf2x0nb5nj	"Watkins (Carleton E.) Yosemite Views, ca. 1876"
http://www.oac.cdlib.org/findaid/ark:/13030/hb038n99v8	Watkins (Carleton E.) Yosemite Views from the Sierra Club Collection
http://www.oac.cdlib.org/findaid/ark:/13030/kt0k4034sx	Watkins (Edwin A) Photograph Album
http://www.oac.cdlib.org/findaid/ark:/13030/c8m32v24	Watkins (Frances E.) Papers
http://www.oac.cdlib.org/findaid/ark:/13030/kt3p3037b7	Watkins (Gordon and Anna) papers
http://www.oac.cdlib.org/findaid/ark:/13030/tf638nb14v	Watkins (James T.) Papers
http://www.oac.cdlib.org/findaid/ark:/13030/kt538nf3pg	Watkins (James T.) Papers
http://www.oac.cdlib.org/findaid/ark:/13030/c85h7j0h	Watkins (Lee H.) Papers
http://www.oac.cdlib.org/findaid/ark:/13030/tf000000mb	Watkins (Ralph J.) Papers
http://www.oac.cdlib.org/findaid/ark:/13030/kt3p3036ds	Watkins (Richard Howells) Collection
http://www.oac.cdlib.org/findaid/ark:/13030/kt2p30326f	Watkins (Susan E.) collection
http://www.oac.cdlib.org/findaid/ark:/13030/kt4j49n6w7	Watson and Moderwell Families Collection
http://www.oac.cdlib.org/findaid/ark:/13030/kt6w1015n8	"Watson, (Diane E.) Papers"
http://www.oac.cdlib.org/findaid/ark:/13030/c89k48nh	Watson (Diane E.) papers
http://www.oac.cdlib.org/findaid/ark:/13030/kt667nd2zn	Watson (Diane) Papers
http://www.oac.cdlib.org/findaid/ark:/13030/c8kw5hs5	Watson (Don) Oral History
http://www.oac.cdlib.org/findaid/ark:/13030/kt0s2017kp	Watson Land Company Collection
http://www.oac.cdlib.org/findaid/ark:/13030/c8ft8nhf	Watson (Mary) Letters
http://www.oac.cdlib.org/findaid/ark:/13030/kt867nf5qj	Watson (Raymond L.) papers
http://www.oac.cdlib.org/findaid/ark:/13030/kt7q2nf3p1	Watson (Samuel Newell) papers
http://www.oac.cdlib.org/findaid/ark:/13030/kt329035kz	Watt (Ian P.) Papers
http://www.oac.cdlib.org/findaid/ark:/13030/c8xs5wcd	Watters (Bill) collection of 19th and 20th century autographs and documents
http://www.oac.cdlib.org/findaid/ark:/13030/kt567nf00b	Wattles (Warren F.) miscellaneous papers
http://www.oac.cdlib.org/findaid/ark:/13030/kt2x0nf14j	Watts (Captain Charles A.) rough logook
http://www.oac.cdlib.org/findaid/ark:/13030/c8qr4zg0	Watts (Captain Charles) personal papers and records
http://www.oac.cdlib.org/findaid/ark:/13030/kt7w1038pf	Watts (Robert) papers
http://www.oac.cdlib.org/findaid/ark:/13030/kt7c60394c	Watts (Vervon Orval) papers
http://www.oac.cdlib.org/findaid/ark:/13030/c8j1040g	"Watts (W. L.) Collection, 1891-1910"
http://www.oac.cdlib.org/findaid/ark:/13030/c8j967cp	Watts (William M.) Papers
http://www.oac.cdlib.org/findaid/ark:/13030/kt9q2nf728	"Watts Writers' Workshop stories, lesson books, and other material"
http://www.oac.cdlib.org/findaid/ark:/13030/c8st7nt6	Waud (Alfred R.) Collection
http://www.oac.cdlib.org/findaid/ark:/13030/c8sb46rz	Waud (Alfred R.) Photograph Collection
http://www.oac.cdlib.org/findaid/ark:/13030/c84x59xs	Waugh (Evelyn) Papers
http://www.oac.cdlib.org/findaid/ark:/13030/kt767nf591	"Waugh (Olive Wilbur Gamble), ""A Jumble of Memories: Stories of My Life"""
http://www.oac.cdlib.org/findaid/ark:/13030/tf6g5005nv	Wave Power Patents Collection
http://www.oac.cdlib.org/findaid/ark:/13030/kt0v19r5gm	Wawrzonek (Roman) papers
http://www.oac.cdlib.org/findaid/ark:/13030/tf0r29n4nc	Wax (Rosalie H.) Papers
