rel=cannonical	title
http://www.oac.cdlib.org/findaid/ark:/13030/tf2q2n997h	Way (Arthur S.) - English Verse Translation of Lucretius' “De rerum natura”
http://www.oac.cdlib.org/findaid/ark:/13030/tf0x0n97c9	Way (Howard) Papers
http://www.oac.cdlib.org/findaid/ark:/13030/hb0g5007kx	Wayburn (Edgar) papers
http://www.oac.cdlib.org/findaid/ark:/13030/c8j67hpc	Waycott (Ralph) collection of papers regarding the Appleton/Waycott house
http://www.oac.cdlib.org/findaid/ark:/13030/c8rv0p7c	"Wayland, Francis:"
http://www.oac.cdlib.org/findaid/ark:/13030/c86m358c	Wayland (George H.) naval architectural drawings
http://www.oac.cdlib.org/findaid/ark:/13030/kt0v19r71v	Wayland (Harold) papers
http://www.oac.cdlib.org/findaid/ark:/13030/c8nc62gk	Waymire (Carol) Collection
http://www.oac.cdlib.org/findaid/ark:/13030/c8fb54fc	Waymire (Carol) collection of periodicals and ephemera
http://www.oac.cdlib.org/findaid/ark:/13030/kt1g503877	Wayne (June) Exhibit Catalogs and Publications
http://www.oac.cdlib.org/findaid/ark:/13030/kt5j49r1tf	Wayne (June) papers
http://www.oac.cdlib.org/findaid/ark:/13030/kt438nf24d	Wayne (Roy E.) photographs
http://www.oac.cdlib.org/findaid/ark:/13030/kt7w1040dw	Wayne (Stephen J.) papers
http://www.oac.cdlib.org/findaid/ark:/13030/c89p33q0	We A.R.E. (Athletes Reaching Equality) Pride Collection
http://www.oac.cdlib.org/findaid/ark:/13030/c8sb4442	"We Are Everywhere, International Collection"
http://www.oac.cdlib.org/findaid/ark:/13030/kt596nf2hq	We Supported Our Men in Vietnam records
http://www.oac.cdlib.org/findaid/ark:/13030/kt229033m6	Weakley (Charles Enright) papers
http://www.oac.cdlib.org/findaid/ark:/13030/kt7290367h	Wealth of nations in the twentieth century conference proceedings
http://www.oac.cdlib.org/findaid/ark:/13030/kt1k4024hn	Weast (Clair A.) Collection
http://www.oac.cdlib.org/findaid/ark:/13030/kt6199s18n	Weather Bureau Records
http://www.oac.cdlib.org/findaid/ark:/13030/kt7n39s2mj	Weatherholt (Charles) collection
http://www.oac.cdlib.org/findaid/ark:/13030/kt4s2037kt	Weatherly (Aubrey Richard) Collection
http://www.oac.cdlib.org/findaid/ark:/13030/ft4c6004mz	Weatherwax (Seema Aissen) Photographs
http://www.oac.cdlib.org/findaid/ark:/13030/c82n532q	"Weaver (Alan) Papers Related to the Sierra Employees Alliance, United Autoworkers Union, Local 2103"
http://www.oac.cdlib.org/findaid/ark:/13030/kt1q2nf1np	Weaver (Harrell) Family Papers
http://www.oac.cdlib.org/findaid/ark:/13030/kt9z09p9np	Weaver (Harriet) papers
http://www.oac.cdlib.org/findaid/ark:/13030/kt2199q1c2	"Weaver (Harriett) Collection about Residential Development and Fire, Flood, and Landslide Management in the Santa Monica Mountains"
http://www.oac.cdlib.org/findaid/ark:/13030/kt5t1nc718	Weaver (John D.) Collection about the 1984 Olympic Games
http://www.oac.cdlib.org/findaid/ark:/13030/kt4x0nd9z0	Weaver (John D.) collection of Los Angeles ephemera and research materials
http://www.oac.cdlib.org/findaid/ark:/13030/kt7c601400	Weaver (John D.) Collection of Material about Thomas Mann
http://www.oac.cdlib.org/findaid/ark:/13030/kt4779q44t	Weaver (William) Papers
http://www.oac.cdlib.org/findaid/ark:/13030/kt609nc6q6	Webb (A. Dinsmoor) Papers
http://www.oac.cdlib.org/findaid/ark:/13030/kt1t1nf14k	Webb (Eugene J.) Papers
http://www.oac.cdlib.org/findaid/ark:/13030/c8dz0b2x	Webb (Francis Gilbert) Correspondence Collection
http://www.oac.cdlib.org/findaid/ark:/13030/tf8779p26b	Webb (Jack) Collection
http://www.oac.cdlib.org/findaid/ark:/13030/kt409nb9cd	Webb (James R.) Papers
http://www.oac.cdlib.org/findaid/ark:/13030/c8kh0q2j	Webb (Nancy) Papers.
http://www.oac.cdlib.org/findaid/ark:/13030/kt7v19s0hb	Webber (Bert) papers
http://www.oac.cdlib.org/findaid/ark:/13030/kt5n39s1nz	Webber (Herbert J.) papers
http://www.oac.cdlib.org/findaid/ark:/13030/c83b60sg	Weber &amp; Spaulding drawings of the William Wrigley Jr. castle on Mount Ada
http://www.oac.cdlib.org/findaid/ark:/13030/c8jm2ccx	Weber (Brom) Papers.
http://www.oac.cdlib.org/findaid/ark:/13030/kt200033t6	"Weber (David C.) ""Library Trends"" Papers"
http://www.oac.cdlib.org/findaid/ark:/13030/kt667nd2x4	Weber (Devra) Papers
http://www.oac.cdlib.org/findaid/ark:/13030/kt567nc7ch	Weber (Eugen J.) Papers
http://www.oac.cdlib.org/findaid/ark:/13030/tf5199n7cn	Weber Family Collection
http://www.oac.cdlib.org/findaid/ark:/13030/tf32900332	Weber Family Papers
http://www.oac.cdlib.org/findaid/ark:/13030/kt3m3nd9jh	Weber (Kem) papers
http://www.oac.cdlib.org/findaid/ark:/13030/kt967nd16q	Weber (Mark) Jazz Collection
http://www.oac.cdlib.org/findaid/ark:/13030/tf5r29n843	Webern (Lilly von) Papers
http://www.oac.cdlib.org/findaid/ark:/13030/kt2x0nf07m	"Webser (David Locke), Reminiscences of a Rolling Stone"
http://www.oac.cdlib.org/findaid/ark:/13030/kt3x0nc8gh	Webster (David James) Papers
http://www.oac.cdlib.org/findaid/ark:/13030/c8js9s44	Webster (David L.) Photographic Slides
http://www.oac.cdlib.org/findaid/ark:/13030/tf6x0nb2bp	Webster (David Locke) Papers
http://www.oac.cdlib.org/findaid/ark:/13030/kt2t1nf4x7	Webster (David Locke) Papers
http://www.oac.cdlib.org/findaid/ark:/13030/c85t3hvw	Webster Family Papers
http://www.oac.cdlib.org/findaid/ark:/13030/kt2199r827	Webster (Hutton) Papers
http://www.oac.cdlib.org/findaid/ark:/13030/tf696nb1gb	Webster (James B.) papers
http://www.oac.cdlib.org/findaid/ark:/13030/kt7d5nf49v	Webster (William H.) speeches
http://www.oac.cdlib.org/findaid/ark:/13030/kt0s203050	Wedel (Oswald Henry) typescript
http://www.oac.cdlib.org/findaid/ark:/13030/tf3x0n99pv	Wedemeyer (Albert C.) Papers
http://www.oac.cdlib.org/findaid/ark:/13030/kt400033n7	Weekly Review of Events in Ireland bulletins
http://www.oac.cdlib.org/findaid/ark:/13030/c8hq4144	Weeks (Charles) Collection
http://www.oac.cdlib.org/findaid/ark:/13030/kt9s2040gw	Weeks (George P.) memorandum
http://www.oac.cdlib.org/findaid/ark:/13030/c8q240xb	Weeks (W. H. ) drawings of the Santa Barbara Junior High School
http://www.oac.cdlib.org/findaid/ark:/13030/c82f7p10	Wegeforth (Rachel Granger) Papers
http://www.oac.cdlib.org/findaid/ark:/13030/kt0199r4fc	Wegerer (Alfred von) writings
http://www.oac.cdlib.org/findaid/ark:/13030/kt3d5nf0nv	Wegierski (Mark) writings
http://www.oac.cdlib.org/findaid/ark:/13030/c8513zvb	"Wegner (Glen E.) Papers, White House Central Files, 1969-1972"
http://www.oac.cdlib.org/findaid/ark:/13030/kt1n39r5f3	Wei (E) writings
http://www.oac.cdlib.org/findaid/ark:/13030/kt5w1034jt	Wei (James) diaries
http://www.oac.cdlib.org/findaid/ark:/13030/kt996nf5r1	Wei (Yong) papers
http://www.oac.cdlib.org/findaid/ark:/13030/c8kd1zj2	Weid (A. J. ) drawings of the apartments for McLennan and Fargo
http://www.oac.cdlib.org/findaid/ark:/13030/kt1000345j	Weidenbaum (Murray L.) papers
http://www.oac.cdlib.org/findaid/ark:/13030/c8q81fsv	Weier (Thomas E.) Papers.
http://www.oac.cdlib.org/findaid/ark:/13030/tf4v19n6rs	Weiffenbach (John F.) Collection
http://www.oac.cdlib.org/findaid/ark:/13030/kt558037gn	Weigel (George) papers
http://www.oac.cdlib.org/findaid/ark:/13030/kt1m3nf04s	Weigle (Richard Daniel) papers
http://www.oac.cdlib.org/findaid/ark:/13030/tf8j49p0h0	"Weihe, Frick &amp; Kruse Collection, 1917-1976"
http://www.oac.cdlib.org/findaid/ark:/13030/kt996nf5sj	Weil (Charles A.) correspondence
http://www.oac.cdlib.org/findaid/ark:/13030/tf287002x0	Weil (Oscar) Papers
http://www.oac.cdlib.org/findaid/ark:/13030/kt9c6038zx	Weiland (Richard William) Papers
http://www.oac.cdlib.org/findaid/ark:/13030/kt4n39r9cx	Weiler (Hans N.) miscellaneous papers
http://www.oac.cdlib.org/findaid/ark:/13030/kt738nf89t	Weimann (Robert) Papers
http://www.oac.cdlib.org/findaid/ark:/13030/kt9489s475	Weimer (Jan) Papers
http://www.oac.cdlib.org/findaid/ark:/13030/c8cj8gns	Weinberg (Max) papers
http://www.oac.cdlib.org/findaid/ark:/13030/c8fn188c	Weinberg (Tom Wilson) collection
http://www.oac.cdlib.org/findaid/ark:/13030/kt1870344f	Weinberger (Caspar) at Stanford
http://www.oac.cdlib.org/findaid/ark:/13030/kt3199r71j	Weinberger (William E.) Collection on the Law and Gays and Lesbian Rights
http://www.oac.cdlib.org/findaid/ark:/13030/kt0k4035c6	Weiner (Gerald and Barbara) collection of Ethiopic manuscripts
http://www.oac.cdlib.org/findaid/ark:/13030/kt5g500434	Weiner (Hannah) papers
http://www.oac.cdlib.org/findaid/ark:/13030/c86m3875	Weiner (Matthew) papers
http://www.oac.cdlib.org/findaid/ark:/13030/tf667nb1n8	Weinland (William H.) Collection
http://www.oac.cdlib.org/findaid/ark:/13030/kt3s20269f	Weinstein (Allen) Papers
http://www.oac.cdlib.org/findaid/ark:/13030/kt1f59r3wj	Weinstein (Brian) papers
http://www.oac.cdlib.org/findaid/ark:/13030/tf0w1001g3	Weinstein Spanish American War Collection
http://www.oac.cdlib.org/findaid/ark:/13030/kt4r29n8v0	Weinstock (Matt) Papers
http://www.oac.cdlib.org/findaid/ark:/13030/kt92902225	Weintraub (Hyman) and William Goldberg Collection of Socialist Party Material
http://www.oac.cdlib.org/findaid/ark:/13030/c8xp7638	Weintraub (Jerry) Collection of Motion Picture and Television Program Reels
http://www.oac.cdlib.org/findaid/ark:/13030/tf700005jw	Weiser (Mark D.) Papers
http://www.oac.cdlib.org/findaid/ark:/13030/c8xd1313	Weiser (Marty) papers
http://www.oac.cdlib.org/findaid/ark:/13030/ft0h4n974f	Weiss (Helene) Heidegger lecture notes
http://www.oac.cdlib.org/findaid/ark:/13030/kt4489r7b5	Weiss (Herbert F.) papers
http://www.oac.cdlib.org/findaid/ark:/13030/c83t9jjx	Weiss (Mike) Double Play Collection
http://www.oac.cdlib.org/findaid/ark:/13030/kt0870316q	Weiss (Seymour) papers
http://www.oac.cdlib.org/findaid/ark:/13030/kt8k4037p9	Weissenberg (Henry and Idelle) Collection
http://www.oac.cdlib.org/findaid/ark:/13030/kt596nf2cn	Weissenbock (Franz) correspondence
http://www.oac.cdlib.org/findaid/ark:/13030/kt229033nq	Weissman (Susan) Radio Broadcast Interviews
http://www.oac.cdlib.org/findaid/ark:/13030/hb1z09p13q	Weitbrecht (Robert) papers
http://www.oac.cdlib.org/findaid/ark:/13030/kt6m3nf6v3	Weixlgärtner-Neutra (Pepi) collection of prints
http://www.oac.cdlib.org/findaid/ark:/13030/tf28700222	Welch (Claude E.) Collection
http://www.oac.cdlib.org/findaid/ark:/13030/tf7v19p170	Welch (d'Alté A.) papers
http://www.oac.cdlib.org/findaid/ark:/13030/c8z03902	"Welch (d'Alté) Bibliography of English Children’s Books Printed before 1821, with annotations and additional entries by Wilbur Jordan Smith"
http://www.oac.cdlib.org/findaid/ark:/13030/tf887005ws	Welch (J. A.) Letters
http://www.oac.cdlib.org/findaid/ark:/13030/c8251k42	"Welch (James F.) collection, 1973-1979"
http://www.oac.cdlib.org/findaid/ark:/13030/tf2b69n5rd	Welch (James R.) Papers
http://www.oac.cdlib.org/findaid/ark:/13030/tf48700634	(Welch) Lew Papers
http://www.oac.cdlib.org/findaid/ark:/13030/kt02903109	Welch (Vivian Lee) Papers
http://www.oac.cdlib.org/findaid/ark:/13030/kt838nb59b	Weld (John) Papers
http://www.oac.cdlib.org/findaid/ark:/13030/kt887039wd	Welfare Council of Metropolitan Los Angeles reports and publications
http://www.oac.cdlib.org/findaid/ark:/13030/kt638nf54g	"Welfare Planning Council, Los Angeles Region, records"
http://www.oac.cdlib.org/findaid/ark:/13030/kt9g5015w6	Wellborn Family Papers
http://www.oac.cdlib.org/findaid/ark:/13030/kt7t1nc9bh	Wellcome Collection of Near Eastern Manuscripts
http://www.oac.cdlib.org/findaid/ark:/13030/ft7000068m	Wellek (René) Papers
http://www.oac.cdlib.org/findaid/ark:/13030/kt8n39s0gt	Wellington Family Papers
http://www.oac.cdlib.org/findaid/ark:/13030/tf9t1nb4xq	"Wellington (Winfield S.) Collection, 1931-1968"
http://www.oac.cdlib.org/findaid/ark:/13030/kt52902061	Wellington (Winfield S.) Exhibits - Photographs
http://www.oac.cdlib.org/findaid/ark:/13030/kt5r29r9n1	"Wellington (Winfield Scott) Collection, 1931-1968"
http://www.oac.cdlib.org/findaid/ark:/13030/tf9v19p2gq	Wellman (Paul I.) Papers
http://www.oac.cdlib.org/findaid/ark:/13030/c8tq63pp	"Wellman, Robert. Collegium Bibendi, Men's Faculty Club, and ASUCLA Student Legislative Council. Agendas and minutes."
http://www.oac.cdlib.org/findaid/ark:/13030/tf2n39n64j	Wellman (Theodore C.) Papers
http://www.oac.cdlib.org/findaid/ark:/13030/kt487005jq	Wells (Carlton F.) Collection of Material about The Moon is Down by John Steinbeck
http://www.oac.cdlib.org/findaid/ark:/13030/c8nc61tn	Wells Fargo &amp; Company Express Collection
http://www.oac.cdlib.org/findaid/ark:/13030/tf229001pk	"Wells, Fargo &amp; Company Papers"
http://www.oac.cdlib.org/findaid/ark:/13030/tf196n97wf	"Wells, Fargo &amp;amp; Company Records"
http://www.oac.cdlib.org/findaid/ark:/13030/tf9d5nb3p0	Wells Fargo Steinbeck Collection
http://www.oac.cdlib.org/findaid/ark:/13030/ft2c6001sg	"Wells (Robert) and Kirk (Lisa) Collection of Music Scores, Lyrics, and Associated Papers"
http://www.oac.cdlib.org/findaid/ark:/13030/c889177h	Wells (Robertha J.) Papers
http://www.oac.cdlib.org/findaid/ark:/13030/kt138nf34z	"Wells, Van Dyke, and Lee Papers."
http://www.oac.cdlib.org/findaid/ark:/13030/kt0x0nf25x	"Wells, Van Dyke, and Lee Papers."
http://www.oac.cdlib.org/findaid/ark:/13030/kt7t1nf66w	"Wells, Van Dyke, and Lee Papers"
http://www.oac.cdlib.org/findaid/ark:/13030/tf1j49n763	Welmers (William E.) Papers
http://www.oac.cdlib.org/findaid/ark:/13030/c8pv6jqn	Welsh (Elliott) papers
http://www.oac.cdlib.org/findaid/ark:/13030/kt5k4035mc	Weltausstellung in Wien 1873
http://www.oac.cdlib.org/findaid/ark:/13030/kt7h4nf5gk	Wemple (Emmet) papers
http://www.oac.cdlib.org/findaid/ark:/13030/kt996nf8cs	Wendell (Charles) Arabic Volumes
http://www.oac.cdlib.org/findaid/ark:/13030/tf7d5nb4f7	Wendt (William) Letters to Guy and Lucia Edwards
http://www.oac.cdlib.org/findaid/ark:/13030/tf367n993g	Wenzel (Caroline) Collection
http://www.oac.cdlib.org/findaid/ark:/13030/kt800007v5	Werfel (Franz) Papers
http://www.oac.cdlib.org/findaid/ark:/13030/kt367nf0t4	Werner (Max Alexis) typescript
http://www.oac.cdlib.org/findaid/ark:/13030/kt4s2020tm	Wesker (Arnold) Collection of works
http://www.oac.cdlib.org/findaid/ark:/13030/kt0p3032dx	Wesley (Edgar Bruce) papers
http://www.oac.cdlib.org/findaid/ark:/13030/kt9g5039jv	Wesson (Robert G.) papers
http://www.oac.cdlib.org/findaid/ark:/13030/kt687035vb	West Adams Christian Church Records
http://www.oac.cdlib.org/findaid/ark:/13030/kt709nc1pk	West (Andrew) Photographs of the Guelaguetza
http://www.oac.cdlib.org/findaid/ark:/13030/kt6p30401k	West (Arthur L.) papers
http://www.oac.cdlib.org/findaid/ark:/13030/c8125tf5	West Coast Negro Baseball Association Collection
http://www.oac.cdlib.org/findaid/ark:/13030/c8gx499f	West Coast Zines Collection
http://www.oac.cdlib.org/findaid/ark:/13030/kt12903245	West (Edith) papers
http://www.oac.cdlib.org/findaid/ark:/13030/kt8j49s171	West Indian Conference report
http://www.oac.cdlib.org/findaid/ark:/13030/c8959jbj	"West Indies Cruise Photo Album, 1928"
http://www.oac.cdlib.org/findaid/ark:/13030/kt2290117n	West Indies Photograph Album
http://www.oac.cdlib.org/findaid/ark:/13030/kt4q2nd2g2	West (John B.) Papers
http://www.oac.cdlib.org/findaid/ark:/13030/tf0489n3s1	West Oakland Christian Parish Collection
http://www.oac.cdlib.org/findaid/ark:/13030/tf2m3n9907	West on Videotape
http://www.oac.cdlib.org/findaid/ark:/13030/c8k938c8	West (R. Rolleston) Collection
http://www.oac.cdlib.org/findaid/ark:/13030/kt1b69r6d3	West (Ralph E.) papers
http://www.oac.cdlib.org/findaid/ark:/13030/c8377998	West Sacramento Haines directory
http://www.oac.cdlib.org/findaid/ark:/13030/kt929038wx	West Valley College Accreditation Reports
http://www.oac.cdlib.org/findaid/ark:/13030/kt438nf2mn	"West Valley College Administrators, Board Members, Community Leaders, and Alumni File"
http://www.oac.cdlib.org/findaid/ark:/13030/kt129032pf	West Valley College Admissions and Records Surveys of Students Released to Attend Other Community Colleges
http://www.oac.cdlib.org/findaid/ark:/13030/kt4h4nf34h	"West Valley College Advisory Group Documentation, Marketing Materials, Studies, and Surveys"
http://www.oac.cdlib.org/findaid/ark:/13030/kt3x0nf1d0	West Valley College Catalogs
http://www.oac.cdlib.org/findaid/ark:/13030/kt5k4035pd	West Valley College Classified Staff File
http://www.oac.cdlib.org/findaid/ark:/13030/kt1k4033vs	West Valley College Early History and Development File
http://www.oac.cdlib.org/findaid/ark:/13030/kt2z09r6mf	West Valley College Educational and Facilities Master Plans
http://www.oac.cdlib.org/findaid/ark:/13030/kt3n39r86j	West Valley College Enrollment Profiles
http://www.oac.cdlib.org/findaid/ark:/13030/kt5s20369h	West Valley College Faculty and Classified Staff Handbooks
http://www.oac.cdlib.org/findaid/ark:/13030/kt8k4037qt	West Valley College Faculty File
http://www.oac.cdlib.org/findaid/ark:/13030/kt258034d7	West Valley College Library Services and Instruction Materials
http://www.oac.cdlib.org/findaid/ark:/13030/kt2870359t	West Valley College Photographs and Negatives
http://www.oac.cdlib.org/findaid/ark:/13030/kt5s2036cj	West Valley College Pictorial Progress Scrapbooks of the Construction of the Saratoga Campus
http://www.oac.cdlib.org/findaid/ark:/13030/kt7h4nf3s8	"West Valley College Press Releases, Public Service Announcements, and Cutlines"
http://www.oac.cdlib.org/findaid/ark:/13030/kt5489r9x7	West Valley College Program Reviews
http://www.oac.cdlib.org/findaid/ark:/13030/kt3q2nd9wb	West Valley College Programs and Departments Information File
http://www.oac.cdlib.org/findaid/ark:/13030/kt658037kh	West Valley College Publications
http://www.oac.cdlib.org/findaid/ark:/13030/kt358035nn	West Valley College Saratoga Campus Slides
http://www.oac.cdlib.org/findaid/ark:/13030/kt7489r82f	West Valley College Schedules of Classes
http://www.oac.cdlib.org/findaid/ark:/13030/kt6r29s1rg	West Valley College Schedules of Classes for Community Education
http://www.oac.cdlib.org/findaid/ark:/13030/kt5j49s1dp	West Valley College scrapbooks
http://www.oac.cdlib.org/findaid/ark:/13030/kt0d5nf0wj	West Valley College Sponsored Events and Community Events Held at West Valley College
http://www.oac.cdlib.org/findaid/ark:/13030/kt938nf6w8	"West Valley College Student Retention, Recruitment and Transition Reports"
http://www.oac.cdlib.org/findaid/ark:/13030/kt6199s2hr	"West Valley College Study of Enrollment, Weekly Student Contact Hours, Average Daily Attendance"
http://www.oac.cdlib.org/findaid/ark:/13030/kt0489r56w	West Valley Mission College District Staff Directories
http://www.oac.cdlib.org/findaid/ark:/13030/kt087031w2	West Valley-Mission Community College District Budgets
http://www.oac.cdlib.org/findaid/ark:/13030/kt7n39s3ff	West Valley-Mission Community College District Financial Statements and Audit Reports
http://www.oac.cdlib.org/findaid/ark:/13030/kt558037tt	West Valley-Mission Community College District Sabbatical Leave Proposals and Compliance Reports
http://www.oac.cdlib.org/findaid/ark:/13030/c8930vxs	West Van Nuys Chamber of Commerce Collection
http://www.oac.cdlib.org/findaid/ark:/13030/kt9s2040dv	Westchester Security League records
http://www.oac.cdlib.org/findaid/ark:/13030/tf329004d6	Westergaard (Waldemar) Papers
http://www.oac.cdlib.org/findaid/ark:/13030/c87d2vpw	"Westerholm, (Victor W.) papers"
http://www.oac.cdlib.org/findaid/ark:/13030/kt9g50431n	Western American Ephemera
http://www.oac.cdlib.org/findaid/ark:/13030/c83r0v7h	Western Association of Women Historians Records
http://www.oac.cdlib.org/findaid/ark:/13030/c8f1912m	Western Association of Women Historians Records: Additions
http://www.oac.cdlib.org/findaid/ark:/13030/kt1199r50f	Western College Congress records
http://www.oac.cdlib.org/findaid/ark:/13030/ft029001fq	Western Consortium for Public Health Records
http://www.oac.cdlib.org/findaid/ark:/13030/kt496nf257	Western Culture Faculty Symposium Videorecordings
http://www.oac.cdlib.org/findaid/ark:/13030/c8930w77	Western Data Processing Center. Publications.
http://www.oac.cdlib.org/findaid/ark:/13030/c85d8tks	Western Electric Company photographs
http://www.oac.cdlib.org/findaid/ark:/13030/c81r6s06	Western Fiction Ephemera Collection
http://www.oac.cdlib.org/findaid/ark:/13030/kt409nf13r	Western Goals issuances
http://www.oac.cdlib.org/findaid/ark:/13030/tf3489n653	Western Highways Historical Collection
http://www.oac.cdlib.org/findaid/ark:/13030/c8tf00f8	Western Independent Publishers. Records
http://www.oac.cdlib.org/findaid/ark:/13030/c8416zqc	"Western Jewish History Center, Vertical Files"
http://www.oac.cdlib.org/findaid/ark:/13030/c8h996x8	Western Jewish Studies Association (WJSA) Collection
http://www.oac.cdlib.org/findaid/ark:/13030/ft3j49n5wg	"Western landscapes in California, Nevada, Wyoming, and Washington"
http://www.oac.cdlib.org/findaid/ark:/13030/c8dj5hj1	Western Machinery Company. Records.
http://www.oac.cdlib.org/findaid/ark:/13030/c8wm1c4h	Western Museums League Collection
http://www.oac.cdlib.org/findaid/ark:/13030/kt6z09p79m	Western Photograph Collection
http://www.oac.cdlib.org/findaid/ark:/13030/c8125v6f	Western Pipe and Steel Company C3 Manual for Mold Lines
http://www.oac.cdlib.org/findaid/ark:/13030/c8542pz1	Western Signal Corps School Collection
http://www.oac.cdlib.org/findaid/ark:/13030/kt938nf33x	Western Society for Physical Education Education of College Women Records
http://www.oac.cdlib.org/findaid/ark:/13030/kt796nf323	Western States Jewish History Archive
http://www.oac.cdlib.org/findaid/ark:/13030/kt3m3nd07h	Western Sugar Refinery records
http://www.oac.cdlib.org/findaid/ark:/13030/tf9r29p4fh	"Western Survey Expeditions of 1871, 1872, 1873, and 1874"
http://www.oac.cdlib.org/findaid/ark:/13030/c84m95cc	Western Television Programs Script Collection
http://www.oac.cdlib.org/findaid/ark:/13030/tf387002q6	Western Theological Library Association Records
http://www.oac.cdlib.org/findaid/ark:/13030/tf3s20037q	Western United States Business Records
http://www.oac.cdlib.org/findaid/ark:/13030/kt6m3nc6dg	Western Writers of America Records
http://www.oac.cdlib.org/findaid/ark:/13030/c8wm1cq4	"Westerners Collection, The"
http://www.oac.cdlib.org/findaid/ark:/13030/tf7j49p2zc	Westerners Foundation Records
http://www.oac.cdlib.org/findaid/ark:/13030/tf8w10097t	"Westerners International, Stockton Corral Records"
http://www.oac.cdlib.org/findaid/ark:/13030/kt8199p8rj	Westfall (Victor B.) Papers
http://www.oac.cdlib.org/findaid/ark:/13030/kt038nc955	Westinghouse Electric Corporation Nuclear Training Center Manuals
http://www.oac.cdlib.org/findaid/ark:/13030/c8xd12dm	"Westlake Park, Los Angeles History Correspondence"
http://www.oac.cdlib.org/findaid/ark:/13030/c8t15470	Westman (Walt) Papers
http://www.oac.cdlib.org/findaid/ark:/13030/c80g3mhn	Westmore (Perc) papers
http://www.oac.cdlib.org/findaid/ark:/13030/tf429006jj	Westmoreland Versus CBS Collection
http://www.oac.cdlib.org/findaid/ark:/13030/kt8n39s2w0	Weston (Edward) Photographs
http://www.oac.cdlib.org/findaid/ark:/13030/c8jw8h2k	Weston (Francis E.) Diaries
http://www.oac.cdlib.org/findaid/ark:/13030/tf6199n82s	Weston Gold Country Collection
http://www.oac.cdlib.org/findaid/ark:/13030/kt387032b6	Westphalen (Emilio Adolfo) papers regarding surrealism in Latin America
http://www.oac.cdlib.org/findaid/ark:/13030/kt3v19q3hn	Westra (Dorothy) Papers
http://www.oac.cdlib.org/findaid/ark:/13030/kt7q2nf4n0	Westrick (Edward) Collection on Veterans Council for American Rights and Equality
http://www.oac.cdlib.org/findaid/ark:/13030/kt0d5nb0bx	Westwood Chamber of Commerce Records
http://www.oac.cdlib.org/findaid/ark:/13030/c8639qk4	"Westwood Hills Business Village Collection, ca. 1920s"
http://www.oac.cdlib.org/findaid/ark:/13030/tf267nb13r	Wexler (Haskell) Collection
http://www.oac.cdlib.org/findaid/ark:/13030/kt3489n65f	Wey (Nancy) Papers
http://www.oac.cdlib.org/findaid/ark:/13030/kt5199r9nf	Weygand (Maxime) memorandum
http://www.oac.cdlib.org/findaid/ark:/13030/tf0489n3tj	Weyl (Nathaniel) Papers
http://www.oac.cdlib.org/findaid/ark:/13030/kt9c6014mx	Weyman (Stanley J.) Papers
http://www.oac.cdlib.org/findaid/ark:/13030/kt5f59s21t	Weymouth (Alice Jenkins) Photograph Album
http://www.oac.cdlib.org/findaid/ark:/13030/kt5199s1n1	Weymouth Family Papers
http://www.oac.cdlib.org/findaid/ark:/13030/kt1c60329q	"Weymouth (Frank Elwin) Papers, Water Resources Collection"
http://www.oac.cdlib.org/findaid/ark:/13030/kt7p3038xr	Weymouth (Frank) Papers
http://www.oac.cdlib.org/findaid/ark:/13030/tf6s2007fp	Weyse (Alice W.) Correspondence
http://www.oac.cdlib.org/findaid/ark:/13030/tf9779p33k	Whalen (Philip) Correspondence
http://www.oac.cdlib.org/findaid/ark:/13030/kt6779r74b	Whalen (Philip) Correspondence
http://www.oac.cdlib.org/findaid/ark:/13030/kt2199q0t9	Whalen (Philip) Papers
http://www.oac.cdlib.org/findaid/ark:/13030/kt9k4040h3	Whalen (Richard J.) papers
http://www.oac.cdlib.org/findaid/ark:/13030/tf258004ws	Whaley Family Letters
http://www.oac.cdlib.org/findaid/ark:/13030/tf8z09p3c0	Whaley (Thomas) Resignation Letter
http://www.oac.cdlib.org/findaid/ark:/13030/c8v69mc4	Wheat (Carl I.) 'Flush Times in the Diggins' Research Collection
http://www.oac.cdlib.org/findaid/ark:/13030/tf4779n6xf	Wheeler (Benjamin Ide) Papers
http://www.oac.cdlib.org/findaid/ark:/13030/kt8q2nf4vd	Wheeler (Charles Julian) papers
http://www.oac.cdlib.org/findaid/ark:/13030/tf738nb1qz	Wheeler (Cyrus T.) Papers
http://www.oac.cdlib.org/findaid/ark:/13030/kt3p3035pf	Wheeler (Frank K. B.) papers
http://www.oac.cdlib.org/findaid/ark:/13030/kt6h4nf6dq	Wheeler (Harvey) Papers
http://www.oac.cdlib.org/findaid/ark:/13030/kt700036hj	Wheeler (Philip H.) papers
http://www.oac.cdlib.org/findaid/ark:/13030/tf9j49p054	Wheeler (Raymond A.) Papers
http://www.oac.cdlib.org/findaid/ark:/13030/tf9x0nb3zd	Wheeler (Robert F.) Papers
http://www.oac.cdlib.org/findaid/ark:/13030/tf600007k2	Wheelock (John Hall) Letters
http://www.oac.cdlib.org/findaid/ark:/13030/kt0199r4hd	Whelan (Elizabeth M.) papers
http://www.oac.cdlib.org/findaid/ark:/13030/c8ns0vn6	"Whelihan (J. Bruce) Papers, White House Special Files, 1969-1974"
http://www.oac.cdlib.org/findaid/ark:/13030/c83b614c	"Which Way, LA? Collection"
