rel=cannonical	title
http://www.oac.cdlib.org/findaid/ark:/13030/kt4779r89s	Winchell (Walter) miscellaneous papers
http://www.oac.cdlib.org/findaid/ark:/13030/c86h4kj8	Winchell (Walter) papers
http://www.oac.cdlib.org/findaid/ark:/13030/tf1j49n4jt	Winchester (Jonas) Collection
http://www.oac.cdlib.org/findaid/ark:/13030/c86q1xwt	"Winchester (Lucy A.) Papers, White House Central Files, 1969-1974"
http://www.oac.cdlib.org/findaid/ark:/13030/tf9j49p2mt	Windle (William F.) Papers
http://www.oac.cdlib.org/findaid/ark:/13030/kt8q2nf5p9	Windmiller (Marshall) papers
http://www.oac.cdlib.org/findaid/ark:/13030/kt1199r7n7	"""Winds of Freedom"" [Videorecording]"
http://www.oac.cdlib.org/findaid/ark:/13030/kt796nf2mw	Windsor (Mark) questionnaire responses
http://www.oac.cdlib.org/findaid/ark:/13030/c8rn376m	Windsor Project Oral Histories
http://www.oac.cdlib.org/findaid/ark:/13030/kt5489s0xb	Wine and architecture tour photograph album
http://www.oac.cdlib.org/findaid/ark:/13030/tf567nb33n	Wine and Food Society of Los Angeles Collection of Menus
http://www.oac.cdlib.org/findaid/ark:/13030/c84f1stw	Wine Institute Collection
http://www.oac.cdlib.org/findaid/ark:/13030/tf1j49n77m	Wine Material Collection
http://www.oac.cdlib.org/findaid/ark:/13030/c83r0r8q	Wineman (Mode) Papers
http://www.oac.cdlib.org/findaid/ark:/13030/kt3f59n6ch	Winfield (Orilla) Papers
http://www.oac.cdlib.org/findaid/ark:/13030/c8tf002b	Winfield S. Stratton (built 1943; freighter) records
http://www.oac.cdlib.org/findaid/ark:/13030/c81j9c7f	Wing (Ah) Letter
http://www.oac.cdlib.org/findaid/ark:/13030/c89k49jk	Wing (Kenneth) papers
http://www.oac.cdlib.org/findaid/ark:/13030/tf1779n502	Wing (Robert Y.) Electric vehicles (EV) collection
http://www.oac.cdlib.org/findaid/ark:/13030/kt3x0nf0zs	Wings for Norway appeal
http://www.oac.cdlib.org/findaid/ark:/13030/c8sf2xhs	Wings of History Aerial Photographic Collection (1936-1941)
http://www.oac.cdlib.org/findaid/ark:/13030/c8rn38p9	"Winiarczyk, Andrew (Battle of Hatten-Rittershoffen collection)"
http://www.oac.cdlib.org/findaid/ark:/13030/kt5z09r8tf	Winkler (Rolf) letters
http://www.oac.cdlib.org/findaid/ark:/13030/kt0r29r65s	Winkler (Wojciech) papers
http://www.oac.cdlib.org/findaid/ark:/13030/tf900009s2	"Winkley (John W.) ""Major Pierson Barton Reading, California Pioneer"""
http://www.oac.cdlib.org/findaid/ark:/13030/c8d79cpk	Winn (Carol Mass) papers
http://www.oac.cdlib.org/findaid/ark:/13030/c8pc3443	Winnetka Women's Club Collection
http://www.oac.cdlib.org/findaid/ark:/13030/tf687004q3	Winnow (Jackie) Papers
http://www.oac.cdlib.org/findaid/ark:/13030/c89k4cp6	Winograd (Terry Allen) Papers
http://www.oac.cdlib.org/findaid/ark:/13030/kt838nf2rz	Winslow (Alan F.) letters
http://www.oac.cdlib.org/findaid/ark:/13030/kt6n39r9vs	"Winslow (Carleton, Sr.) Papers, 1910-1946"
http://www.oac.cdlib.org/findaid/ark:/13030/kt700014g5	Winslow (Kathryn) Collection
http://www.oac.cdlib.org/findaid/ark:/13030/c85t3jtv	"Winslow, Sr. (Carleton Monroe) papers"
http://www.oac.cdlib.org/findaid/ark:/13030/kt8q2nc88n	Winstein (Saul) Papers
http://www.oac.cdlib.org/findaid/ark:/13030/kt9t1nf66h	Winter (Alice Ames) papers
http://www.oac.cdlib.org/findaid/ark:/13030/c8qn67mt	Winter (William E.) Maya Research Papers
http://www.oac.cdlib.org/findaid/ark:/13030/tf5n39n7wb	Winters (Yvor) and Lewis (Janet) Papers
http://www.oac.cdlib.org/findaid/ark:/13030/kt8199s4gt	Winters (Yvor) Papers
http://www.oac.cdlib.org/findaid/ark:/13030/c8w95bhf	"Wire recordings of Japanese performers in Sacramento, California"
http://www.oac.cdlib.org/findaid/ark:/13030/kt10003441	Wiren (Nicholas) miscellany
http://www.oac.cdlib.org/findaid/ark:/13030/kt9489s46n	Wirt (Mildred) Collection
http://www.oac.cdlib.org/findaid/ark:/13030/c85b0479	Wirth (John D) Papers
http://www.oac.cdlib.org/findaid/ark:/13030/c8dj5dz5	Wirth (Scott) Operation Concern Collection
http://www.oac.cdlib.org/findaid/ark:/13030/kt9489s454	Wirthlin (Richard) papers
http://www.oac.cdlib.org/findaid/ark:/13030/kt696nf1vq	"Wirtschaftliche und soziale Entwicklung in der Sowjetischen Besatzungszone Deutschlands, 1945-1949 mimeograph"
http://www.oac.cdlib.org/findaid/ark:/13030/kt3h4nf15r	Wirtschaftspolitische Gesellschaft mimeograph
http://www.oac.cdlib.org/findaid/ark:/13030/kt0s20304g	Wisconsin Educational Research Association records
http://www.oac.cdlib.org/findaid/ark:/13030/tf8g50067r	Wiskowski (Wlodzimierz) Collection
http://www.oac.cdlib.org/findaid/ark:/13030/kt4s2035cr	Wisner (Lewis S.) collection
http://www.oac.cdlib.org/findaid/ark:/13030/kt4w1034wp	Wisniewski (Tomasz) photograph collection
http://www.oac.cdlib.org/findaid/ark:/13030/kt7x0nf5sv	Wissmann (Hellmuth) writings
http://www.oac.cdlib.org/findaid/ark:/13030/kt1w10312w	Wister (Owen) Collection of Photographs
http://www.oac.cdlib.org/findaid/ark:/13030/kt0d5nf0x2	With (Karl) Papers
http://www.oac.cdlib.org/findaid/ark:/13030/tf1k400478	Withee (Louisa A.) Papers
http://www.oac.cdlib.org/findaid/ark:/13030/kt6z09s14g	Withington (Robert) letters
http://www.oac.cdlib.org/findaid/ark:/13030/kt1c60334m	Witkin (Zara) papers
http://www.oac.cdlib.org/findaid/ark:/13030/tf3j49n667	Wittenberg (Jean) Collection
http://www.oac.cdlib.org/findaid/ark:/13030/c8x92cvh	"Wittenburg, Florence (UCLA 1934). UCLA Scrapbooks."
http://www.oac.cdlib.org/findaid/ark:/13030/tf2s20027x	Wittfogel (Karl A.) Papers
http://www.oac.cdlib.org/findaid/ark:/13030/c8xp73b5	Wittman (Jason) Los Angeles Event Photographs
http://www.oac.cdlib.org/findaid/ark:/13030/kt5199r9pz	Witts (David A.) papers
http://www.oac.cdlib.org/findaid/ark:/13030/kt8z09p844	Wittwer (Johnny) Papers
http://www.oac.cdlib.org/findaid/ark:/13030/kt109nd806	Witzleben (Erwin von) trial transcript
http://www.oac.cdlib.org/findaid/ark:/13030/c8d21w02	Wockner (Rex) World Gay Periodical Cover Photographs
http://www.oac.cdlib.org/findaid/ark:/13030/kt8m3nc96f	Woellner (Frederic P.) Papers
http://www.oac.cdlib.org/findaid/ark:/13030/kt7x0nc1zm	Wofsy (Constance) Papers
http://www.oac.cdlib.org/findaid/ark:/13030/c83r0w17	Wohlfert (Ethel) Scrapbook Collection
http://www.oac.cdlib.org/findaid/ark:/13030/kt0n39r5fs	Wohlford (Burnet) papers
http://www.oac.cdlib.org/findaid/ark:/13030/kt1489q8rg	Wohlstetter (Albert J. and Roberta) Papers
http://www.oac.cdlib.org/findaid/ark:/13030/kt2w1032sj	Wojciechowski (Adam) papers
http://www.oac.cdlib.org/findaid/ark:/13030/kt567nf01v	Wojskowe przyczyny kleski wrzesniowej : proba syntezy typescript
http://www.oac.cdlib.org/findaid/ark:/13030/kt4c60361f	Wolbert (Louise D.) album
http://www.oac.cdlib.org/findaid/ark:/13030/kt558036m7	Wolf (Albert) typescript
http://www.oac.cdlib.org/findaid/ark:/13030/kt7b69r7zq	Wolf (Ernest M.) Stamp Collection
http://www.oac.cdlib.org/findaid/ark:/13030/kt8779s34g	Wolf (Jack) Collection
http://www.oac.cdlib.org/findaid/ark:/13030/kt1d5nd9c0	Wolf (Jiri) processed volume
http://www.oac.cdlib.org/findaid/ark:/13030/c83f4q6t	Wolf (Rudolf) papers
http://www.oac.cdlib.org/findaid/ark:/13030/kt709nf35p	Wolf (William) collection
http://www.oac.cdlib.org/findaid/ark:/13030/kt1z09r6p5	Wolfe (Bernard) slide collection
http://www.oac.cdlib.org/findaid/ark:/13030/tf838nb2m6	Wolfe (Bertram David) papers
http://www.oac.cdlib.org/findaid/ark:/13030/kt2489r69j	"Wolfe, Henry Cutler"
http://www.oac.cdlib.org/findaid/ark:/13030/kt2t1nf1xs	Wolfen miscellaneous records
http://www.oac.cdlib.org/findaid/ark:/13030/kt5x0nf1f4	Wolff (Peter) collection
http://www.oac.cdlib.org/findaid/ark:/13030/tf000002rc	Wolff (Victoria) Papers
http://www.oac.cdlib.org/findaid/ark:/13030/kt8r29s1qk	Wolfpack : the U-boats video tape
http://www.oac.cdlib.org/findaid/ark:/13030/kt9k403949	Wolfram (George) papers
http://www.oac.cdlib.org/findaid/ark:/13030/kt6v19r84r	Wolfskill Family Collection
http://www.oac.cdlib.org/findaid/ark:/13030/c8736s83	Wolfskill (William) 1830-1855 Ledgers
http://www.oac.cdlib.org/findaid/ark:/13030/kt2489r6b2	Wolkoff (A. de.) typescript
http://www.oac.cdlib.org/findaid/ark:/13030/kt4r29r6h6	Wollenberg (Erich Julian) memoirs
http://www.oac.cdlib.org/findaid/ark:/13030/kt4b69p6b3	Wollman (William B.) collection of material about Calligraphy
http://www.oac.cdlib.org/findaid/ark:/13030/kt9000399h	Wolnosc i Niezawislosc miscellaneous records
http://www.oac.cdlib.org/findaid/ark:/13030/kt4h4nf5f4	Wolpe (Dr. Joseph) papers
http://www.oac.cdlib.org/findaid/ark:/13030/kt88700935	Wolper Productions Records
http://www.oac.cdlib.org/findaid/ark:/13030/kt400005vz	Wolpert (Stanley A.) Papers
http://www.oac.cdlib.org/findaid/ark:/13030/c8gx4csj	Wolt (Irene) papers
http://www.oac.cdlib.org/findaid/ark:/13030/kt0h4nd9bt	Wolter (Erich) correspondence
http://www.oac.cdlib.org/findaid/ark:/13030/tf9q2nb445	"Wolters (Henry &amp; Son : Stockton, Calif.) Collection"
http://www.oac.cdlib.org/findaid/ark:/13030/kt2t1nf1w8	Wolters (Maria) papers
http://www.oac.cdlib.org/findaid/ark:/13030/kt9j49s2fx	Wolverton (Terry) papers
http://www.oac.cdlib.org/findaid/ark:/13030/c8nk3fkd	Womack (Morris M.) Research Materials on J.P. Sanders
http://www.oac.cdlib.org/findaid/ark:/13030/c8dn45sp	Woman's Building records
http://www.oac.cdlib.org/findaid/ark:/13030/tf2290048t	"Woman's Christian Temperance Union (Duarte, Calif.) Records"
http://www.oac.cdlib.org/findaid/ark:/13030/kt1h4nf1rx	Woman's Institute for Continuing Jewish Education Collection
http://www.oac.cdlib.org/findaid/ark:/13030/c83779bq	A Woman's Place Bookstore Records
http://www.oac.cdlib.org/findaid/ark:/13030/kt4t1nf1vc	Women Against Violence Against Women (WAVAW) collection
http://www.oac.cdlib.org/findaid/ark:/13030/tf1v19n4tx	Women Against Violence in Pornography and the Media Records
http://www.oac.cdlib.org/findaid/ark:/13030/kt5290383s	Women and Health Videorecordings
http://www.oac.cdlib.org/findaid/ark:/13030/kt9b69s5dj	Women at Stanford Collection
http://www.oac.cdlib.org/findaid/ark:/13030/ft4p3003b9	Women Composers Collection
http://www.oac.cdlib.org/findaid/ark:/13030/c8fx7c6r	Women Composers Music Manuscripts Collection
http://www.oac.cdlib.org/findaid/ark:/13030/tf509nb0h3	Women for Legislative Action Collection
http://www.oac.cdlib.org/findaid/ark:/13030/kt6b69s0zg	Women For: Orange County Records
http://www.oac.cdlib.org/findaid/ark:/13030/c8qc050w	Women of the West Museum Institutional Archives
http://www.oac.cdlib.org/findaid/ark:/13030/c8z89fb7	Women on the Waterfront Oral History Project Collection
http://www.oac.cdlib.org/findaid/ark:/13030/kt2g5025kt	Women Veterans &amp; Civilian Support of S. C. Co. records
http://www.oac.cdlib.org/findaid/ark:/13030/kt7199r07h	Women's AIDS Network (WAN) Records
http://www.oac.cdlib.org/findaid/ark:/13030/kt896nf5h3	Women's Association Collection
http://www.oac.cdlib.org/findaid/ark:/13030/c8vt1tmx	Women's Athletic Association Records
http://www.oac.cdlib.org/findaid/ark:/13030/kt138nf33f	Women's Athletics at Stanford Collection
http://www.oac.cdlib.org/findaid/ark:/13030/kt0x0nf2f2	Women's Christian Temperance Union Records
http://www.oac.cdlib.org/findaid/ark:/13030/kt196nc4w7	Women's Council of the State University Collection
http://www.oac.cdlib.org/findaid/ark:/13030/tf509nb10t	"Women's Dormitory Association, University of California, Berkeley Records"
http://www.oac.cdlib.org/findaid/ark:/13030/kt0n39q1sk	Women's Employment Collection
http://www.oac.cdlib.org/findaid/ark:/13030/kt4m3nf2sh	Women's Heritage Museum/International Museum of Women Records
http://www.oac.cdlib.org/findaid/ark:/13030/kt167nd5pd	"Women's International League for Peace and Freedom, Auburn Branch Records"
http://www.oac.cdlib.org/findaid/ark:/13030/c8k35s1p	Women's International League for Peace and Freedom Collection
http://www.oac.cdlib.org/findaid/ark:/13030/kt500020nn	"Women's International League for Peace and Freedom, Los Angeles Chapter Records."
http://www.oac.cdlib.org/findaid/ark:/13030/kt9n39s2cj	Women's International League for Peace and Freedom Oral History Project Transcripts
http://www.oac.cdlib.org/findaid/ark:/13030/c8xg9rr3	Women's International League for Peace and Freedom (WILPF) Collection
http://www.oac.cdlib.org/findaid/ark:/13030/kt2x0nd66j	"Women's Opportunities Center Publications, University of California, Irvine"
http://www.oac.cdlib.org/findaid/ark:/13030/c8bp0244	"Women's Opportunities Center Videorecordings (University of California, Irvine)"
http://www.oac.cdlib.org/findaid/ark:/13030/tf1v19n4vf	Women's Press/Up Press Records
http://www.oac.cdlib.org/findaid/ark:/13030/kt7b69r7wp	Women's Regional Planning Club Records
http://www.oac.cdlib.org/findaid/ark:/13030/tf3779n689	Women's Relief Corps (Dept. of Calif &amp;amp; Nev.) Scrapbook
http://www.oac.cdlib.org/findaid/ark:/13030/c8c53jmg	Women's Resource Center Records
http://www.oac.cdlib.org/findaid/ark:/13030/kt4g5025t2	"Women's Resource Center (University of California, Irvine) records"
http://www.oac.cdlib.org/findaid/ark:/13030/c8db8390	Women's Rights Button Collection
http://www.oac.cdlib.org/findaid/ark:/13030/c89w0h0g	Women's Rights Poster Collection
http://www.oac.cdlib.org/findaid/ark:/13030/kt0q2nd9p9	Women's Rights Scrapbooks
http://www.oac.cdlib.org/findaid/ark:/13030/kt4j49r6fv	Women's Studies Department Records
http://www.oac.cdlib.org/findaid/ark:/13030/kt7s2027mt	Women's Suffrage Collection
http://www.oac.cdlib.org/findaid/ark:/13030/kt7779s0xm	The Wonderful World of Stanford Fund Raising
http://www.oac.cdlib.org/findaid/ark:/13030/kt1p3033js	Wonderland Award Submissions collection
http://www.oac.cdlib.org/findaid/ark:/13030/c82f7pxn	Wonderland in Green Collection
http://www.oac.cdlib.org/findaid/ark:/13030/c8pr7x78	Wong (Elizabeth) Papers
http://www.oac.cdlib.org/findaid/ark:/13030/kt7z09s5t2	Wong (Flo) Papers
http://www.oac.cdlib.org/findaid/ark:/13030/c8vt1tkg	Wong (Nellie) papers
http://www.oac.cdlib.org/findaid/ark:/13030/kt3k40340z	Woo (Q. S.) collection
http://www.oac.cdlib.org/findaid/ark:/13030/kt9z09s3k3	Wood (Benjamin de Kalbe) interview transcripts
http://www.oac.cdlib.org/findaid/ark:/13030/tf3199n96d	Wood California State Landmarks Advisory Committee Papers
http://www.oac.cdlib.org/findaid/ark:/13030/kt067nd77b	Wood (Carlos) Papers
http://www.oac.cdlib.org/findaid/ark:/13030/kt6v19r9rj	Wood (Casey A.) collection
http://www.oac.cdlib.org/findaid/ark:/13030/kt0k4032wh	Wood (E. Thomas) papers
http://www.oac.cdlib.org/findaid/ark:/13030/c8mp542f	Wood (Edith M.) of Long Beach Photograph album containing snapshots of California
http://www.oac.cdlib.org/findaid/ark:/13030/kt729027b3	Wood Family Papers and Medical Practice Records
http://www.oac.cdlib.org/findaid/ark:/13030/tf0j49n6x5	Wood (Fred B.) Papers
http://www.oac.cdlib.org/findaid/ark:/13030/tf9r29p04x	Wood (Harry O.) Papers
http://www.oac.cdlib.org/findaid/ark:/13030/c8zs2v6x	Wood (Henry Ellsworth) Papers
http://www.oac.cdlib.org/findaid/ark:/13030/kt6q2nf3mp	Wood (Hugh B.) papers
http://www.oac.cdlib.org/findaid/ark:/13030/tf5d5nb77z	"Wood (James Earl) Photograph Collection Relating to Filipinos in California, ca. 1929-1934"
http://www.oac.cdlib.org/findaid/ark:/13030/kt1h4nf36m	Wood (Margaret Spencer) papers
http://www.oac.cdlib.org/findaid/ark:/13030/c8np25x7	Wood (Raymund F.) Index File and Papers to Military Records of Spanish and Mexican Soldiers from 1769-1840
http://www.oac.cdlib.org/findaid/ark:/13030/c8zs2xtt	Wood (Raymund F.) Iskandar al-Magribi and the Memoirs of Cherif Soliman Collection
http://www.oac.cdlib.org/findaid/ark:/13030/tf2z09n8s9	Wood (Richard C.) - American Revolution Bicentennial Commission of California Papers
http://www.oac.cdlib.org/findaid/ark:/13030/tf9k4010bt	Wood (Richard C.) Papers
http://www.oac.cdlib.org/findaid/ark:/13030/c8gq6zdb	Wood (Tim) Erotica Collection
http://www.oac.cdlib.org/findaid/ark:/13030/tf9t1nb3k2	Wood (Will C.) Collection
http://www.oac.cdlib.org/findaid/ark:/13030/ft787006g4	Woodbridge (Charlotte Louise) Collection
http://www.oac.cdlib.org/findaid/ark:/13030/c87h1mpn	Woodbury (Jeanne) collection
http://www.oac.cdlib.org/findaid/ark:/13030/kt4b69q93c	Wooden (Wesley R.) Papers
http://www.oac.cdlib.org/findaid/ark:/13030/kt8s20156h	Woodfield (William R.) Papers
http://www.oac.cdlib.org/findaid/ark:/13030/c84b33dz	Woodhead (J.E.) collection of Roycroft Press and Elbert Hubbard materials
http://www.oac.cdlib.org/findaid/ark:/13030/kt3z09r83z	Woodhead (J.E.) papers
http://www.oac.cdlib.org/findaid/ark:/13030/c8hx1d7z	"Woodhead (William) Collection, 1860-1881"
http://www.oac.cdlib.org/findaid/ark:/13030/tf096n97bv	Wood-Kelly (Ann) Papers
http://www.oac.cdlib.org/findaid/ark:/13030/c8gh9jj7	Woodland city directory
http://www.oac.cdlib.org/findaid/ark:/13030/c8x068ss	Woodland Opera House Collection
http://www.oac.cdlib.org/findaid/ark:/13030/c8br8ss2	"Woodland-Davis, CA Polk city directory"
http://www.oac.cdlib.org/findaid/ark:/13030/kt6d5nf6d2	"Woodmen of the World, Applewood Camp No. 696, Records"
http://www.oac.cdlib.org/findaid/ark:/13030/kt7x0nf81x	Woodruff (Edwin Hamlin) Correspondence
http://www.oac.cdlib.org/findaid/ark:/13030/tf0m3nb0z6	Woodruff (Ennis C.) Papers
http://www.oac.cdlib.org/findaid/ark:/13030/c8q241gx	Woodruff (S.H.) album of photographs and renderings of homes in Hollywoodland
http://www.oac.cdlib.org/findaid/ark:/13030/c8k938r6	"Woodruff (S.H.) album of photographs relating to development of Hollywoodland and Dana Point, California"
http://www.oac.cdlib.org/findaid/ark:/13030/c81n82bq	"Woodruff (S.H.) community developer : Hollywoodland, Dana Point, California photograph album"
http://www.oac.cdlib.org/findaid/ark:/13030/c8tt4s6z	Woodruff (S.H.) Hollywoodland album of photographs of homes
http://www.oac.cdlib.org/findaid/ark:/13030/c81g0p4q	Woods (Earline) Photograph Collection
http://www.oac.cdlib.org/findaid/ark:/13030/kt858039gj	Woods (Eddie) papers
http://www.oac.cdlib.org/findaid/ark:/13030/kt9j49q65t	Woods Family Papers
http://www.oac.cdlib.org/findaid/ark:/13030/tf7q2nb60f	Woods (Jean M.) Collection
http://www.oac.cdlib.org/findaid/ark:/13030/c82z165w	"Woods (Rose Mary) Papers, White House Central Files, 1969-1974"
http://www.oac.cdlib.org/findaid/ark:/13030/tf387006bf	Woods (Virna) Collection
http://www.oac.cdlib.org/findaid/ark:/13030/kt1q2nf0gm	Woodside Country Club Collection
http://www.oac.cdlib.org/findaid/ark:/13030/kt4q2nf2gh	A Woodside reminiscence: as told by Grizzly Ryder / Cutler L. Bonestell
http://www.oac.cdlib.org/findaid/ark:/13030/kt6z09s2nq	Woodside-Atherton Garden Club Records
http://www.oac.cdlib.org/findaid/ark:/13030/kt3x0nf04c	Woodward (Ella) Notebook
http://www.oac.cdlib.org/findaid/ark:/13030/kt509nf2fq	Woodward (George Ratcliffe) Papers
http://www.oac.cdlib.org/findaid/ark:/13030/c8wd41ck	Woodworth Collection
http://www.oac.cdlib.org/findaid/ark:/13030/c8348kx0	Woodworth (Mrs. J.J.) Papers
http://www.oac.cdlib.org/findaid/ark:/13030/kt467nd7zf	Woodworth (S.E.) diary
http://www.oac.cdlib.org/findaid/ark:/13030/c87h1m88	Woody Allen collection of Brian Hamill photography
http://www.oac.cdlib.org/findaid/ark:/13030/kt0b69r5s0	Woody (Thomas) papers
http://www.oac.cdlib.org/findaid/ark:/13030/kt7d5nf3xp	Wooldridge (Jesse Walton) papers
http://www.oac.cdlib.org/findaid/ark:/13030/c8251hh5	Woolf (John E.) papers
http://www.oac.cdlib.org/findaid/ark:/13030/tf500003wg	Woolf (Leonard S.) Papers
http://www.oac.cdlib.org/findaid/ark:/13030/kt887037td	Woolf (Paul N.) photograph collection
http://www.oac.cdlib.org/findaid/ark:/13030/kt7j49r85m	Woolf (Virginia) Letters
http://www.oac.cdlib.org/findaid/ark:/13030/c8ng4r53	Woollett (Willam Lee) papers
http://www.oac.cdlib.org/findaid/ark:/13030/kt4f59r8sb	Woolley (Barry Lee) typescript
http://www.oac.cdlib.org/findaid/ark:/13030/k6w66hp0	Woolsey Family Papers
http://www.oac.cdlib.org/findaid/ark:/13030/tf0199n750	Woolsey (John H.) Papers
http://www.oac.cdlib.org/findaid/ark:/13030/tf2779n5v9	"Worcester (Joseph) Collection, 1899-1906"
http://www.oac.cdlib.org/findaid/ark:/13030/tf7d5nb2f8	Wores (Theodore) Papers
http://www.oac.cdlib.org/findaid/ark:/13030/kt4199r85d	Work (Hubert) miscellaneous papers
http://www.oac.cdlib.org/findaid/ark:/13030/tf4t1nb15b	Work Projects Administration (Calif.) Records
http://www.oac.cdlib.org/findaid/ark:/13030/kt0z09p33q	Work (Stuart A.) collection of material about automobile history
http://www.oac.cdlib.org/findaid/ark:/13030/kt7779s104	Work (Telford H) Notebook
http://www.oac.cdlib.org/findaid/ark:/13030/kt8p3036zm	Workers Party of the United States miscellaneous records
http://www.oac.cdlib.org/findaid/ark:/13030/kt9g5037z3	Working Group Records
http://www.oac.cdlib.org/findaid/ark:/13030/kt0489r6wq	Workman (family) albums
http://www.oac.cdlib.org/findaid/ark:/13030/c84j0gc0	Workman Family Collection
http://www.oac.cdlib.org/findaid/ark:/13030/kt8870232n	Workman Family Papers
http://www.oac.cdlib.org/findaid/ark:/13030/tf8199n9g3	Works (John D.) Papers
http://www.oac.cdlib.org/findaid/ark:/13030/tf0779n4gh	Works (John D.) Papers
http://www.oac.cdlib.org/findaid/ark:/13030/tf3580039t	Works Progress Administration Projects at the University of California
http://www.oac.cdlib.org/findaid/ark:/13030/c8mg7qwx	World Arts and Culture. Administrative files.
http://www.oac.cdlib.org/findaid/ark:/13030/kt329032z6	World Black and African Festival of Arts and Culture issuances
http://www.oac.cdlib.org/findaid/ark:/13030/kt6t1nf1v0	World Book Encyclopedia miscellaneous records
http://www.oac.cdlib.org/findaid/ark:/13030/c8wh2qjc	"World Conference on Faith and Order, 1910-1949: Papers on Microfilm Minutes and Correspondence"
http://www.oac.cdlib.org/findaid/ark:/13030/ft3d5nb02r	"World Conference on Women, Beijing Conference"
http://www.oac.cdlib.org/findaid/ark:/13030/tf5n39n7g4	World Council of Churches Collection
http://www.oac.cdlib.org/findaid/ark:/13030/kt8h4nc13c	World Institute on Disability Records
http://www.oac.cdlib.org/findaid/ark:/13030/kt1290325p	World Media Association. Opinion Leaders' Tour of Southern Africa issuances
http://www.oac.cdlib.org/findaid/ark:/13030/c8n58n4t	World Menu Collection
http://www.oac.cdlib.org/findaid/ark:/13030/kt700020vc	World Tour Photograph Album
http://www.oac.cdlib.org/findaid/ark:/13030/kt538nc6bv	World War I - U.S. Signal Corps Photograph Collection
http://www.oac.cdlib.org/findaid/ark:/13030/c8xg9rxb	World War I and II (Collection on)
http://www.oac.cdlib.org/findaid/ark:/13030/c89z96zd	World War I and II Ephemera Collection
http://www.oac.cdlib.org/findaid/ark:/13030/kt4v19r7qf	World War I and World War II Manuscript Collection
http://www.oac.cdlib.org/findaid/ark:/13030/kt1g5037rh	World War I Collection
http://www.oac.cdlib.org/findaid/ark:/13030/ft9h4nb4wm	World War I Collection of Material
http://www.oac.cdlib.org/findaid/ark:/13030/c8cv4ktv	World War I ephemera from Germany
http://www.oac.cdlib.org/findaid/ark:/13030/c8cv4gpt	World War I Manuscript Collection
http://www.oac.cdlib.org/findaid/ark:/13030/c8vm4d73	World War I Maps
http://www.oac.cdlib.org/findaid/ark:/13030/c8z89dp9	World War I pamphlets collection
http://www.oac.cdlib.org/findaid/ark:/13030/kt1p3017qd	World War I Photograph Album
http://www.oac.cdlib.org/findaid/ark:/13030/kt4w1026z7	World War I Pictorial Collection
http://www.oac.cdlib.org/findaid/ark:/13030/c83t9hsn	World War I Scrapbooks
http://www.oac.cdlib.org/findaid/ark:/13030/tf9t1nb3jj	World War I Soldiers File
http://www.oac.cdlib.org/findaid/ark:/13030/kt3j49s15f	World War I Stereograph Collection
http://www.oac.cdlib.org/findaid/ark:/13030/tf7v19n95c	World War I Subject Collection
http://www.oac.cdlib.org/findaid/ark:/13030/kt0c6009cg	"World War II - Philippines, New Guinea, Okinawa Photograph Collection"
http://www.oac.cdlib.org/findaid/ark:/13030/kt70001482	World War II - U.S. Forces in the Pacific Photograph Album
http://www.oac.cdlib.org/findaid/ark:/13030/kt9k4016m6	World War II Collection of Material
http://www.oac.cdlib.org/findaid/ark:/13030/c8639nfh	World War II Danish Resistance Literature Collection
http://www.oac.cdlib.org/findaid/ark:/13030/kt1h4nd0r0	World War II German Engineer Bridging Battalion Photograph Album
http://www.oac.cdlib.org/findaid/ark:/13030/kt3m3nd8m2	World War II German Manuscript Collection
http://www.oac.cdlib.org/findaid/ark:/13030/c8hh6j1p	World War II Manuscript Collection
http://www.oac.cdlib.org/findaid/ark:/13030/kt9h4nd5vf	World War II Pictorial Collection
http://www.oac.cdlib.org/findaid/ark:/13030/kt7p3013wx	World War II Project Papers
http://www.oac.cdlib.org/findaid/ark:/13030/kt2k403499	World War II Propaganda Collection
http://www.oac.cdlib.org/findaid/ark:/13030/kt0290316d	World War II San Diego State College Servicemen's Correspondence Collection
http://www.oac.cdlib.org/findaid/ark:/13030/tf838nb2nq	World War II subject collection
http://www.oac.cdlib.org/findaid/ark:/13030/c82j6dx0	World War II Survivors Oral History Project Collection
http://www.oac.cdlib.org/findaid/ark:/13030/kt0779p2wj	World War II U.S. Military Construction in Okinawa Photograph Album
http://www.oac.cdlib.org/findaid/ark:/13030/c8gt5kj7	World War Poster collection
http://www.oac.cdlib.org/findaid/ark:/13030/c85m6692	World War Posters Collection
http://www.oac.cdlib.org/findaid/ark:/13030/kt658020ck	World War Through The Stereoscope
http://www.oac.cdlib.org/findaid/ark:/13030/tf167n984w	World Without War Council Collection
http://www.oac.cdlib.org/findaid/ark:/13030/c84f1rjw	"World's Columbian Exposition Collection, 1893"
http://www.oac.cdlib.org/findaid/ark:/13030/c8z3206p	Worldwide Church of God Collection
http://www.oac.cdlib.org/findaid/ark:/13030/kt8p3037hc	Worley (Alfred Edward Thomas) Papers
http://www.oac.cdlib.org/findaid/ark:/13030/kt4f59r9hp	Wormser (Richard) interviews
http://www.oac.cdlib.org/findaid/ark:/13030/kt4d5nf2dh	Woronoff (Serge) letter
http://www.oac.cdlib.org/findaid/ark:/13030/kt5f59s03w	Woronzow-Daschkow (Graf Hilarion) collection
http://www.oac.cdlib.org/findaid/ark:/13030/kt1j49r2s5	"Worrell (Edward) A journal of a campaign through the south western and western prairies in the months of May and June, 1833"
