rel=cannonical	title
http://www.oac.cdlib.org/findaid/ark:/13030/kt7z09s5cb	Whigham (Thomas) collection on Paraguay
http://www.oac.cdlib.org/findaid/ark:/13030/kt7p3036z9	"Whitaker &amp; Baxter Campaigns, Inc. Records"
http://www.oac.cdlib.org/findaid/ark:/13030/kt1h4nf2cq	Whitaker (Douglas Merritt) Papers
http://www.oac.cdlib.org/findaid/ark:/13030/c81c1xhw	"Whitaker (John C.) Papers, White House Central Files, 1969-1973"
http://www.oac.cdlib.org/findaid/ark:/13030/kt8p3037c9	Whitaker (Robert W.) Collection
http://www.oac.cdlib.org/findaid/ark:/13030/c8sx6bk0	Whitaker (Virgil Keeble) Papers
http://www.oac.cdlib.org/findaid/ark:/13030/kt287034fd	Whitcomb (John M.) papers
http://www.oac.cdlib.org/findaid/ark:/13030/tf5199p0mb	White (Albert) Waiters' Union Collection
http://www.oac.cdlib.org/findaid/ark:/13030/tf0779n47w	"White Apron Club (Lodi, Calif.) Collection"
http://www.oac.cdlib.org/findaid/ark:/13030/kt5h4nf37c	White (Charles H.) papers
http://www.oac.cdlib.org/findaid/ark:/13030/kt958037mz	White (Christine) collection
http://www.oac.cdlib.org/findaid/ark:/13030/c8qz2bpj	White (Don Lee) Collection
http://www.oac.cdlib.org/findaid/ark:/13030/kt6r29s255	White (Don Lee) Collection 2008.04
http://www.oac.cdlib.org/findaid/ark:/13030/c8t72k6v	White (Ellis) Collection
http://www.oac.cdlib.org/findaid/ark:/13030/tf5b69n9kp	White Fathers Records
http://www.oac.cdlib.org/findaid/ark:/13030/tf796nb22x	White (Geoffrey) Papers
http://www.oac.cdlib.org/findaid/ark:/13030/tf6k40059b	White (George) Papers
http://www.oac.cdlib.org/findaid/ark:/13030/ft9k400872	White (Gerald T.) Papers
http://www.oac.cdlib.org/findaid/ark:/13030/c8t43tw2	White (Harry) Family Collection
http://www.oac.cdlib.org/findaid/ark:/13030/kt8s2037mk	White (Helen Hartley Greene) typescript
http://www.oac.cdlib.org/findaid/ark:/13030/kt1k4032wt	White (Henry) miscellaneous papers
http://www.oac.cdlib.org/findaid/ark:/13030/kt3h4nf4bs	White (Henry) Special Collection
http://www.oac.cdlib.org/findaid/ark:/13030/c8251h5p	White (Hortense Sacriste) Letters
http://www.oac.cdlib.org/findaid/ark:/13030/c8rv0pbq	"White House Conference on Aging Papers, White House Central Files, 1971-1972"
http://www.oac.cdlib.org/findaid/ark:/13030/kt6j49r12c	White House Conference on Child Health and Protection Records
http://www.oac.cdlib.org/findaid/ark:/13030/c8cj8f36	"White House Conference on Food, Nutrition and Health, White House Central Files, 1969-1971"
http://www.oac.cdlib.org/findaid/ark:/13030/c87s7pdx	"White House Executive Clerk Reading Papers, White House Central Files, 01/20/1969 - 08/09/1974"
http://www.oac.cdlib.org/findaid/ark:/13030/c8445n4p	"White House Gift Unit, White House Central Files, 1969-1974"
http://www.oac.cdlib.org/findaid/ark:/13030/c80c4wfd	"White House Press Office, White House Central Files, 1969-1974"
http://www.oac.cdlib.org/findaid/ark:/13030/c8sj1mcx	"White House Special Files, Administrative Files, White House Special Files, 1969-1974"
http://www.oac.cdlib.org/findaid/ark:/13030/c8sb4531	White (Howard A.) Papers
http://www.oac.cdlib.org/findaid/ark:/13030/kt5r29r89c	White (J. Gustav) typescript
http://www.oac.cdlib.org/findaid/ark:/13030/kt3n39q8fq	White (James L.) Papers
http://www.oac.cdlib.org/findaid/ark:/13030/c8nv9k1x	White (James) papers
http://www.oac.cdlib.org/findaid/ark:/13030/c8j967vz	White (Jules) papers
http://www.oac.cdlib.org/findaid/ark:/13030/kt4q2nf1sp	White (Lewis E) Papers and Memorabilia
http://www.oac.cdlib.org/findaid/ark:/13030/tf1489n73x	White (Lynn T.) Papers
http://www.oac.cdlib.org/findaid/ark:/13030/kt9489r136	White Mountain Research Station. Administrative Files
http://www.oac.cdlib.org/findaid/ark:/13030/kt7v19q655	White (Nelson H.) Papers
http://www.oac.cdlib.org/findaid/ark:/13030/kt1w1034jk	White (Raymond R.) Collection
http://www.oac.cdlib.org/findaid/ark:/13030/kt82904039	White (Robert J) Photograph Album
http://www.oac.cdlib.org/findaid/ark:/13030/c88k7c6r	White (Sam) papers
http://www.oac.cdlib.org/findaid/ark:/13030/c8x34z01	"White (Stephen M.) Ledger, 1892-1899"
http://www.oac.cdlib.org/findaid/ark:/13030/kt6779s03w	White (Stephen Mallory) Papers
http://www.oac.cdlib.org/findaid/ark:/13030/c85x27x4	White (Stephen Mallory) Scrapbooks
http://www.oac.cdlib.org/findaid/ark:/13030/ft9x0nb529	White (Steven M.) Papers?
http://www.oac.cdlib.org/findaid/ark:/13030/tf709nb29k	White (Stewart E.) Correspondence: Additions
http://www.oac.cdlib.org/findaid/ark:/13030/tf1t1n98vp	White (Stewart E.) Manuscripts
http://www.oac.cdlib.org/findaid/ark:/13030/kt3f59q11t	White (Terence) Collection
http://www.oac.cdlib.org/findaid/ark:/13030/kt9k40220d	White (Thomas P.) Papers
http://www.oac.cdlib.org/findaid/ark:/13030/c8k35t0n	White (Walter S.) papers
http://www.oac.cdlib.org/findaid/ark:/13030/tf5290042n	White (William A.) Letters
http://www.oac.cdlib.org/findaid/ark:/13030/c81g0nrc	White (William A.) Scrapbook
http://www.oac.cdlib.org/findaid/ark:/13030/kt287034hf	White (William Lindsay) typescript
http://www.oac.cdlib.org/findaid/ark:/13030/tf1w1001v3	Whitehead (Barry) Collection of Horse Prints: Breeder and Sportsman Horseman Magazine
http://www.oac.cdlib.org/findaid/ark:/13030/kt9489s15p	Whitehead (James H.) photograph collection
http://www.oac.cdlib.org/findaid/ark:/13030/c8tb17gz	Whitehead (Richard) Papers
http://www.oac.cdlib.org/findaid/ark:/13030/tf067nb0kw	Whitehead (Richard S.) Collection
http://www.oac.cdlib.org/findaid/ark:/13030/c8pv6m02	"Whiteley (Harold) design of an unidentified Beverly Hills, California store building"
http://www.oac.cdlib.org/findaid/ark:/13030/tf1199n4mk	Whiting (Billington C.) Papers
http://www.oac.cdlib.org/findaid/ark:/13030/kt4j49r7fb	Whiting (Charles Jonathan) papers
http://www.oac.cdlib.org/findaid/ark:/13030/c8tq62xd	Whiting (Randolph V.) Papers
http://www.oac.cdlib.org/findaid/ark:/13030/c8pg1sh5	"Whitley (H.J.) lands near Corcoran, California photograph album"
http://www.oac.cdlib.org/findaid/ark:/13030/kt658018n4	Whitley (Hobart J.) Papers
http://www.oac.cdlib.org/findaid/ark:/13030/kt009nd7k6	Whitlock (Brand) papers
http://www.oac.cdlib.org/findaid/ark:/13030/kt309nd9v7	Whitlock (Mary) Photographs
http://www.oac.cdlib.org/findaid/ark:/13030/c8m04603	Whitlock Metered Mailing Machine Collection
http://www.oac.cdlib.org/findaid/ark:/13030/c8m04620	"Whitman (Marina von Neumann) Papers, White House Central Files, 1971-1973"
http://www.oac.cdlib.org/findaid/ark:/13030/c8w959r5	Whitman-Radclyffe Foundation Collection
http://www.oac.cdlib.org/findaid/ark:/13030/ft4q2nb03j	Whitmore (William F.) Papers
http://www.oac.cdlib.org/findaid/ark:/13030/kt8m3nf6j2	Whitmore (William Francis) papers
http://www.oac.cdlib.org/findaid/ark:/13030/kt5r29r7k1	Whitney (Daniel) Papers
http://www.oac.cdlib.org/findaid/ark:/13030/kt7h4nc8vt	Whitney (Daniel S.) Papers
http://www.oac.cdlib.org/findaid/ark:/13030/kt5w1006x4	Whitney (Frances A.) Scrapbook
http://www.oac.cdlib.org/findaid/ark:/13030/kt129031nf	Whitney (Frederick C.) Papers
http://www.oac.cdlib.org/findaid/ark:/13030/tf5g500847	Whitsell (Leon O.) California History Scrapbooks
http://www.oac.cdlib.org/findaid/ark:/13030/c8bg2qj2	Whittaker (Barbara) scrapbooks
http://www.oac.cdlib.org/findaid/ark:/13030/kt1b69q44j	Whittier Public Library Historical Photograph Collection
http://www.oac.cdlib.org/findaid/ark:/13030/c8vd702z	Whittier Union High School elevation drawing
http://www.oac.cdlib.org/findaid/ark:/13030/c8tt4rmx	"Whittlesey (Charles) drawing of the Atchison, Topeka and Santa Fe Railway Co. Alvarado Hotel building"
http://www.oac.cdlib.org/findaid/ark:/13030/kt5199q3cz	Whittlesey (Enid C.) Papers
http://www.oac.cdlib.org/findaid/ark:/13030/tf7n39n9ms	Whole Earth Catalog Records
http://www.oac.cdlib.org/findaid/ark:/13030/kt1r29r6pv	Who's who of prominent Germans in the U.S.S.R. mimeograph
http://www.oac.cdlib.org/findaid/ark:/13030/kt6c6036mv	Wiasemsky (Prince Serge) miscellaneous papers
http://www.oac.cdlib.org/findaid/ark:/13030/kt2p3034pn	Wibberley (Leonard) papers
http://www.oac.cdlib.org/findaid/ark:/13030/kt9w10247z	Wickenden (Ida E.) Papers
http://www.oac.cdlib.org/findaid/ark:/13030/tf2h4n99nd	"Wickenden (JamesD.) Collection, 1915-1937"
http://www.oac.cdlib.org/findaid/ark:/13030/kt8k4036wx	Wickes (Mrs. Francis) collection
http://www.oac.cdlib.org/findaid/ark:/13030/kt767nf5bj	Wickett Family Collection
http://www.oac.cdlib.org/findaid/ark:/13030/kt5x0nf1gn	Wicklein (Edward C.) typescript
http://www.oac.cdlib.org/findaid/ark:/13030/kt5w103213	Wickman (Boyd E.) Papers
http://www.oac.cdlib.org/findaid/ark:/13030/tf8q2nb39z	Wickson (Edward J.) Papers
http://www.oac.cdlib.org/findaid/ark:/13030/kt7z09r3rm	Wickson (Edward J.) Papers
http://www.oac.cdlib.org/findaid/ark:/13030/kt8z09s295	Wide Awake Quicksilver Mine Records
http://www.oac.cdlib.org/findaid/ark:/13030/c8154hp7	Wide Open Town History Project Records
http://www.oac.cdlib.org/findaid/ark:/13030/c8db82ph	"Widney (Joseph P.) Collection, ca. 1880-1903"
http://www.oac.cdlib.org/findaid/ark:/13030/c8df6q5x	Widney (Joseph Pomeroy) Scrapbooks
http://www.oac.cdlib.org/findaid/ark:/13030/kt3m3nd0zc	Wiederhold (Kenneth L.) Papers
http://www.oac.cdlib.org/findaid/ark:/13030/tf987007kd	Wiegel (Robert L.) Term Papers Collection
http://www.oac.cdlib.org/findaid/ark:/13030/kt0d5nf0b8	Wieliczka (Zygmunt) mimeograph
http://www.oac.cdlib.org/findaid/ark:/13030/tf5779p11b	Wieners (John) Poetry manuscripts and photograph
http://www.oac.cdlib.org/findaid/ark:/13030/kt4j49q9kx	Wiesendanger (Dan) Diaries
http://www.oac.cdlib.org/findaid/ark:/13030/kt5s2035wt	Wiesinger (Otto) papers
http://www.oac.cdlib.org/findaid/ark:/13030/c8cv4k03	Wiggan (Elvira Davis) Photograph Collection
http://www.oac.cdlib.org/findaid/ark:/13030/tf8t1nb39m	Wiggin (Kate D.) - Notebooks and Workbooks
http://www.oac.cdlib.org/findaid/ark:/13030/kt1h4nd8jr	Wiggin (Kate D.) collection
http://www.oac.cdlib.org/findaid/ark:/13030/tf5779n7s5	Wiggins (Ira L.) Papers
http://www.oac.cdlib.org/findaid/ark:/13030/c80v8f4b	Wight Art Gallery. Exhibition files.
http://www.oac.cdlib.org/findaid/ark:/13030/kt6489r8zk	Wiig (Laurence Maxon) collection
http://www.oac.cdlib.org/findaid/ark:/13030/kt8t1nf5bs	Wijdeveld (H. Th.) graphic and architectural designs
http://www.oac.cdlib.org/findaid/ark:/13030/kt1z09r6nn	Wijngaert (Mark van den.) mimeograph
http://www.oac.cdlib.org/findaid/ark:/13030/tf2290027b	Wilbur (Curtis D.) Papers
http://www.oac.cdlib.org/findaid/ark:/13030/tf3g5002p0	Wilbur (Earl M.) Papers
http://www.oac.cdlib.org/findaid/ark:/13030/kt6n39s240	Wilbur (Ray L.) Papers
http://www.oac.cdlib.org/findaid/ark:/13030/tf1r29n4w9	Wilbur (Ray L.) Papers
http://www.oac.cdlib.org/findaid/ark:/13030/c82v2hn7	Wilbur (Ray Lyman) Personal Papers
http://www.oac.cdlib.org/findaid/ark:/13030/kt696nf3sn	Wilbur (Ray Lyman) Photographs
http://www.oac.cdlib.org/findaid/ark:/13030/kt5p3035kh	"Wilbur (Ray Lyman), President of Stanford University, Papers"
http://www.oac.cdlib.org/findaid/ark:/13030/kt238nf259	Wilcox (John Marsh) Papers
http://www.oac.cdlib.org/findaid/ark:/13030/kt987036nn	Wilcox (Wendell) diary
http://www.oac.cdlib.org/findaid/ark:/13030/kt829023mm	Wilcoxson (Jefferson) Papers
http://www.oac.cdlib.org/findaid/ark:/13030/kt4v19r0zp	Wildavsky (Aaron) Papers
http://www.oac.cdlib.org/findaid/ark:/13030/tf1w1002kf	Wildcat Creek Restoration Collection
http://www.oac.cdlib.org/findaid/ark:/13030/kt2c6011nt	Wilde (Irene) papers
http://www.oac.cdlib.org/findaid/ark:/13030/kt9w1038gz	Wilde (Oscar) and his Literary Circle Collection: Correspondence
http://www.oac.cdlib.org/findaid/ark:/13030/kt2p3031hm	Wilde (Oscar) and his Literary Circle Collection: Forgeries
http://www.oac.cdlib.org/findaid/ark:/13030/kt2t1nf18z	Wilde (Oscar) and his Literary Circle Collection: Manuscripts and Miscellaneous Materials
http://www.oac.cdlib.org/findaid/ark:/13030/kt867nf36t	Wilde (Oscar) and his Literary Circle Collection: Wildeiana
http://www.oac.cdlib.org/findaid/ark:/13030/c8qf8v6k	Wilder (Billy) papers
http://www.oac.cdlib.org/findaid/ark:/13030/kt758022wm	Wilder (Thornton N.) Papers
http://www.oac.cdlib.org/findaid/ark:/13030/kt909nf5bv	Wildman (Murray Shipley) miscellaneous papers
http://www.oac.cdlib.org/findaid/ark:/13030/c8gh9k82	Wildschut (William) Manuscript Collection
http://www.oac.cdlib.org/findaid/ark:/13030/c8sx6g8m	Wildy (Marion E.) Papers
http://www.oac.cdlib.org/findaid/ark:/13030/kt1w10243d	Wiley (Patricia S.) Rose Collection
http://www.oac.cdlib.org/findaid/ark:/13030/kt3h4nd3bv	Wilhelm (Gale) Papers
http://www.oac.cdlib.org/findaid/ark:/13030/kt7s203694	Wilhelm (Kathy) collection
http://www.oac.cdlib.org/findaid/ark:/13030/kt2j49r51j	Wilhelm (Paul) Collection
http://www.oac.cdlib.org/findaid/ark:/13030/kt5m3nf3wv	"Wilhelmsen, Finn (Mardi Gras Indian A/V collection)"
http://www.oac.cdlib.org/findaid/ark:/13030/kt009nf0xf	"Wilhelmsen, Finn (Mardi Gras Indian A/V collection)"
http://www.oac.cdlib.org/findaid/ark:/13030/tf9b69p379	Wilhoit (Roley E.) Business Ledgers
http://www.oac.cdlib.org/findaid/ark:/13030/c8kk9951	Wilke (William Hancock) Collection
http://www.oac.cdlib.org/findaid/ark:/13030/c80z742c	"Wilkie (George N.) (1879-1941) Collection, ca. 1905-1915"
http://www.oac.cdlib.org/findaid/ark:/13030/c8g73fcq	"Wilkinson (Charles B.) Papers, White House Central Files, 1969-1971"
http://www.oac.cdlib.org/findaid/ark:/13030/c8tb15bb	Wilkinson Collection of Library Postcards
http://www.oac.cdlib.org/findaid/ark:/13030/kt9p3040fq	Wilkinson (Ed) Collection
http://www.oac.cdlib.org/findaid/ark:/13030/tf0w1001d2	Wilkinson (Jean B.) Papers: Blacklisted Teachers in Los Angeles
http://www.oac.cdlib.org/findaid/ark:/13030/tf0489n4c9	Wilkinson (Warring) Papers
http://www.oac.cdlib.org/findaid/ark:/13030/c80003kc	Willard (T. A. [Theodore Arthur]) Collection
http://www.oac.cdlib.org/findaid/ark:/13030/kt5j49s0ks	Willcox (Mark) report
http://www.oac.cdlib.org/findaid/ark:/13030/tf5199n9tb	William and Lee Bell Collection of Scripts for Television Soap Operas
http://www.oac.cdlib.org/findaid/ark:/13030/k6g15xsg	William Byron Rumford papers
http://www.oac.cdlib.org/findaid/ark:/13030/c8h996vc	William C. Lynch Dennis Brain Collection
http://www.oac.cdlib.org/findaid/ark:/13030/kt4489r90z	William Edwin Rudge [Firm] Collection
http://www.oac.cdlib.org/findaid/ark:/13030/kt267nf17h	William Hewlett Memorial Service [videorecording]
http://www.oac.cdlib.org/findaid/ark:/13030/kt267nd9h2	"William II, German Emperor correspondence"
http://www.oac.cdlib.org/findaid/ark:/13030/kt3c6032z5	William J. Donovan Memorial Foundation records
http://www.oac.cdlib.org/findaid/ark:/13030/kt4k4034pm	William (Maurice) miscellaneous papers
http://www.oac.cdlib.org/findaid/ark:/13030/ft938nb5vz	William Penn Mott Jr. Memorial Fund Records
http://www.oac.cdlib.org/findaid/ark:/13030/c8sj1m57	William W. Hansen lecture notebooks
http://www.oac.cdlib.org/findaid/ark:/13030/kt5z09s08r	"Williams (Alfred C.) Records, 1926-1991, (bulk 1926-1948)"
http://www.oac.cdlib.org/findaid/ark:/13030/kt867nf6v3	Williams (Dora Moody) Papers
http://www.oac.cdlib.org/findaid/ark:/13030/c8z039c0	Williams (Dr. Robert J.) California State Normal Schools Collection
http://www.oac.cdlib.org/findaid/ark:/13030/tf058000z8	Williams (Earle E.) Papers
http://www.oac.cdlib.org/findaid/ark:/13030/tf438nb016	Williams (Earle E.) Tracy/Westside History Collection
http://www.oac.cdlib.org/findaid/ark:/13030/tf2t1n9954	Williams (Edward T.) Papers
http://www.oac.cdlib.org/findaid/ark:/13030/c8vq3426	Williams (Elmo) papers
http://www.oac.cdlib.org/findaid/ark:/13030/kt6h4nf454	Williams Family Papers
http://www.oac.cdlib.org/findaid/ark:/13030/tf7489p28d	Williams (Flossie) Letters
http://www.oac.cdlib.org/findaid/ark:/13030/kt0h4nc5dg	Williams (Frances E.) Papers
http://www.oac.cdlib.org/findaid/ark:/13030/kt838nf5wg	Williams (Frederick P.) Papers
http://www.oac.cdlib.org/findaid/ark:/13030/c8r78g0k	"Williams (Hanson A., Jr.) Collection of Photographs and Negatives"
http://www.oac.cdlib.org/findaid/ark:/13030/kt487037xq	Williams (Helen Carhart) Papers
http://www.oac.cdlib.org/findaid/ark:/13030/tf729007dw	Williams (J. Harold) Papers
http://www.oac.cdlib.org/findaid/ark:/13030/kt2580020q	Williams (James C.) Trade Catalog Collection
http://www.oac.cdlib.org/findaid/ark:/13030/c82f7kt2	Williams (James) Photographs
http://www.oac.cdlib.org/findaid/ark:/13030/c8j103sc	Williams (Juliene) papers
http://www.oac.cdlib.org/findaid/ark:/13030/c889180s	Williams (Larry) collection of scripts for medical and health related television programs
http://www.oac.cdlib.org/findaid/ark:/13030/kt2r29r6j3	Williams (Leon) Papers
http://www.oac.cdlib.org/findaid/ark:/13030/tf2j49n5x9	Williams (Mary W.) Papers
http://www.oac.cdlib.org/findaid/ark:/13030/tf7n39n9pt	Williams (Maud) Correspondence
http://www.oac.cdlib.org/findaid/ark:/13030/tf1g50021j	Williams (Milo B.) Papers
http://www.oac.cdlib.org/findaid/ark:/13030/c8br8v2g	Williams (Milo B.) Papers.
http://www.oac.cdlib.org/findaid/ark:/13030/kt967nf5b5	"Williams, Otho Clinton (1908-1997) Records"
http://www.oac.cdlib.org/findaid/ark:/13030/c8z60pn2	Williams (Paul Revere) drawings
http://www.oac.cdlib.org/findaid/ark:/13030/c8fb5289	Williams (Paula) papers
http://www.oac.cdlib.org/findaid/ark:/13030/c8vd71h6	Williams (Percy H.) collection
http://www.oac.cdlib.org/findaid/ark:/13030/kt3b69r8n9	Williams (Ray E.) Files on Newport Bay Environmental Issues
http://www.oac.cdlib.org/findaid/ark:/13030/kt1p30350g	Williams (Rhona) collection
http://www.oac.cdlib.org/findaid/ark:/13030/kt7000279g	Williams (Robert Parvin) Papers
http://www.oac.cdlib.org/findaid/ark:/13030/c8m90b44	"Williams (Robin M., Jr.) Papers"
http://www.oac.cdlib.org/findaid/ark:/13030/tf6779n7vh	Williams (Samuel T.) Papers
http://www.oac.cdlib.org/findaid/ark:/13030/kt7f59s14h	Williams (Spencer M.) papers
http://www.oac.cdlib.org/findaid/ark:/13030/kt8n39p1p2	Williams (Tennessee) papers
http://www.oac.cdlib.org/findaid/ark:/13030/kt5b69r96p	Williams (Thomas) collection
http://www.oac.cdlib.org/findaid/ark:/13030/kt729038hm	Williams (Thomas M) Papers
http://www.oac.cdlib.org/findaid/ark:/13030/c8765fwp	Williams (Wayne) papers
http://www.oac.cdlib.org/findaid/ark:/13030/kt2g5035ms	Williamson (Alan Bacher) Papers
http://www.oac.cdlib.org/findaid/ark:/13030/kt5q2nf46n	Williamson (Florence Kettles) Scrapbook
http://www.oac.cdlib.org/findaid/ark:/13030/c8tf00h5	"Williamson, (J.F.) Field Notebook"
http://www.oac.cdlib.org/findaid/ark:/13030/kt996nc21t	Willie Walker Erotica Collection
http://www.oac.cdlib.org/findaid/ark:/13030/kt5199r9qg	Willimont (Marie) typescript
http://www.oac.cdlib.org/findaid/ark:/13030/tf6v19n8pb	Willis (Bailey) Geological Formations Photographs
http://www.oac.cdlib.org/findaid/ark:/13030/kt167nf024	Willis (Bailey) Letter to Margaret Cosgrave
http://www.oac.cdlib.org/findaid/ark:/13030/kt8p30390k	Willis (Bailey) Papers
http://www.oac.cdlib.org/findaid/ark:/13030/kt0870314p	Willis (Bailey) papers
http://www.oac.cdlib.org/findaid/ark:/13030/tf0h4n97cp	Willis (Bailey) Papers
http://www.oac.cdlib.org/findaid/ark:/13030/kt3290331q	Willis (Benjamin C.) papers
http://www.oac.cdlib.org/findaid/ark:/13030/kt0j49r5vb	Willis (Edward Frederick) papers
http://www.oac.cdlib.org/findaid/ark:/13030/tf8h4nb2z0	Willis (Frances E.) Papers
http://www.oac.cdlib.org/findaid/ark:/13030/kt3r29r8zk	Willis (Julia) Papers
http://www.oac.cdlib.org/findaid/ark:/13030/kt2z09r6b9	Willis-Porter (R.) typescript
http://www.oac.cdlib.org/findaid/ark:/13030/kt4f59r8tv	Williston (Agnes L.) letters
http://www.oac.cdlib.org/findaid/ark:/13030/kt209nf202	Willits (John Metts) Papers
http://www.oac.cdlib.org/findaid/ark:/13030/kt638nf2ns	Willkie (Wendell L.) campaign speeches
http://www.oac.cdlib.org/findaid/ark:/13030/kt858015c5	Willkie (Wendell L.) Collection of Material
http://www.oac.cdlib.org/findaid/ark:/13030/tf2z09n5rb	Willoughby (Charles A.) papers
http://www.oac.cdlib.org/findaid/ark:/13030/kt8j49s35z	"Willoughby (Raymond Royce), ""The Inheritance of Intellectual Abilities"" Typescript"
http://www.oac.cdlib.org/findaid/ark:/13030/kt609nd57x	Willoughby (Wes) Papers
http://www.oac.cdlib.org/findaid/ark:/13030/kt587034xk	"The Willows Reading and Study Club Records, 1896-1980s"
http://www.oac.cdlib.org/findaid/ark:/13030/c8mg7q99	Wills (Madeline F.) Collection
http://www.oac.cdlib.org/findaid/ark:/13030/c88c9v0j	Wills (Madeline Frances) Collection
http://www.oac.cdlib.org/findaid/ark:/13030/tf009nb0hj	Wills (Ridley) Golden mean and other poems
http://www.oac.cdlib.org/findaid/ark:/13030/kt929009vj	Wills (William H.) Papers
http://www.oac.cdlib.org/findaid/ark:/13030/kt329002rr	Willsmore (Herbert) Papers
http://www.oac.cdlib.org/findaid/ark:/13030/kt8r29s3kg	Willson (Lawrence) Papers
http://www.oac.cdlib.org/findaid/ark:/13030/kt796nf302	Willson (William H.) processed volume
http://www.oac.cdlib.org/findaid/ark:/13030/tf7c6008rh	Willy (John) History Collection - Stockton (Calif.)
http://www.oac.cdlib.org/findaid/ark:/13030/tf5h4nb323	Wilshire Family Papers
http://www.oac.cdlib.org/findaid/ark:/13030/kt9z09r4f2	Wilson (Adrian) Papers
http://www.oac.cdlib.org/findaid/ark:/13030/kt958035w4	Wilson (Allan) Papers
http://www.oac.cdlib.org/findaid/ark:/13030/c89g5p9b	Wilson (Benjamin D.) Papers
http://www.oac.cdlib.org/findaid/ark:/13030/kt6m3nf6s2	Wilson (Benjamin Davis) Collection
http://www.oac.cdlib.org/findaid/ark:/13030/tf6g5004pw	Wilson (Carol G.) Papers
http://www.oac.cdlib.org/findaid/ark:/13030/kt867nf2jh	Wilson (Charis) Papers
http://www.oac.cdlib.org/findaid/ark:/13030/kt058033tb	Wilson (Charles Richard) Personal Collection
http://www.oac.cdlib.org/findaid/ark:/13030/kt6x0nf578	Wilson (Colin) papers
http://www.oac.cdlib.org/findaid/ark:/13030/c8j103wq	"Wilson (David G.) Papers, White House Special Files, 1971-1973"
http://www.oac.cdlib.org/findaid/ark:/13030/kt729036qr	Wilson (Donald E.) Earth Resources Survey Program Papers
http://www.oac.cdlib.org/findaid/ark:/13030/kt029023vr	"Wilson (Donna M.) Collection of Brazilian Slides by John S. Stiles, Jr."
http://www.oac.cdlib.org/findaid/ark:/13030/c8g44qw3	Wilson (Doric) Papers
http://www.oac.cdlib.org/findaid/ark:/13030/kt238nf2z6	Wilson (Edwin C.) Papers
http://www.oac.cdlib.org/findaid/ark:/13030/tf1b69n4q3	Wilson (Elmer E.) Collection
http://www.oac.cdlib.org/findaid/ark:/13030/c89w0g4v	Wilson (Francis W.) drawings
http://www.oac.cdlib.org/findaid/ark:/13030/kt3489q99v	Wilson (Hank) Papers
http://www.oac.cdlib.org/findaid/ark:/13030/kt6q2nf54d	Wilson (Harold N.) papers
http://www.oac.cdlib.org/findaid/ark:/13030/kt8z09p83m	Wilson (Harrison) Civil War Collection
http://www.oac.cdlib.org/findaid/ark:/13030/tf796nb2hn	Wilson (Harry L.) Papers
http://www.oac.cdlib.org/findaid/ark:/13030/tf5f59p1tj	Wilson (Henry L.) Papers
http://www.oac.cdlib.org/findaid/ark:/13030/kt7g503632	Wilson (Herbert Blair) papers
http://www.oac.cdlib.org/findaid/ark:/13030/kt838nf2sg	Wilson (Howard E.) papers
http://www.oac.cdlib.org/findaid/ark:/13030/kt267nf160	Wilson (Jessica Anna) Photograph Album
http://www.oac.cdlib.org/findaid/ark:/13030/c8ms3s2k	Wilson (John F.) Papers
http://www.oac.cdlib.org/findaid/ark:/13030/tf2g5002c1	Wilson (John) Papers
http://www.oac.cdlib.org/findaid/ark:/13030/tf958010d7	Wilson (John) Papers
http://www.oac.cdlib.org/findaid/ark:/13030/kt1w10336x	Wilson (Laurence L.) collection
http://www.oac.cdlib.org/findaid/ark:/13030/kt2p30243d	"Wilson (Lee) Papers, 1956-1989 (bulk 1961-1972)"
http://www.oac.cdlib.org/findaid/ark:/13030/c8z89fhg	Wilson (Lionel J.) Collection
http://www.oac.cdlib.org/findaid/ark:/13030/kt0v19r8nn	"Wilson, Michael G. Collection of Félicien Rops letters and other material."
http://www.oac.cdlib.org/findaid/ark:/13030/tf2w1005c3	Wilson (Michael) Papers
http://www.oac.cdlib.org/findaid/ark:/13030/ft158002gp	Wilson (Mortimer) Collection of silent film music compositions and arrangement
http://www.oac.cdlib.org/findaid/ark:/13030/tf7n39n9n9	Wilson (Neill C.) Papers
http://www.oac.cdlib.org/findaid/ark:/13030/tf3v19n6s0	Wilson (Orlando W.) Papers
http://www.oac.cdlib.org/findaid/ark:/13030/kt6g5013hm	Wilson Peace Trip Photograph Album
http://www.oac.cdlib.org/findaid/ark:/13030/kt9n39r9z8	Wilson (Philip Whitwell) writings
http://www.oac.cdlib.org/findaid/ark:/13030/kt8x0nf54b	Wilson (Ralph E.) papers
http://www.oac.cdlib.org/findaid/ark:/13030/kt3b69r784	Wilson (Raymond Davis) diaries
http://www.oac.cdlib.org/findaid/ark:/13030/kt6z09q352	Wilson (Richard A.) Papers
http://www.oac.cdlib.org/findaid/ark:/13030/tf7h4nb29v	Wilson (Richard C.) Papers
http://www.oac.cdlib.org/findaid/ark:/13030/kt209nd8pv	Wilson (Robert Carlton (Bob)) Papers
http://www.oac.cdlib.org/findaid/ark:/13030/c8qf8vnd	Wilson (Robert Curtis) Art Collection
http://www.oac.cdlib.org/findaid/ark:/13030/kt6w1038d0	Wilson (Robert) letter extracts
http://www.oac.cdlib.org/findaid/ark:/13030/c8862h1g	Wilson (Roy C.) papers
http://www.oac.cdlib.org/findaid/ark:/13030/kt438nf25x	Wilson (Samuel Graham) letter
http://www.oac.cdlib.org/findaid/ark:/13030/kt1v19p45w	Wilson (Thomas Joel) Files on Vietnamese Refugees
http://www.oac.cdlib.org/findaid/ark:/13030/kt8s20396b	Wilson (Virginia Perry) Collection on Jesse Stuart
http://www.oac.cdlib.org/findaid/ark:/13030/kt0x0nf01w	Wilson (Walter King) mimeograph
http://www.oac.cdlib.org/findaid/ark:/13030/kt5j49s2rb	Wilson (Warren A.) report
http://www.oac.cdlib.org/findaid/ark:/13030/kt62901349	Wilson (Woodrow) Framed Photograph
http://www.oac.cdlib.org/findaid/ark:/13030/tf438n99px	Wilson (Woodrow) Papers
http://www.oac.cdlib.org/findaid/ark:/13030/tf9n39p3gw	Wilson-McAdoo Collection
http://www.oac.cdlib.org/findaid/ark:/13030/kt2t1nf2wr	Wilton (Kenneth B.) and Ercoline (Alfred L.) Papers.
http://www.oac.cdlib.org/findaid/ark:/13030/kt338nf002	Winbigler (H. Donald) motion picture film collection
http://www.oac.cdlib.org/findaid/ark:/13030/tf629004g5	Winchell (L. A.) Collection
